base_type,type_,text,price
handphone-tablet,aksesoris-tablet,Tempered Glass Xiaomi Redmi Pad 10.61 inci Anti Gores Kaca,Rp37.500
handphone-tablet,aksesoris-tablet,Apple Pencil 2nd Gen iPad Pro 2021 M1 2020 / iPad Air Apple Pencil 2,Rp1.499.000
handphone-tablet,aksesoris-tablet,Holder hp jepit universal Dashboard mobil HD 22 Holder hp mobil 360,Rp12.900
handphone-tablet,aksesoris-tablet,DD05 DUX DUCIS Case iPad Air 3 iPad Pro 10.5 2017 Domo Series ORIGINAL,Rp149.000
handphone-tablet,aksesoris-tablet,Charger Google Pixel Fast Charging 18W USB-C - COD BDG,Rp140.000
handphone-tablet,aksesoris-tablet,ZOLA 3 in 1 OTG Type-C Lightning Micro USB Type C Android Iphone IPad,Rp129.900
handphone-tablet,aksesoris-tablet,Samsung Tab A7 Lite T225 Book Cover Case Keyboard Wireless Mouse Set,Rp68.000
handphone-tablet,aksesoris-tablet,Original ESR Urban Premium Case iPad Air 5 2021 Smart Cover Casing,Rp235.000
handphone-tablet,aksesoris-tablet,Tempered Glass REDMI NOTE 10s Ceramic Matte Anti Spy Gaming,Rp13.500
handphone-tablet,aksesoris-tablet,Oraimo charger Fast Charging firefly 3 Charger OCW-E66S + C53 type C,Rp45.000
handphone-tablet,aksesoris-tablet,CERAMIC Mate Temper Glass Anti Pecah OPPO A3S A5 / A9 2020 A15 A16 A54,Rp8.000
handphone-tablet,aksesoris-tablet,ROBOT KB10 KEYBOARD WiRELESS & BLUETOOTH Android iPad PC Multi Connec,Rp299.000
handphone-tablet,aksesoris-tablet,tempered glass tab a7 lite - anti gores kaca Samsung tab a7 lite T255,Rp16.500
handphone-tablet,aksesoris-tablet,XIAOMI Mi Pad MiPad 5 Flip Cover Hard Soft Case Back Acrylic Bening,Rp178.000
handphone-tablet,aksesoris-tablet,FLIP CASE LEATHER CASE MAGNETIC FLIP COVER HUAWEI MATEPAD T10S 10.1,Rp75.000
handphone-tablet,aksesoris-tablet,Apple Pencil Pen holder Pouch Stylus tempel,Rp50.000
handphone-tablet,aksesoris-tablet,Stylus Pen iPad Robot RSP100 Active Version like Pencil 2 Apple,Rp299.000
handphone-tablet,aksesoris-tablet,Flip Smart Cover Soft Case Softcase XIAOMI RedMi Pad 10.61,Rp95.000
handphone-tablet,aksesoris-tablet,Phone Bracket Tiang HD25 / HD-25 ADJUSTABLE DESKTOP STAND 360 Rotation,Rp7.150
handphone-tablet,aksesoris-tablet,BATOK CHARGER SAMSUNG USB - C (45 W) FAST CHARGING,Rp27.500
handphone-tablet,aksesoris-tablet,Kabel Data Original Realme 3 Pro Vooc Flash Charge Ori 100% Micro USB,Rp20.000
handphone-tablet,aksesoris-tablet,Leather Case Iphone 14 |Pro |Pro Max Flip Cover Wallet Casing Kulit,Rp129.000
handphone-tablet,aksesoris-tablet,TEMPERED GLASS BENING SAMSUNG A23 A13,Rp6.000
handphone-tablet,aksesoris-tablet,Apple iPad 10 2022 Clear TPU Bening Soft Case,Rp22.000
handphone-tablet,aksesoris-tablet,Stylus Pen ROBOT RSP01 Universal 2in1 Capacitipe,Rp58.000
handphone-tablet,aksesoris-tablet,IPAD PRO M2 2022 11 / 12.9 INCH TEMPERED GLASS CAMERA LENS PROTECTOR,Rp25.000
handphone-tablet,aksesoris-tablet,Case Casing Cover Pelidnung Apple Magic Mouse 1 2 Silikon Transparan,Rp40.000
handphone-tablet,aksesoris-tablet,MAXFEEL Tempered glass 3D UV Full Glue Samsung S22 Ultra S22 Plus,Rp88.000
handphone-tablet,aksesoris-tablet,6 in1 Card reader Type-C+Android+TF+SD+USB mobile computer OTG adapter,Rp38.950
handphone-tablet,aksesoris-tablet,flip case VIVO Y20 / Y20S / Y21 / Y21S / Y30 / flip dompet kulit hp,Rp21.000
handphone-tablet,aksesoris-tablet,Apple Pencil 2 (2nd Generation) for iPad,Rp1.683.000
handphone-tablet,aksesoris-tablet,Apple Pencil Gen 2 Mulus Like New Istimewa,Rp1.550.000
handphone-tablet,aksesoris-tablet,stylus note 9 SAMSUNG S Pen Galaxy Note 9 Original,Rp259.000
handphone-tablet,aksesoris-tablet,HOUSING BACK CASING BACKDOOR COVER FULLSET + BEZEL OPPO A53 / A33 2020,Rp70.000
handphone-tablet,aksesoris-tablet,Tempered Glass Anti Gores Garmin Venu 2 Plus AMOLED Screen Guard Gel,Rp50.000
handphone-tablet,aksesoris-tablet,PAKET ANTI GORES DEPAN DAN BELAKANG LAPTOP,Rp250.000
handphone-tablet,aksesoris-tablet,SMART CASE IPAD 1 2 3 4 NEW COVER ORIGINAL SOFTCASE ipad2 ipad3 ipad4,Rp135.000
handphone-tablet,aksesoris-tablet,Sambungan Flashdisk ke HP / Sambungan Type C ke USB / OTG Type C,Rp5.500
handphone-tablet,aksesoris-tablet,Oxyguard Premium HD Tempered Glass Ipad Pro 11 inch 2022/ 21 Air 2022,Rp150.000
handphone-tablet,aksesoris-tablet,"Case iPad Pro 11"" (M1/2020) Nillkin Bevel Smart Cover Magnetic Flip",Rp259.000
handphone-tablet,aksesoris-tablet,TEMPERED GLASS ANTI GORES KACA IPAD 9 10.2 2021,Rp50.000
handphone-tablet,aksesoris-tablet,MCDODO OT-8600 OTG Adapter Usb A 3.0 To lightning Data Transmission,Rp47.500
handphone-tablet,aksesoris-tablet,ESR Classic Hybrid Case iPad Mini 6 (2021) Crystal Clear,Rp125.000
handphone-tablet,aksesoris-tablet,"Magnetic iPad Case Detachable Acrylic Case iPad Mini 6, iPad Air 4 / 5",Rp189.000
handphone-tablet,aksesoris-tablet,Anti Gores Temper Tempered Glass iPhone 13 Pro Hikaru Full Cover,Rp29.999
handphone-tablet,aksesoris-tablet,Tempered Glass Guard Screen Protector iPad 7 / 8 / 9 10.2 inch,Rp199.000
handphone-tablet,aksesoris-tablet,"Tempered Glass Anti Spy Samsung Galaxy A51 (6.5"") | Anti Gores Screen",Rp24.900
handphone-tablet,aksesoris-tablet,Case iPhone X Xs XR Xs Max Soft Silicone Ring TPU Microfiber,Rp53.500
handphone-tablet,aksesoris-tablet,Refill Tip Nib Stylus S Pen Galaxy Tab S7 S7 Fe S7 Plus,Rp39.000
handphone-tablet,aksesoris-tablet,Ibywind Clear TPU Screen Protector Xiaomi 12,Rp100.000
handphone-tablet,aksesoris-tablet,New Hikaru - Full Cover Tempred Glass Black Realme 8/Realme 8 Pro,Rp35.000
handphone-tablet,aksesoris-tablet,BACKDOOR FOR IPHONE 11 PRO BACK GLASS,Rp55.000
handphone-tablet,aksesoris-tablet,iPad Mini 6 Case Armor Full Body Cover Stand Kids Pen Holder Military,Rp245.000
handphone-tablet,aksesoris-tablet,Tablet Screen Protector / Anti Gores HYDROGEL 8 10 11 inch,Rp69.000
handphone-tablet,aksesoris-tablet,Vivo Y50 Y30i Y30 Case Flip Cover Case Leather Wallet Sarung Vivo Y30,Rp25.000
handphone-tablet,aksesoris-tablet,Tempered Glass Samsung A33 5G Anti Gores Matte Anti Glare Full Layar,Rp13.500
handphone-tablet,aksesoris-tablet,"Monocozzi Lucid Folio Case Shock Resistant new iPad Pro 10.5 inch 10,5",Rp200.000
handphone-tablet,aksesoris-tablet,ANTI SPY TEMPER GLASS IPHONE 7 6 PLUS 7 PLUS 11 12 12 MINI 12 PRO MAX,Rp15.000
handphone-tablet,aksesoris-tablet,Flip Cover Kulit Samsung Galaxy J7 2016 CORE PRIME Case Dompet Casing,Rp22.000
handphone-tablet,aksesoris-tablet,Tecnix CMH-018 Car Holder Universal 360° Mobile Phone Stand,Rp36.000
handphone-tablet,aksesoris-tablet,Case iPad Pro 11 (2022/2021/2020) Spigen Smart Fold Stand Flip Cover,Rp375.000
handphone-tablet,aksesoris-tablet,CASING ARMOR STRAP STANDING COVER IPAD 9 10.2 inch 2021,Rp225.000
handphone-tablet,aksesoris-tablet,Samsung Tab A8 10.5 2022 X205 Smart Stylus Pen Tablet Pencil Drawing,Rp199.000
handphone-tablet,aksesoris-tablet,SAMSUNG Z FOLD 3 Hydrogel Matte Anti Spy Privacy Screen Protector,Rp169.000
handphone-tablet,aksesoris-tablet,"Tempered Glass iPad Mini 4/5 - Mini 6 8.3"" AntiGores Screen Protector",Rp40.500
handphone-tablet,aksesoris-tablet,Keyboard Bluetooth iPad 10 2022 10.9 inch 10th Gen TK Series - DD,Rp499.000
handphone-tablet,aksesoris-tablet,Lazy Neck Phone Holder Leher / Lazypod Hp Leher Flexible,Rp10.000
handphone-tablet,aksesoris-tablet,CHARGER OPPO 18W USB TIPE C A52 A53 A92 FAST CHARGING ORIGINAL 100%,Rp50.000
handphone-tablet,aksesoris-tablet,Apple pencil 1 & 2 1st 2nd gen ipad mini 6 5 pro 11 12.9 m1 air 4 2021,Rp1.650.000
handphone-tablet,aksesoris-tablet,SAMSUNG GALAXY TAB A7 LITE T220 T225 2021 FLIP COVER FLIPCASE,Rp65.000
handphone-tablet,aksesoris-tablet,Kabel Data Xiaomi Redmi MICRO USB 2A Fast Charging,Rp3.500
handphone-tablet,aksesoris-tablet,INBEX Tripod Stand 70CM Phone Mount Holder Selfie Stick+26cm Ringlight,Rp59.000
handphone-tablet,aksesoris-tablet,Anti Gores iPad Pro 12.9 ESR Paper Feel - 1 Pack,Rp184.900
handphone-tablet,aksesoris-tablet,USB C Digital AV Multiport Adapter Original Apple,Rp1.199.000
handphone-tablet,aksesoris-tablet,"FROSTED BACK CASE REALME PAD MINI 8.7"" PREMIUM BUMPER SOFTCASE",Rp36.500
handphone-tablet,aksesoris-tablet,FS Bluemoon Leather Flip Case - Samsung Galaxy Tab A8 10.5 (2022) X205,Rp85.000
handphone-tablet,aksesoris-tablet,BASEUS 4 IN 1 CHARGER 100W GaN 3 PRO FAST CHARGE ADAPTOR USB TYPE C,Rp789.000
handphone-tablet,aksesoris-tablet,Paper Like Samsung Galaxy Tab S7+ | S7 FE 12.4 Screen Protector Matte,Rp60.000
handphone-tablet,aksesoris-tablet,Case iPad Pro 11 (2022/2021/2020) Spigen Air Skin Hybrid S Clear Stand,Rp346.002
handphone-tablet,aksesoris-tablet,CASING OPPO A17 TERBARU SILIKON KULIT LEATHER SOFT CASE HANSPHONE,Rp15.000
handphone-tablet,aksesoris-tablet,Case Xiaomi Mi Pad 5 Nillkin Bumper Pro Flip Camera Cover Casing,Rp310.000
handphone-tablet,aksesoris-tablet,IPHONE 11 / 11 PRO SOFT CASE CASING COVER KULIT LEATHER MAGNET STAND,Rp105.000
handphone-tablet,aksesoris-tablet,OPPO SUPERVOOC Car Charger 80W Fast Charging Original 100%,Rp399.000
handphone-tablet,aksesoris-tablet,Taffware Keyboard Bluetooth Wireless Rechargeable,Rp51.900
handphone-tablet,aksesoris-tablet,Apple iPad Mini 1 2 3 4 5 Sarung Keyboard Bluetooth Book Case,Rp117.500
handphone-tablet,aksesoris-tablet,Case iPad Pro 11 Inch 2022 M2 Spigen Urban Fit Folio Stand Slim Casing,Rp495.000
handphone-tablet,aksesoris-tablet,PRO Carbon Case iPhone 14 PRO MAX PLUS Hard Casing Matte Transparan,Rp73.000
handphone-tablet,aksesoris-tablet,Smart Case iPad Pro 11 M2 2022 M1 2021 2020 Silikon with Slot Pencil,Rp105.000
handphone-tablet,aksesoris-tablet,Lazypod Leher dan Pinggang / Holder HP Lazy Hanging Neck Cell Stand,Rp15.000
handphone-tablet,aksesoris-tablet,Book Cover TPU Samsung Galaxy Tab A8 10.5 2022 / X205 Bahan Softshell,Rp80.000
handphone-tablet,aksesoris-tablet,Bahan Xtra Hydrogel Clear Film For Laptop Tablet IPad 15 inch,Rp40.000
handphone-tablet,aksesoris-tablet,Soft Case iPad 5 6 7 8 9 Pro 11 Pro 12.9 Air 1 2 3 4 Mini 1 2 3 4 5 6,Rp57.500
handphone-tablet,aksesoris-tablet,Oppo Reno 7 4G Flip Wallet Caseme Leather Case Cover Sarung Kulit,Rp85.000
handphone-tablet,aksesoris-tablet,Mini Keyboard NYK Bluetooth BT 90 BLACK,Rp91.999
handphone-tablet,aksesoris-tablet,Book cover keyboard slim original tab s7+|s7+5G|s7 FE 5G resmi SEIN,Rp1.799.000
handphone-tablet,aksesoris-tablet,ADAPTOR KEPALA CHARGER REALME 30W FAST CHARGING ORIGINAL 100% 30W,Rp50.000
handphone-tablet,aksesoris-tablet,Converter Lightning Female to Female untuk Charger Apple Pencil,Rp50.000
handphone-tablet,aksesoris-tablet,SAMSUNG A03S/A03 CORE/A10/A10E/A10S ANTI GORES ANTI MINYAK,Rp4.500
handphone-tablet,aksesoris-tablet,SAMSUNG Stylus S Pen Galaxy Tab S7 S7+ S7 Plus Original 100%,Rp385.000
handphone-tablet,aksesoris-tablet,Mobile Pad Phone Stand Holder Unitech K322 Dudukan Hp Tablet,Rp29.000
handphone-tablet,aksesoris-tablet,iPad mini 6 2021 Case with Pencil Holder Transparent Air Protection,Rp99.000
handphone-tablet,aksesoris-tablet,Tempered Glass Samsung Tab S8 Plus | Tab S8 ultra - Dux Ducis Premium,Rp130.000
handphone-tablet,aksesoris-tablet,CHANGER SAMSUNG GALAXY S20 ULTRA 45WATT FAST CHARGING C TO C 100%,Rp87.500
handphone-tablet,aksesoris-tablet,CASE IPAD MINI 4 FLIP COVER LEATHER SMART COVER STANDING,Rp115.000
handphone-tablet,aksesoris-tablet,Samsung Note 8 Note 9 Tempered Glass CERAMIC MATTE ANTI MINYAK,Rp22.500
handphone-tablet,aksesoris-tablet,Case Ipad Mini 6 2021 8.3 Inch Case XUNDD Design Crystal Casing,Rp130.000
handphone-tablet,aksesoris-tablet,KURA Flat Casing - Soft Case iPhone 11 Pro Max,Rp14.000
handphone-tablet,aksesoris-tablet,C142 Iphone 14 / 14 Plus / 14 Pro Max Matte Case UltraThin + Lens,Rp10.000
handphone-tablet,aksesoris-tablet,Screen Protector Hydrogel Rockspace MATTE untuk Semua Model HP,Rp35.000
handphone-tablet,aksesoris-tablet,Case Xiaomi Redmi Pad - Dux Ducis DOMO Cover Casing,Rp149.000
handphone-tablet,aksesoris-tablet,Case Casing Anya Spy family SEMUA TIPE HP Oppo Vivo Samsung dan lain,Rp32.500
handphone-tablet,aksesoris-tablet,SONY XPERIA XA XZ2 XZ3 ANTI GORES JELLY HYDROGEL DEPAN BELAKANG CLEAR,Rp14.900
handphone-tablet,aksesoris-tablet,flip case samsung J2 prime / J5 prime / J7 prime flip dompet kulit hp,Rp21.000
handphone-tablet,aksesoris-tablet,Active Stylus Pen Asus SA200H for Transfomer Vivobook Zenbook Original,Rp799.000
handphone-tablet,aksesoris-tablet,Flip Book Cover Silicone Samsung Galaxy Tab A7 Lite 8.7inch T220/T225,Rp85.000
handphone-tablet,aksesoris-tablet,Smartcase ipad mini 1 2 3 4 5 6 sarung flip cover case tpu slot pen,Rp23.500
handphone-tablet,aksesoris-tablet,Original HP Active Stylus Pen For HP Envy Pavilion Spectre X360 etc,Rp549.000
handphone-tablet,aksesoris-tablet,Phone Stand Mini F1 Folding Holder Dudukan Penyangga Hp Tablet Lipat,Rp1.999
handphone-tablet,aksesoris-tablet,Case Infinity / Casing Infinity,Rp57.500
handphone-tablet,aksesoris-tablet,Carger Charger Cassan Infinix Micro Usb XCU32 Asli Original 100%,Rp40.000
handphone-tablet,aksesoris-tablet,Case Samsung Galaxy A04 A04e Premium Clear Anti Crack Anti Jamur,Rp24.500
handphone-tablet,aksesoris-tablet,Tempred Glass Matte Fingerprint / Antigores Anti Minyak iPhone 13,Rp50.000
handphone-tablet,aksesoris-tablet,Car Holder Magnetic Dudukan Handphone Tempelan Magnet HP Mount Mobil,Rp12.900
handphone-tablet,aksesoris-tablet,S pen stylus samsung note 5 ori,Rp35.000
handphone-tablet,aksesoris-tablet,Casing Softcase Airpods Gen 1 2 3 Pro Model Anjing Corgi Lucu,Rp55.000
handphone-tablet,aksesoris-tablet,CHARGER ADAPTOR APPLE IPHONE FOR 12/13/14 Series 20W - ORIGINAL TAM,Rp400.000
handphone-tablet,aksesoris-tablet,"TOTU iPad 9 2021 10.2"" Smart Case TPU dengan Pencil Slot Flip Case",Rp109.000
handphone-tablet,aksesoris-tablet,Tempered Glass Ibywind Samsung Galaxy S20 FE,Rp99.000
handphone-tablet,aksesoris-tablet,Vivan VAL01 Splitter Converter IPhone Lightning to Aux 3.5mm,Rp88.000
handphone-tablet,aksesoris-tablet,Puff Case Bantalan Luxury iPhone Pillow Case iPhone Puffer Case (1),Rp24.900
handphone-tablet,aksesoris-tablet,Ipad AIR / 5 / 6 Anti GLARE DOFF MATTE Anti Fingerprint Tempered Glass,Rp80.000
handphone-tablet,aksesoris-tablet,Hippo OTG-02 Konektor USB Type C To USB A 2.0 OTG Converter,Rp25.000
handphone-tablet,aksesoris-tablet,OPPO A96 Tempered Glass Anti Gores FULL CERAMIC Matte PRIVACY SPY Anti,Rp16.500
handphone-tablet,aksesoris-tablet,New Ipad Mini 5 Ipad Mini 4 XUNDD Original Soft Case TPU Bumper Armor,Rp130.000
handphone-tablet,aksesoris-tablet,Apple iPad Mini 1 2 3 4 5 Smart Cover Stylus Flip Case,Rp75.000
handphone-tablet,aksesoris-tablet,Robot KB10 Multi-Device Bluetooth & Wireless Keyboard 3 Device Connect,Rp269.000
handphone-tablet,aksesoris-tablet,Tempered Glass Iphone 6 6S 6G 6PLUS 6SPLUS 7 7PLUS PLUS anti gores,Rp39.000
handphone-tablet,aksesoris-tablet,Adapter Charger Baseus 65W Gan 2 Lite USB C & USB OUTPUT Dual Charging,Rp285.000
handphone-tablet,aksesoris-tablet,Stylus Pen Universal Baseus Household Pen Stylus 2in1 Original,Rp94.000
handphone-tablet,aksesoris-tablet,Adapter iPhone Lightning to Jack 3.5 MM Splitter,Rp32.000
handphone-tablet,aksesoris-tablet,Samsung Galaxy Tab S5e T725 Bluemoon Flip Cover Tablet Case,Rp65.000
handphone-tablet,aksesoris-tablet,MCDODO IPHONE OTG WITH LIGHTNING CHARGER PORT SUPPORT HDD/SSD MAX 2 TB,Rp125.000
handphone-tablet,aksesoris-tablet,Batok Charger Adaptor Gepeng Kaki 2 iPhone 4 4s 5 5s 6 6+ Ori 99,Rp13.000
handphone-tablet,aksesoris-tablet,Case Cover iPad Pro 12.9 11 Inch M2 2022 M1 2021 2020 Casing Softcase,Rp165.000
handphone-tablet,aksesoris-tablet,IPAD 2 3 4 5 JELLY CASE ULTRATHIN CASING SOFTCASE TPU PREMIUM,Rp24.900
handphone-tablet,aksesoris-tablet,Case Samsung Tab S6 Lite 10.4 P615 P610 Flip Cover Kulit OEM Magnetic,Rp60.000
handphone-tablet,aksesoris-tablet,Samsung Note 20 Ultra C002 CASEON FLIP LEATHER CASE HORSE SERIES,Rp80.750
handphone-tablet,aksesoris-tablet,iPhone 14 | 14 Max | 14 Pro | 14 Promax Anti Gores Hydrogel CLEAR Back,Rp30.000
handphone-tablet,aksesoris-tablet,Nillkin Bumper Pro Leather Flip Case Samsung Tab S7 S8 S8 Plus S7 Plus,Rp340.000
handphone-tablet,aksesoris-tablet,ANTIGORES PREMIUM HYDROGEL FULLSCREEN GUARD IPHONE 14 PLUS PRO MAX,Rp48.500
handphone-tablet,aksesoris-tablet,Xiaomi Mi Charger 20W Port Type C ( Original 100% ),Rp89.000
handphone-tablet,aksesoris-tablet,KABEL CHARGER 3 IN 1 FAST CHARGING KABEL CAS TYPE C MICRO USB PHONE,Rp45.000
handphone-tablet,aksesoris-tablet,Ibywind Rog Phone 5 / 5 Pro / 5 Ultimate Temperglass untuk,Rp99.000
handphone-tablet,aksesoris-tablet,Holder Meja NB HD23 tempat senderan dudukan stand hp phone,Rp7.350
handphone-tablet,aksesoris-tablet,Case iPad Air 4/ 5 10.9 2022/2020 Spigen Tough Armor Pro Stand Casing,Rp425.000
handphone-tablet,aksesoris-tablet,UAG Metropolis iPad mini 2/3/4/5 inch Bookcover Standing Case iPad UAG,Rp150.000
handphone-tablet,aksesoris-tablet,TC Charger VIVO V23 5G 44W Original FAST Charging USB Micro/ Tipe C,Rp32.500
handphone-tablet,aksesoris-tablet,Leather Case iPad Pro 11 ESR Ascend Trifold with Clasp Flip,Rp229.000
handphone-tablet,aksesoris-tablet,Huawei M-Pencil Stylus 2nd Generation For Matepad 11 Garansi Resmi,Rp1.209.000
handphone-tablet,aksesoris-tablet,Folding Desktop Holder Stand HP Lipat Anti Slip Besi Aluminium Berat,Rp32.500
handphone-tablet,aksesoris-tablet,Sarung ipad tablet karakter CS08 tas sleeve bear,Rp75.000
handphone-tablet,aksesoris-tablet,iPad Mini 4 5 / Case iPad Mini 4 5 / Casing Flip Cover Leather Rotary,Rp19.900
handphone-tablet,aksesoris-tablet,Hardcase Samsung Galaxy Tab A8 10.5 2022 X205 Robot Strap Shockproof,Rp192.000
handphone-tablet,aksesoris-tablet,HP Stylus Active Pen,Rp499.000
handphone-tablet,aksesoris-tablet,Nillkin Screen Protector AR Like Paper iPad 9.7 10.2 Pro 11 12.9 Mini,Rp270.000
handphone-tablet,aksesoris-tablet,"Temper Glass Samsung Tab A8 10.5"" 2022 X200 X205 Anti Gores Kaca",Rp22.116
handphone-tablet,aksesoris-tablet,Keyboard Cover Case Samsung Galaxy Tab A8 2022 10.5 Wifi X200 LTE X205,Rp399.000
handphone-tablet,aksesoris-tablet,Wall Charger Anker PowerPort III 20W PD Android Iphone Type C,Rp152.000
handphone-tablet,aksesoris-tablet,KABEL DATA OPPO VOOC USB TIPE C ORIGINAL 100% KABEL OPPO VOOC TIPE C,Rp17.500
handphone-tablet,aksesoris-tablet,"Case iPad 9 | 8 | 7 10.2"" Flip Cover Rotating 360 Leather Book Casing",Rp69.000
handphone-tablet,aksesoris-tablet,Softcase Iphone 13 Pro Max OEM Apple Silicone Case,Rp59.800
handphone-tablet,aksesoris-tablet,Adapter Anker Charger 20W Powerport III PD IQ 3.0 USB Type C,Rp125.000
handphone-tablet,aksesoris-tablet,TORCH Choho Charger Pack,Rp126.650
handphone-tablet,aksesoris-tablet,Pelindung Layar bahan Tempered glass Apple ipad 7 8 Mini 5 Air 3 4,Rp60.000
handphone-tablet,aksesoris-tablet,Case iPad Air 3 2019 / Pro 10.5 Dux Ducis Domo Series Cover Casing,Rp150.000
handphone-tablet,aksesoris-tablet,"Skinarma HADAKA TSUIKA, Black - Case / Casing iPhone 13 /Pro / Pro Max",Rp273.000
handphone-tablet,aksesoris-tablet,Smart Case Book Cover untuk Samsung Tab S6 Lite model Original Magnet,Rp150.000
handphone-tablet,aksesoris-tablet,Universal Case Cover Casing Tablet 7 Inch - Coklat,Rp10.000
handphone-tablet,aksesoris-tablet,flip case samsung A02 / A02s / A03s / A11 / A12 flip dompet kulit hp,Rp21.000
handphone-tablet,aksesoris-tablet,Charger PD 20W iPhone 11 12 13 Pro Adaptor Kabel Type C to Lighting,Rp54.900
handphone-tablet,aksesoris-tablet,Leather Case iPad 10.2 ESR Rebound Slim Case,Rp215.900
handphone-tablet,aksesoris-tablet,Ugreen MFI lightning Lighting male iphone to 3.5 audio aux cable 1M,Rp190.000
handphone-tablet,aksesoris-tablet,CASE SAMSUNG GALAXY Z FLIP 3 MATTE WITH RING CASE PREMIUM,Rp100.000
handphone-tablet,aksesoris-tablet,Kabel Charger Samsung Z Fold 3 4 / Z Flip 3 4 Original 100% Type C Ori,Rp75.000
handphone-tablet,aksesoris-tablet,IPAD MINI 1/ 2 / 3 PREMIUM SMART FLIP COVER LEATHER CASE,Rp47.500
handphone-tablet,aksesoris-tablet,Clear Case 2.0mm Samsung A14 5G 2023/Silikon bening Samsung A14 5G,Rp11.500
handphone-tablet,aksesoris-tablet,Xiaomi Poco X3 Pro Hikaru Premium Tempered Glass Anti Gores Kaca,Rp25.000
handphone-tablet,aksesoris-tablet,Uneed Stylus Pen for iPad with Palm Rejection Tilt Function and Remote,Rp307.230
handphone-tablet,aksesoris-tablet,"Stand Holder Portable UGREEN Dudukan Handphone ,Tablet ,Ipad Universal",Rp42.500
handphone-tablet,aksesoris-tablet,Samsung A cover galaxy A50s case silicon tpu araree goncangan goresan,Rp15.000
handphone-tablet,aksesoris-tablet,HyperDrive 6 /in 1 Hub Original for iPad Air Pro Macbook Air Pro,Rp1.299.000
handphone-tablet,aksesoris-tablet,CERAMIC Mate Temper Glass Anti Pecah VIVO Y11 Y12 Y15 Y17 Y19 Y20 Y91C,Rp8.000
handphone-tablet,aksesoris-tablet,BOOK COVER FLIP CASE KEYBOARD WIRELESS SAMSUNG TAB S6 LITE 10.4 T610,Rp35.500
handphone-tablet,aksesoris-tablet,Case Protector Apple Magsafe battery Pack TPU Clear,Rp95.000
handphone-tablet,aksesoris-tablet,Apple Pencil Gen 1 2 Case Silicone Sleeve Protector - Carrot Model,Rp60.000
handphone-tablet,aksesoris-tablet,SAMSUNG TAB A8 LTE 10.5 IN DUX DUCIS TOBY COVER CASING ORI,Rp169.000
handphone-tablet,aksesoris-tablet,tripod 3110 3210 3120 + holder U 1 meter tomsis bluetooth remote self,Rp19.900
handphone-tablet,aksesoris-tablet,DUX DUCIS TOBY SERIES Case iPad 9.7 2018 iPad 9.7 2017 iPad 9.7 2016,Rp169.000
handphone-tablet,aksesoris-tablet,BACKDOOR BACK COVER CASING REALME 5i,Rp35.000
handphone-tablet,aksesoris-tablet,Holder Handphone Jepit / Holder Hp Dashboard Mobil 360 Derajat,Rp11.900
handphone-tablet,aksesoris-tablet,Copper Charger CP1004 (US / UK / EUR / AUS - PLUG SOCKET),Rp383.900
handphone-tablet,aksesoris-tablet,Logitech Combo Touch Keyboard iPad 10 iPad Air iPad Pro | 10.9 11 12.9,Rp2.689.000
handphone-tablet,aksesoris-tablet,(GROSIR)TG Tempered Glass anti gores bening REDMI 10C 10 C,Rp2.250
handphone-tablet,aksesoris-tablet,Case iPad 8 10.2 inch 8th-gen 2020 Dux Ducis Domo Series Cover Casing,Rp149.000
handphone-tablet,aksesoris-tablet,CHARGER KABEL DATA MICRO OPPO VOOC P11 CHARGING ORIGINAL 100% 4A,Rp15.000
handphone-tablet,aksesoris-tablet,ADAPTOR KEPALA CHARGER VIVO 2A 5V Y12 Y15 ORIGINAL 100% 10W V1020D-EU,Rp30.000
handphone-tablet,aksesoris-tablet,Xiaomi Mi Pad 5 Mi Pad 5 Pro Sarung Keyboard Bluetooth Book Case,Rp130.000
handphone-tablet,aksesoris-tablet,Case HuaWei MatePad 10.4” / R Rotary 360 Leather Case Flip Cover,Rp24.800
handphone-tablet,aksesoris-tablet,Magnetic Case For Iphone X XR XS MAX 11 11 Pro Max 12 12 Mini 13 PRO,Rp28.500
handphone-tablet,aksesoris-tablet,CASE ROBOT SAMSUNG A04 2022 / A73 5G / HARD CASE BELT CLIP ROBOT,Rp20.500
handphone-tablet,aksesoris-tablet,"Tempered Glass iPad 9 / 8 / 7 10.2"" Nillkin V+ Anti Blue Light Screen",Rp290.000
handphone-tablet,aksesoris-tablet,Screen Guard Paperlike for iPad,Rp89.000
handphone-tablet,aksesoris-tablet,TEMPERED GLASS BENING REDMI 10A 10C,Rp5.500
handphone-tablet,aksesoris-tablet,Case iPad Mini 6 8.3 Inch 2021 SWITCHEASY ORIGAMI Folio Folding,Rp210.000
handphone-tablet,aksesoris-tablet,Magnetic charger casan cabel Apple watch iwatch type C original,Rp295.000
handphone-tablet,aksesoris-tablet,OTG Fleco All in One TypeC Type C Micro USB 3.0 Card Reader Original,Rp5.999
handphone-tablet,aksesoris-tablet,keyboard case ipad mini 6 8.3 2021 Bluetooth keyboard pencil holder,Rp499.000
handphone-tablet,aksesoris-tablet,Jazz Focus Case iPad 2 3 4 6 2018 Air 2 Mini 4 5 iPad 10.2 7/8 Pro 11,Rp50.000
handphone-tablet,aksesoris-tablet,PROMO- Converter Type C to 3.5mm Jack Audio Samsung Note 10 20 S20 S21,Rp28.700
handphone-tablet,aksesoris-tablet,Realme Pad Mini 2022 8.7 inch Bluetooth Keyboard Case Casing Trackpad,Rp109.000
handphone-tablet,aksesoris-tablet,UGREEN OTG Adapter Konverter Tipe C Type C USB Untuk Ngecas USB1,Rp45.900
handphone-tablet,aksesoris-tablet,C143 Iphone 11 12 13 Pro Max Gold Plated Chrome Premium Soft Case,Rp29.900
handphone-tablet,aksesoris-tablet,Anker Powerport III Nano 20W Fast Charger USB-C / A2633,Rp149.999
handphone-tablet,aksesoris-tablet,iPad Pro 11 2021 2020 Magic Keyboard Softcase Folio Sleeve Cover Case,Rp139.000
handphone-tablet,aksesoris-tablet,[KN ACC] OTG USB 6 IN1 MICRO USB / TYPE C CARD READER FUNCTION,Rp26.000
handphone-tablet,aksesoris-tablet,Holder Hp Dashboard Mobil Jepit 360 Derajat 3 In 1 Universal - HD35,Rp17.000
handphone-tablet,aksesoris-tablet,i8 Mini Bluetooth Keyboard Backlit for Android TV Box in - Non Led,Rp59.500
handphone-tablet,aksesoris-tablet,STYLUS PEN SAMSUNG GALAXY NOTE 9 ORIGINAL,Rp45.000
handphone-tablet,aksesoris-tablet,Case iPad Pro 11 (2022/2021/2020) Spigen Ultra Hybrid Pro Flip Cover,Rp529.002
handphone-tablet,aksesoris-tablet,MultiStation CHARGER STM CHARGETREE SWING 3in1 Charging Apple,Rp1.379.000
handphone-tablet,aksesoris-tablet,Xiaomi Mi10T / Mi 10T Pro Hikaru Premium Tempered Glass,Rp25.000
handphone-tablet,aksesoris-tablet,CHARGER CASAN IPHONE 12 PROMAX 12 PRO ORIGINAL FASTCHARGING 20 W,Rp40.000
handphone-tablet,aksesoris-tablet,Apple Magic Keyboard for iPad Pro 2022 M2 6th Gen 11 12.9 White Black,Rp4.290.000
handphone-tablet,aksesoris-tablet,Case Realme Pad mini 8.7 2022 Casing Pad mini Rotary Flip Cover,Rp32.800
handphone-tablet,aksesoris-tablet,Charger Xiaomi 33W 22W 18W 10W Original Cabutan Produk Original Turbo,Rp60.000
handphone-tablet,aksesoris-tablet,Case ipad Air ipad 7 ipad 8 ipad 9 ( 2021) 10.2 inch smart case HITAM,Rp74.000
handphone-tablet,aksesoris-tablet,Smart Case Apple Case iPad Pro 9.7 inch 2016,Rp100.000
handphone-tablet,aksesoris-tablet,Batok samsung 1usb sy358 2.1A/Batok Charger Samsung 1USB SY358 2.1A,Rp3.499
handphone-tablet,aksesoris-tablet,Ringke iPad Pro 10.5 11 12.9 Smart Case Folio Cover Book Casing Slim,Rp224.850
handphone-tablet,aksesoris-tablet,deep purple steel hardcase case for iphone 14 pro max,Rp79.000
handphone-tablet,aksesoris-tablet,My choice case Dove bumper Aero Samsung A04,Rp8.000
handphone-tablet,aksesoris-tablet,Samsung Galaxy A33 5G Silikon Silicone Full Cover Soft case softcase,Rp65.000
handphone-tablet,aksesoris-tablet,Flip Case Keyboard Apple iPad Pro 11 12.9 9.7 Inch 2021 2020 2019 2018,Rp300.000
