base_type,type_,text,price
handphone-tablet,aksesoris-tablet,GOOJODOQ Float Cantilever Magnetic Keyboard Case For iPad 12.9 Inch,Rp1.223.100
handphone-tablet,aksesoris-tablet,Case iPad Pro 11 2022/2021/2020 Ringke Fusion Hybrid Slim Clear Casing,Rp365.002
handphone-tablet,aksesoris-tablet,Konektor iphone ipad lightning to hdmi,Rp125.000
handphone-tablet,aksesoris-tablet,Vention Kabel Charger Micro USB Type C Fast Charge Braided for Samsung,Rp38.300
handphone-tablet,aksesoris-tablet,XIAOMI REDMI PAD 10.6 ANTIGORES HYDROGEL FILM SCREEN PROTECTOR BENING,Rp46.000
handphone-tablet,aksesoris-tablet,Stylus Pencil Universal Ipad Pro 9.7 2017 Ipad 6 Ipad 5 STRDY,Rp155.000
handphone-tablet,aksesoris-tablet,XIAOMI REDMI PAD SOFT CASE CLEAR AIRBAG SILICONE,Rp50.000
handphone-tablet,aksesoris-tablet,MILS Tempered Glass Screen iPad 9 10 Mini 6 Air 5 Pro 11 12.9 2022 M1,Rp145.000
handphone-tablet,aksesoris-tablet,SAMSUNG J710/J72017/J7 CORE/J7 PRIME/J7 PRO TEMPERED GLASS ANTI MINYAK,Rp4.500
handphone-tablet,aksesoris-tablet,USAMS BH657 Smart Keyboard Cover For iPad 10.2Inch/10.9inc,Rp149.000
handphone-tablet,aksesoris-tablet,TEMPERED GLASS SAMSUNG TAB A 8 2019 SAMSUNG T295 SAMSUNG T290,Rp12.500
handphone-tablet,aksesoris-tablet,SAMSUNG GALAXY TAB S6 LITE PAPERLIKE SCREEN PROTECTOR ANTI GORES,Rp75.000
handphone-tablet,aksesoris-tablet,Apple Usb C To Lightning Cable Original Copotan,Rp99.000
handphone-tablet,aksesoris-tablet,BAHAN HYDROGEL MATTE ANTIMINYAK PREMIUM ANTI SHOCK SCREEN GUARD GROSIR,Rp6.500
handphone-tablet,aksesoris-tablet,CAR HOLDER DASHBOARD MOBIL TAB IPAD TABLET UNIVERSAL 7 INCH - 10 INCH,Rp59.900
handphone-tablet,aksesoris-tablet,"CASE IPAD PRO M1 2021 11 INCH 12,9 INCH SMART CASE IPAD PRO HOLD PEN",Rp90.000
handphone-tablet,aksesoris-tablet,Anti Gores Ceramic Glare Samsung Tab A8 2019 T295 T290 P205 P200 - SC,Rp16.500
handphone-tablet,aksesoris-tablet,SMART COVER IPAD MINI 1 2 3 CASE LEATHER ORIGINAL SOFTCASE MINI2 MINI1,Rp95.000
handphone-tablet,aksesoris-tablet,Case Magsafe clear casing anticrack Iphone 14 Pro Max Premium like Ori,Rp59.900
handphone-tablet,aksesoris-tablet,Anti Spy Tempered Glass Sony Xperia 5 Anti Gores Anti Privacy Xperia5,Rp45.000
handphone-tablet,aksesoris-tablet,BASEUS STYLUS PEN FOR IPAD PRO 12.9 11 AIR MINI 2021/2020 TABLET PHONE,Rp489.000
handphone-tablet,aksesoris-tablet,Antigores Samsung Tab S6 Lite P610 P615 Tempered Glass Screen Guard TG,Rp25.000
handphone-tablet,aksesoris-tablet,Soft Case iPad Air ESR Project Zero,Rp162.000
handphone-tablet,aksesoris-tablet,Superfit Tempered Glass Dust iPhone 12 12pro 12promax pro max full,Rp99.900
handphone-tablet,aksesoris-tablet,Samsung Galaxy Note 9 Back Case Caseme C20 Wallet Leather Slot kartu,Rp85.000
handphone-tablet,aksesoris-tablet,Mcdodo Spliter Audio Adapter iPhone Lightning 2in1 Call+Music+Charging,Rp95.000
handphone-tablet,aksesoris-tablet,Colta P6 Phone/Tablet Stand Holder Aluminium Tab Bracket Dudukan HP,Rp165.000
handphone-tablet,aksesoris-tablet,Leather Case Iphone 6 plus/6s plus Original Ibox Tam,Rp35.000
handphone-tablet,aksesoris-tablet,Case Armor Strap Standing Ipad 9 10.2 2021,Rp215.000
handphone-tablet,aksesoris-tablet,SLAVENS Smart Case iPad 9 10.2 (2021) Transformer Cover Casing,Rp160.000
handphone-tablet,aksesoris-tablet,CONVERTER 100W USB TYPE C FEMALE TO DC CHARGER LAPTOP UNIVERSAL,Rp109.000
handphone-tablet,aksesoris-tablet,Acrylic iPad Transparent Case Mini 6 Gen 7th 8th 9th 10.2 Pro 11 Air 4,Rp135.000
handphone-tablet,aksesoris-tablet,SAMSUNG Stylus S Pen Galaxy Tab S7 FE Original,Rp315.000
handphone-tablet,aksesoris-tablet,BASEUS Kabel Data Iphone 12 Type-C to Lightning Fast Charging PD 20W,Rp89.000
handphone-tablet,aksesoris-tablet,Goojodoq 2nd gen Pro Keyboard Bluetooth 3in1 10 inch,Rp74.000
handphone-tablet,aksesoris-tablet,Case Essential/ Case infinity/ casing infinity/ essential,Rp36.000
handphone-tablet,aksesoris-tablet,Ugreen Foldable Phone Stand Adjustable Holder Charge Capable ORIGINAL,Rp69.900
handphone-tablet,aksesoris-tablet,Case Xiaomi Redmi 9 Hard Case AERO Protection Camera Premium,Rp22.500
handphone-tablet,aksesoris-tablet,Case iPhone SE 2022 SE 3 SE 2 2020 / 8 / 7 Ringke Fusion Soft Casing,Rp199.000
handphone-tablet,aksesoris-tablet,Apple Pencil Case Holder Sleeve Nylon Fabric Elastic Gen 1 2 Stylus,Rp45.000
handphone-tablet,aksesoris-tablet,TEMPERED GLASS FULL 5D/9D GROSIR OPPO/VIVO/XIAOMI/NOKIA/SAMSUNG/IPHONE,Rp1.950
handphone-tablet,aksesoris-tablet,UGREEN 50748 Portable Desktop Phone Holder Stand Tablet Ipad Tab HP,Rp75.000
handphone-tablet,aksesoris-tablet,ibywind tempered glass Iphone 11/XR original,Rp99.000
handphone-tablet,aksesoris-tablet,Bread hologram case iphone for 7 8 plus x xs max 11 pro max,Rp59.000
handphone-tablet,aksesoris-tablet,Apple Magic Keyboard M1 2021 IBOX Silver White MK2A3 for MacBook iMac,Rp1.639.000
handphone-tablet,aksesoris-tablet,Leather Case Keyboard Universal Android Keyboard Tablet 10inch,Rp98.000
handphone-tablet,aksesoris-tablet,SAMSUNG Z FLIP Z FOLD 3 4 2 A2 CORE HYDROGEL SPY GELAP ANTI GORES,Rp36.900
handphone-tablet,aksesoris-tablet,ANTI GORES JELLY HYDROGEL IPAD MINI 6 9 11 INCH 2021 FULL SCREEN,Rp60.000
handphone-tablet,aksesoris-tablet,Case iPad Pro 11 (2022/2020/2021) Spigen Ultra Hybrid Pro Flip Cover,Rp529.002
handphone-tablet,aksesoris-tablet,Ibywind Xiaomi Poco F4 Premium Tempered Glass,Rp115.000
handphone-tablet,aksesoris-tablet,Luna Kepala Charger Adaptor Original Quick Charge Iphone Android,Rp14.500
handphone-tablet,aksesoris-tablet,"Universal Stylus Pen for Android, Samsung, Xiaomi, Oppo, iPad, iPhone",Rp180.000
handphone-tablet,aksesoris-tablet,BACKDOOR BACKCOVER TUTUP BELAKANG CASING VIVO Y91C,Rp35.000
handphone-tablet,aksesoris-tablet,Soft Case Casing Iphone 13 12 Pro Max Mini Motif Mickey Mouse Cute,Rp16.500
handphone-tablet,aksesoris-tablet,SAMSUNG A04E - ANTI GORES MATTE FILM SPY ANTI PRIVACY,Rp5.999
handphone-tablet,aksesoris-tablet,(Original) Apple Pencil 2 for iPad Pro 2018 11 / 12.9 Inch (2nd Gen),Rp1.792.000
handphone-tablet,aksesoris-tablet,Pen Stylus Universal Samsung Galaxy Tab A7 Lite,Rp62.500
handphone-tablet,aksesoris-tablet,"Stylus Pen Samsung Tab A7 Lite 8.7""T220/T225 2021 Spen Pencil Fine",Rp165.000
handphone-tablet,aksesoris-tablet,Sylus Pena Touch Pen HP Tablet 2in1 Layar Capacitive Screen Resistive,Rp12.000
handphone-tablet,aksesoris-tablet,Stand Holder Standing Magnetic Dudukan iPad Pro 10 11 12.9 Air 4,Rp468.000
handphone-tablet,aksesoris-tablet,Stylus S Pen / Pensil Samsung Galaxy Note 8 / Note8 Original 100%,Rp98.000
handphone-tablet,aksesoris-tablet,Case iPad 10 10.9 inch 2022 10th Gen Dux Ducis Domo Cover Casing,Rp149.000
handphone-tablet,aksesoris-tablet,STYLUS TOUCH PEN NINTENDO 3DS,Rp4.500
handphone-tablet,aksesoris-tablet,Skinarma - MUSEN - Case / Casing iPhone 13 / Pro / Pro Max - Magsafe,Rp550.000
handphone-tablet,aksesoris-tablet,IPAD AIR 3 10.5 PAPER LIKE PAPERLIKE SCREEN PROTECTOR ANTI GORES ORI,Rp65.000
handphone-tablet,aksesoris-tablet,TEMPERED GLASS HUAWEI MATEPAD T10S 10.1 SCREEN PROTECTOR,Rp27.899
handphone-tablet,aksesoris-tablet,PROMO Case iPhone 7 Black Matte Premium Soft Casing TERBARU,Rp29.000
handphone-tablet,aksesoris-tablet,Pen Holder Ringke Pen Sleeve For Apple Pencil Samsung S Pen,Rp115.002
handphone-tablet,aksesoris-tablet,Stand Holder HP Invisible Phone Stand Ultra Thin Bahan Metal,Rp5.500
handphone-tablet,aksesoris-tablet,CASE IPAD 2/3/4 KID CASE IPAD 2/3/4 / KID CASE STANDING IPAD 2/3/4,Rp109.000
handphone-tablet,aksesoris-tablet,Charger Adaptor Apple Ipad Pro Iphone Type C 3A 18W 3A Fast Charging,Rp85.000
handphone-tablet,aksesoris-tablet,Universal 10 Inchi Tempered Glass Anti Gores Original FS for Tablet,Rp40.000
handphone-tablet,aksesoris-tablet,Original Apple Smart Folio Case iPad Mini 6 Flip Casing Cover Magnetic,Rp1.499.000
handphone-tablet,aksesoris-tablet,KABEL DATA IPHONE BASEUS AUTOMATIC POWER-OFF FAST CHARGING 2.4A,Rp79.000
handphone-tablet,aksesoris-tablet,Samsung S21 FE Hikaru Premium Tempered Glass Anti Gores Kaca,Rp25.000
handphone-tablet,aksesoris-tablet,Clear Case Magsafe Magnetic Iphone 11 Pro Max / Ip 11 Pro / Ip 11,Rp67.500
handphone-tablet,aksesoris-tablet,Tripod Bluetooth Selfie Stick LED Flash Tongsis Kamera Expandable,Rp27.990
handphone-tablet,aksesoris-tablet,Ipad air 5 m1 2022 flip case bluetooth keyboard trackpad pencil holder,Rp425.000
handphone-tablet,aksesoris-tablet,INFORCE MINI KEYBOARD I8 WIRELESS CHARGE NOKIA HANDHELD,Rp75.000
handphone-tablet,aksesoris-tablet,ROBOT Batok charger / kepala casan RT K8 2A 10WATT Original 💯,Rp19.336
handphone-tablet,aksesoris-tablet,Case Xiaomi Redmi 10 Casing Transparent Free Tempered Glass + Skin,Rp25.500
handphone-tablet,aksesoris-tablet,Flip Cover Kulit Samsung Galaxy A12 A22 4G 5G Case Dompet Casing Lipat,Rp22.000
handphone-tablet,aksesoris-tablet,Apple Pencil 1 / 2 Tips isi 4 Original Resmi Made by Apple Extra Tips,Rp145.000
handphone-tablet,aksesoris-tablet,"APPLE IPAD PRO 2021 11"" / 12.9"" MATTE ANTI GLARE TEMPERED GLASS",Rp150.000
handphone-tablet,aksesoris-tablet,BASEUS Smooth Writing Capacitive Stylus (Active+Passive) - ACSXB-C,Rp379.000
handphone-tablet,aksesoris-tablet,XUNDD CASE IPAD PRO M2 2022 11 INCH / 12.9 INCH BEATLE HOLDER SERIES,Rp170.000
handphone-tablet,aksesoris-tablet,Aukey Car Charger CC-Y11 with PD + QC 3.0 21W - 500476 / 500918,Rp109.000
handphone-tablet,aksesoris-tablet,Paperlike Screen Guard IPAD 11 / 10.5/ 9.7 Inch,Rp139.000
handphone-tablet,aksesoris-tablet,Stand Hp Kursi Phone Holder Chair Dudukan Docking Sanderan Handphone,Rp2.900
handphone-tablet,aksesoris-tablet,Tempered Glass Layar Redmi 10 2022 Free Camera & Garskin,Rp15.900
handphone-tablet,aksesoris-tablet,"Case iPad 9 10.2"" Gen 7/8 Air 3 10.5"" Motif Cartoon Anime Karakter",Rp159.000
handphone-tablet,aksesoris-tablet,Apple Smart Keyboard Folio For iPad 9 10.2 inch 2021,Rp2.740.000
handphone-tablet,aksesoris-tablet,Huawei MatePad 10.4 2022 2021 R 2020 Smart Stylus Pen Tablet Pencil,Rp199.000
handphone-tablet,aksesoris-tablet,Taffware Wireless Bluetooth Keyboard Rechargeable - Black,Rp51.900
handphone-tablet,aksesoris-tablet,XUNDD Untuk Iphone 13 6.1 Case Shockproof Slim Tembus Matte Casing,Rp60.000
handphone-tablet,aksesoris-tablet,FS Smart Cover & OneSOS keyboard - Samsung Tab A8 10.5 (2022) X205,Rp135.000
handphone-tablet,aksesoris-tablet,CASE ORIGINAL SMARTCASE AUTO LOCK FOR IPAD MINI 4,Rp62.500
handphone-tablet,aksesoris-tablet,"COPPER IPAD PRO 2 / 10.5 ""(2017) - Magnetic Case|Magnetic Slim Casing",Rp296.900
handphone-tablet,aksesoris-tablet,"Display Alarm 4” inch (Tablet, iPad) pengaman hp pameran",Rp300.800
handphone-tablet,aksesoris-tablet,Oppo VOOC Kepala Charger GAN3 Pro 65W Fast Charger Adaptor USB Type C,Rp27.000
handphone-tablet,aksesoris-tablet,"Flip Cover 01 SAMSUNG A04, A03",Rp18.000
handphone-tablet,aksesoris-tablet,Smart Case iPad Pro 11 inch 1 / 2 / 3 with Apple Pencil Holder,Rp199.000
handphone-tablet,aksesoris-tablet,Samsung Galaxy Tab A 8.0inchi 2019 T290 T295 Softcase Casing Cover,Rp22.000
handphone-tablet,aksesoris-tablet,ipad pro 11 2018 2020 2021 sleeve pouch tas hand bag jinjing,Rp45.000
handphone-tablet,aksesoris-tablet,ugreen MFI 2.4A kabel cable charger cas usb to lightning iphone 6 7 8,Rp124.500
handphone-tablet,aksesoris-tablet,APPLE PENCIL GEN 1 2 TIP UJUNG REPLACEMENT IPAD PRO AIR MINI PAPERLIKE,Rp50.050
handphone-tablet,aksesoris-tablet,Case iPhone 13 Pro Max Mini Nomad Rugged Leather MagSafe Hybrid Casing,Rp629.002
handphone-tablet,aksesoris-tablet,DK3888 TRIPOD 1M STANDING HP WITH TOMSIS BLUETOOTH WIRELESS PHONE HOLD,Rp54.800
handphone-tablet,aksesoris-tablet,Apple 18W USB-C Power Adapter Original - iPad Pro iPhone,Rp345.000
handphone-tablet,aksesoris-tablet,SAMSUNG Refill Tip Nib Ujung Mata Stylus Samsung S Pen tab S7 S7+ S7 F,Rp14.999
handphone-tablet,aksesoris-tablet,SEIN Original Samsung Galaxy Tab S7 FE Book Cover Keyboard Slim,Rp1.399.000
handphone-tablet,aksesoris-tablet,Xiaomi Pad Keyboard Mi Pad 5 / 5 Pro Protective Keyboard Case Original,Rp1.196.000
handphone-tablet,aksesoris-tablet,Stylus Pen Tablet Advan Sketsa 2 / Sketsa2 Original,Rp249.000
handphone-tablet,aksesoris-tablet,Screen Protector iPad 10 10.9 2022 Spigen Paper Touch Pro Matte Film,Rp295.000
handphone-tablet,aksesoris-tablet,"Tempered Glass SAMSUNG TAB S7 FE 12,4 2021 Anti Gores Kaca Tablet",Rp40.000
handphone-tablet,aksesoris-tablet,S Pen Stylus Samsung Galaxy Note 9 ori,Rp44.000
handphone-tablet,aksesoris-tablet,Baseus Kepala Charger Quick Charger QC3.0 Type-C+USB 20W PD,Rp139.000
handphone-tablet,aksesoris-tablet,ipad 9 10.2 || Paperlike ipad 9 10.2 Antigores Matte,Rp55.000
handphone-tablet,aksesoris-tablet,Soft Case Casing Clear Asus Zenfone 3 5.5inchi ZE552KL Z012DB,Rp20.000
handphone-tablet,aksesoris-tablet,Leather Case Oem Apple iPhone 14 Pro Max Casing Cover,Rp50.000
handphone-tablet,aksesoris-tablet,Case iPad Mini 6 Casing Robot Armor Heavy Duty Pencil Slot Kids,Rp255.000
handphone-tablet,aksesoris-tablet,Original Samsung Tab A7 lite Book Cover Bookcover Casing Flip T225,Rp299.000
handphone-tablet,aksesoris-tablet,BATOK / KEPALA CHARGER TYPE C TO I/P 12 PRO LGTNING,Rp32.500
handphone-tablet,aksesoris-tablet,Capacitive Stylus 2 in1 Universal Pen for Android iPad Tab Robot RSP01,Rp55.500
handphone-tablet,aksesoris-tablet,Dummy Ipad Pro 2021,Rp399.000
handphone-tablet,aksesoris-tablet,ABT-02 Tempered Glass Tablet Universal 7 - 8 - 10 Inch Anti Gores Kaca,Rp35.000
handphone-tablet,aksesoris-tablet,"IPad 10 10th Gen 10.9"" 2022 Stylus Pencil Pensil S Pen Palm Rejection",Rp244.000
handphone-tablet,aksesoris-tablet,PAPERLIKE MATTE SCREEN PROTECTOR IPAD PRO 11 12.9 INCH M1 M2 2021 2022,Rp50.000
handphone-tablet,aksesoris-tablet,"Tempered Glass Anti Spy iPhone 7 Plus (5.5"") | Anti Gores Screen",Rp24.900
handphone-tablet,aksesoris-tablet,KABEL CHARGER APPLE USB C-C ORIGINAL 2M MACBOOK IPAD PRO,Rp135.000
handphone-tablet,aksesoris-tablet,[MACARON] Kabel Data Charger 4A MicroUsb V8/TypeC/iPhone Kabel Toples,Rp3.000
handphone-tablet,aksesoris-tablet,PAPER LIKE Screen Guard SAMSUNG TAB S6 LITE Anti Gores Matte Glare,Rp45.000
handphone-tablet,aksesoris-tablet,Redmi Note 11 Pro 5G Flip Wallet Caseme Leather Case Sarung Kulit,Rp75.000
handphone-tablet,aksesoris-tablet,Anti Gores PaperLike Samsung Galaxy Tab S8 S8 Plus S8 Ultra Anti Glare,Rp65.000
handphone-tablet,aksesoris-tablet,Ipad Pro 12.9 2020 2021 Tas Jinjing Pocket Nylon Pouch Sleeve Slot,Rp129.000
handphone-tablet,aksesoris-tablet,Case XM Redmi Note 8 Pro Casing Transparent Free Tempered Glass + Skin,Rp25.500
handphone-tablet,aksesoris-tablet,C142 Iphone 12 / Pro Max / 13 / Pro Max Matte Case UltraThin + Lens,Rp10.000
handphone-tablet,aksesoris-tablet,Case iPad 10 10.9 2022 FS Smart Cover Matte Stylus Flip Casing,Rp75.000
handphone-tablet,aksesoris-tablet,HYDROGEL SCREEN PROTECTOR ANTI BLUE ANTI RADIASI ADVAN TAB SKETSA 2,Rp75.000
handphone-tablet,aksesoris-tablet,Sarung iPad Exsport Everyday iPad Compartment Pouch - Hijau Army,Rp206.100
handphone-tablet,aksesoris-tablet,Case Samsung Galaxy A52s 5G Casing Comfortable Premium Back Cover,Rp75.000
handphone-tablet,aksesoris-tablet,TEMPERED GLASS ANTI BLUE LIGHT XIAOMI REDMI 10C,Rp10.000
handphone-tablet,aksesoris-tablet,Casing Motif Starbucks Coffe Soft Case IPHONE X XS MAX XR 11 12 13 PRO,Rp70.000
handphone-tablet,aksesoris-tablet,Lazypod 1.75M Stand Ranjang lantai phone Holder Stand Hp Tablet,Rp115.000
handphone-tablet,aksesoris-tablet,ESR Paperlike Screen Protector iPad Pro 11 12.9 2021 M1 Tempered Glass,Rp199.000
handphone-tablet,aksesoris-tablet,"soft case silikon ipad mini 1 2 3 4 5 ipad 9.7"" karakter anak lucu",Rp145.000
handphone-tablet,aksesoris-tablet,Stylus Pen Ipad Mini 1 2 3 4 5 6 Spen Pencil Fine,Rp165.000
handphone-tablet,aksesoris-tablet,SAMSUNG GALAXY A73 5G SOFTCASE CASING COVER LEATHER KULIT STAND MAGNET,Rp105.000
handphone-tablet,aksesoris-tablet,"Case iPad Pro M2 2022 11"" & 12.9"" Inch Dux Ducis Domo Cover Casing",Rp250.000
handphone-tablet,aksesoris-tablet,Tripod Support 4 LEVEL KETINGGIAN + Holder U / Tripod Mini Murah,Rp10.474
handphone-tablet,aksesoris-tablet,Tempered Glass iPhone Series Clear&Spy Full Cover Easy Installation,Rp40.000
handphone-tablet,aksesoris-tablet,YOUNGPRO YST-03 - STYLUS PEN 2IN1 UNIVERSAL,Rp16.500
handphone-tablet,aksesoris-tablet,Case Samsung Galaxy Tab S6 Lite 10.4 P610 P615 Keyboard Bluetooth Flip,Rp349.000
handphone-tablet,aksesoris-tablet,Samsung Tab A8 10.5 2022 X205 X200 Flip Stand pu Leather Slot Pen Case,Rp60.000
handphone-tablet,aksesoris-tablet,SAMSUNG GALAXY TAB A8 LTE 10.5 IN SILICON BENING CASING TPU CLEAR,Rp35.000
handphone-tablet,aksesoris-tablet,Smart Case iPad Pro 12.9 2021 2020 2018 Silikon With Slot Pencil,Rp135.000
handphone-tablet,aksesoris-tablet,Case Samsung Tab A8 2019 Rugged Armor Kick Stand Samsung Tab T290 T295,Rp55.000
handphone-tablet,aksesoris-tablet,Case Huawei Matepad Se 10.4 Inch 2022 Rotary Casing Flip Cover Stand,Rp29.900
handphone-tablet,aksesoris-tablet,GENNEXT Splitter iphone Charger Charging LIGHTNING earphone converter,Rp60.000
handphone-tablet,aksesoris-tablet,"Nillkin AR Paperlike Screen Protector iPad Pro 11"" - Matte",Rp270.000
handphone-tablet,aksesoris-tablet,Case Dove My Choice Samsung Tab A8 2019 Spen P200 SM-P205 Aero Case,Rp33.900
handphone-tablet,aksesoris-tablet,BASEUS FUN JOURNEY For Backseat Car Holder BASEUS Phone & iPad & Tab,Rp155.000
handphone-tablet,aksesoris-tablet,"COPPER iPad 9 / 10,2"" (2021) - Magnetic Case | Magnetic Slim Casing",Rp296.900
handphone-tablet,aksesoris-tablet,Kabel data Veger V-109 Type Lightning QC3.0 fast Charcing,Rp6.900
handphone-tablet,aksesoris-tablet,"Ipad 9.7"" 5 / 6 , AIR 1 2 , PRO 9,7 Eva ShockProof Standing Kids Case",Rp99.999
handphone-tablet,aksesoris-tablet,UGREEN Kabel Lightning (MFI) to USB-C Fast Charging - US171,Rp133.000
handphone-tablet,aksesoris-tablet,Tombol 1 set Volume power on of Oppo F9 - Power Button Casing Plasti,Rp4.250
handphone-tablet,aksesoris-tablet,ADVAN TAB SKETSA 1 2 Tablet 10 10.1 Inch Case Casing Cover Anti Gores,Rp128.000
handphone-tablet,aksesoris-tablet,Case Samsung Galaxy Tab S7 FE 5G SPIGEN Tough Armor Pro Stand Casing,Rp470.000
handphone-tablet,aksesoris-tablet,Case Samsung Galaxy Tab A7 Lite T225 T220 Samrt Flip case Casing Book,Rp89.000
handphone-tablet,aksesoris-tablet,Case Ipad Pro 10.5 Inch Premium Smartcase with Pen Holder,Rp89.900
handphone-tablet,aksesoris-tablet,ugreen gan 65w adapter fast quick charger qc pd 3.0 4.0 type c macbook,Rp245.000
handphone-tablet,aksesoris-tablet,CASE TRANSFORMER ROBOT REALME 3 pro 5 5I 6 PRO 8 PRO Hardcase Armor,Rp25.900
handphone-tablet,aksesoris-tablet,Kabel OTG 2 in 1 Multifungsi Bahan Besi Fast Speed usb Micro & Type C,Rp6.500
handphone-tablet,aksesoris-tablet,LEVINO Case iPad Gen 9/10 10.2 Pro 11 Air4/Air5 Mini 6 Gambar Unik DIY,Rp145.000
handphone-tablet,aksesoris-tablet,Flip Cover Kulit Realme 5 5i 5S 5 PRO Case Dompet Lipat Casing Magnet,Rp22.000
handphone-tablet,aksesoris-tablet,Casing Advan Book Cover Tab A8 Tablet Hardcase Bookcover,Rp59.000
handphone-tablet,aksesoris-tablet,Tempered Glass iPad Pro 12.9 inch (2021/2020/2018) Spigen Glas tR Slim,Rp295.000
handphone-tablet,aksesoris-tablet,WIWU macbook TABLET IPAD PRO 11 13 inci case tablet tas ipad samsung,Rp345.000
handphone-tablet,aksesoris-tablet,Tripod HP Holder Flexible - Tripod Mini Spider Gurita Holder Handphone,Rp6.900
handphone-tablet,aksesoris-tablet,Soft Case PUFF iPhone X XR XS Max 7 8 7+ 8+ Plus Pillow Puffer Case,Rp12.500
handphone-tablet,aksesoris-tablet,MILS Floating Magic Keyboard Case for iPad Pro 11 2018 2021 Air 4 2020,Rp2.235.000
handphone-tablet,aksesoris-tablet,Relx Casing Silikon Bening Infinity 4th,Rp40.000
handphone-tablet,aksesoris-tablet,GOOJODOQ Nib Tip untuk Goojodoq Gen 10 Apple Pencil Stylus,Rp35.000
handphone-tablet,aksesoris-tablet,Samsung Galaxy Tab A8 2022 X205 Sarung Keyboard Bluetooth Book Case,Rp130.000
handphone-tablet,aksesoris-tablet,Flip Cover Kulit Xiaomi Redmi note 6 7 8 PRO Case Dompet Casing Lipat,Rp22.000
handphone-tablet,aksesoris-tablet,Samsung pd charger 25w adapter Original Samsung,Rp149.900
handphone-tablet,aksesoris-tablet,Huawei M-Pencil Stylus 2nd Generation For Huawei MatePad 11 ORIGINAL,Rp1.185.000
handphone-tablet,aksesoris-tablet,Pulpen Stylus Layar Sentuh Kapasitif Universal 2 In 1 Untuk android n,Rp35.000
handphone-tablet,aksesoris-tablet,Magsafe Transparent Case iPhone 13 PRO MAX MINI,Rp55.000
handphone-tablet,aksesoris-tablet,Clear Case Space Apple Iphone 11 Pro Max (Tebal 2.1mm),Rp19.000
handphone-tablet,aksesoris-tablet,Lazy Neck Phone Holder Pegangan Handphone/HOLDER PONSEL FLEKSIBEL,Rp19.000
handphone-tablet,aksesoris-tablet,ORI BLUEFINGER F360 iPad Case Bluetooth Keyboard for iPad Pro 10.5-inc,Rp399.000
handphone-tablet,aksesoris-tablet,Samsung Tab S6 Lite 10.4 2022 P619 Bluetooth Keyboard Trackpad Case,Rp399.000
handphone-tablet,aksesoris-tablet,Vivan VSM100/VSC100/VSL100 Kabel Data & Charger Silicone Quick Charge,Rp39.516
handphone-tablet,aksesoris-tablet,Kabel Data Charger Infinix Hot 9 play / Hot 10 Original Fast Charging,Rp35.000
handphone-tablet,aksesoris-tablet,GOOJODOQ 11Pro Pencil iPad Stylus ipad 7/8/9 Mini6 Tilt Palm Rejection,Rp300.000
handphone-tablet,aksesoris-tablet,PUFF CASE - CASE IPHONE 11 PRO MAX 12 PRO MAX 13 PRO MAX,Rp23.000
handphone-tablet,aksesoris-tablet,Baseus Universal Capacitive Stylus Pen Tablet Apple iPad iPhone PC,Rp105.000
handphone-tablet,aksesoris-tablet,Book Cover Keyboard Samsung Galaxy Tab S7 Plus FE S8 Ultra 5G Original,Rp425.000
handphone-tablet,aksesoris-tablet,NVN-PG01 GRIFPHONE RING PHONE GRIP HOLDER HP STAND WITH MAGNETIC,Rp35.000
handphone-tablet,aksesoris-tablet,Apple Pencil Gen 1 & Pencil Gen 2 RESMI IBOX,Rp1.450.000
handphone-tablet,aksesoris-tablet,Iphone XR Tempered Glass Superfit Anti Spy Screen Protector,Rp26.000
handphone-tablet,aksesoris-tablet,Case iPhone 12 Pro Max Mini Torras GUARDIAN hybrid Casing Original,Rp249.000
handphone-tablet,aksesoris-tablet,TEMPERED GLASS PRIVACY ANTI SPY IPHONE IP 5 / IP 5S / IP 6 / IP 6S,Rp13.800
handphone-tablet,aksesoris-tablet,Case Samsung Book Caver Keyboard slim Tab S8 / S8 Plus / S8+ Original,Rp1.299.000
handphone-tablet,aksesoris-tablet,procamera case iphone 11 11 pro 11 promax 12 12 pro 12 promax 13 pro,Rp20.000
handphone-tablet,aksesoris-tablet,Case sarung iPad Pro 2016 Air 1 2 iPad 5 6 9.7 inch Silikon Pen holder,Rp85.000
handphone-tablet,aksesoris-tablet,MILS Apple Pencil Series for iPad 10.2 8 9 Air 4 5 Pro 11 M1 2021 2022,Rp535.000
handphone-tablet,aksesoris-tablet,VIVO Y30 Y30i Y50 Tempered Glass Anti Gores FULL CERAMIC Matte SPY,Rp16.500
handphone-tablet,aksesoris-tablet,Stylus Pen Ipad Air 2 Spen Pencil Fine,Rp165.000
handphone-tablet,aksesoris-tablet,Apple Watch Tempered Glass Series 7 FULL COVER Screen Protector,Rp45.900
handphone-tablet,aksesoris-tablet,TEMPERED GLASS MATTE/GLARE SCREEN PROTECTOR SUPERFIT FOR IPHONE X/XS,Rp26.000
handphone-tablet,aksesoris-tablet,Case Casing Silicone Protective Devialet Gemini Tws + Carabiner,Rp120.000
handphone-tablet,aksesoris-tablet,iPad Air Generasi 5 5th Gen Matte Tempered Glass Paper Like Antiglare,Rp148.000
handphone-tablet,aksesoris-tablet,Apple iPad Mini 1 2 3 4 5 Bluemoon Flip Cover Tablet Case,Rp55.000
handphone-tablet,aksesoris-tablet,BACKDOOR BACK GLASS TUTUP BELAKANG BATERAI COVER XIAOMI MI 11 LITE ORI,Rp38.000
handphone-tablet,aksesoris-tablet,USAMS Tempered Glass Full Screen Protector Installation Tool iPhone 14,Rp69.000
handphone-tablet,aksesoris-tablet,Samsung Galaxy Tab A8 10.5 Inch 2021 2022 Flip Cover Case Casing Putar,Rp44.900
handphone-tablet,aksesoris-tablet,Screen Guard Protector Anti Gores Head Unit Wuling Almaz Smart Enjoy,Rp50.000
handphone-tablet,aksesoris-tablet,"SCREEN SABLON 25x35 T.120, T150, T165, T180 ( PUTIH/KUNING)",Rp33.000
handphone-tablet,aksesoris-tablet,"Case iPad Pro 11"" 12.9"" 2021 Air 4 SwitchEasy Coverbuddy",Rp390.000
handphone-tablet,aksesoris-tablet,kepala charger nano ER.D.A wapsnano,Rp34.900
handphone-tablet,aksesoris-tablet,"CASE ROTATE IPAD 9 2021 10,2INCH PELINDUNG CASING GEN 2020 10.2 INCH",Rp89.000
handphone-tablet,aksesoris-tablet,Case iPad mini 6 2021 6th Gen Dux Ducis Domo Flip Book Cover Casing,Rp149.000
handphone-tablet,aksesoris-tablet,Apple Pencil 1 / 2 Generation - Tip Nib Silicon Case Cover 4 pcs,Rp7.000
handphone-tablet,aksesoris-tablet,Anti Spy Tempered Glass Pelindung Anti Gores iPhone 13 Mini Pro ProMax,Rp45.900
handphone-tablet,aksesoris-tablet,Tempered Glass Xiaomi Mi Pad 5 Anti gores Kaca,Rp38.500
handphone-tablet,aksesoris-tablet,Adapter iPhone 13 Mini Pro Max Kepala Charger Casan 20W Original Apple,Rp245.000
handphone-tablet,aksesoris-tablet,TERMURAH CASE APPLE PENCIL 2 gen SILICONE CASING COVER IPAD PRO STYLUS,Rp35.100
handphone-tablet,aksesoris-tablet,Apple Watch Stand Dock Wireless Charger Silicone Holder mirip ELAGO,Rp99.900
handphone-tablet,aksesoris-tablet,Tempered Glass Kamera iPad Air 5 4 Mini 6 iPad 10 Ring Camera Lens,Rp45.000
handphone-tablet,aksesoris-tablet,SAMSUNG S22 ULTRA S22 ANTI GORES JELLY HYDROGEL DEPAN BELAKANG CLEAR,Rp14.900
handphone-tablet,aksesoris-tablet,Kepala Charger rd a drop v1.5,Rp39.999
handphone-tablet,aksesoris-tablet,USAMS T50 Adapter Fast Charger GaN 100W 4 ports ACCC,Rp519.000
handphone-tablet,aksesoris-tablet,ESR Case Iphone 11 Pro Max Casing Silikon Metal Stand Cover Transparan,Rp170.000
handphone-tablet,aksesoris-tablet,Anti Gores Paperlike Magnetic iPad 9 10.2 ipad 8 10.2 ipad 7 10.2,Rp120.000
handphone-tablet,aksesoris-tablet,Apple iPad Air 3 iPad Pro 10.5 2017 Clear TPU Bening Soft Case,Rp22.000
handphone-tablet,aksesoris-tablet,Xundd Beetle Stand Case iPad Air 5 10.9 2022 4th Gen Hybrid Back Case,Rp150.000
handphone-tablet,aksesoris-tablet,BACKDOOR BACK COVER CASING XIAOMI 9 - XIAOMI Mi 9,Rp45.000
handphone-tablet,aksesoris-tablet,DUX DUCIS TOBY Case Samsung Galaxy Tab S8 Plus Samsung S8 Ultra S8,Rp169.000
handphone-tablet,aksesoris-tablet,BACKDOOR BACKCASE TUTUP BELAKANG CASING VIVO Y12S ORIGINAL,Rp25.000
