base_type,type_,text,price
handphone-tablet,aksesoris-tablet,REALME C21/C21Y/C25/C25S/C25Y/C3/C31/C35 ANTI GORES ANTI MINYAK,Rp4.500
handphone-tablet,aksesoris-tablet,Charger Samsung Galaxy Watch / Watch Active / Wireless Charging Dock,Rp130.950
handphone-tablet,aksesoris-tablet,Stylus Pen Huawei Matepad Tablet Huawei,Rp299.000
handphone-tablet,aksesoris-tablet,BACKDOOR TUTUP BELAKANG BACK COVER CASING XIAOMI Mi10T / Mi 10T PRO 5G,Rp48.000
handphone-tablet,aksesoris-tablet,"Samsung Keyboard Cover Tab S7, S7FE , S7+ Plus Original Garansi Resmi",Rp1.560.000
handphone-tablet,aksesoris-tablet,CHARGER REALME 3AMPERE POWER QUICK CHARGER MICRO V8,Rp22.000
handphone-tablet,aksesoris-tablet,iPad Pro 12.9 2021-2018 Inch Switcheasy Paperlike NOTE ANTI Blue,Rp179.000
handphone-tablet,aksesoris-tablet,Ringke Pen Holder Sleeve Apple Pencil Samsung S Pen Stylus iPad Tab,Rp105.000
handphone-tablet,aksesoris-tablet,Refill Nib Tip S Pen SAMSUNG Galaxy Tab S8 Ultra S8+ S8 Plus Original,Rp39.000
handphone-tablet,aksesoris-tablet,Apple iPhone 20W Fast Charging USB-C Adaptor Charger iPad Original,Rp399.000
handphone-tablet,aksesoris-tablet,IPHONE 11 CASE SPACE BENING + PROTEC CAMERA INDAH,Rp6.000
handphone-tablet,aksesoris-tablet,iPad Pro 11 2020 2021 M1 Air 4 Flip Case Autolock Slot Pen origami,Rp145.000
handphone-tablet,aksesoris-tablet,HYDROGEL Tempered Glass Huawei Matepad SE 10.4 | 10.4 2022 Full Layar,Rp59.000
handphone-tablet,aksesoris-tablet,UGREEN Stand IPad Pro 11 & 12.9 inch Metal Aluminium Alloy Foldable,Rp215.000
handphone-tablet,aksesoris-tablet,Case Samsung Galaxy Tab S7 Plus/S7 FE 5G BUMPER COMBO Keyboard Casing,Rp920.000
handphone-tablet,aksesoris-tablet,Otway MFI Charging Set C 18W Type C Cable OW-CLPD,Rp274.900
handphone-tablet,aksesoris-tablet,Anti Gores Paperlike Magnetic screen protector ipad Mini 6 2021,Rp100.000
handphone-tablet,aksesoris-tablet,STYLUS PEN IPAD 8 9 10.2 AIR 1 2 3 DUX DUCIS PALM REJECTION STYLUS,Rp275.000
handphone-tablet,aksesoris-tablet,SAMSUNG A04E SKIN CARBON 3D TRANSPARAN GARSKIN SAMSUNG A04E,Rp1.600
handphone-tablet,aksesoris-tablet,Stylus Pen Universal Robot RSP01 Capacitive Android iOS iPad Tablet,Rp50.000
handphone-tablet,aksesoris-tablet,Logitech keys to go Keyboard portable Slim for iPad iPhone Apple TV,Rp1.200.000
handphone-tablet,aksesoris-tablet,Cover Nib / Tip Apple Pencil 1st 2nd Gen Soft Case,Rp65.000
handphone-tablet,aksesoris-tablet,BATOK CHARGER / KEPALA CAS SAMSUNG 25W USB TYPE C TO C ORIGINAL,Rp125.000
handphone-tablet,aksesoris-tablet,CHARGER VIVO FLASH CHARGE V3330L TYPE C FAST CHARGING,Rp43.500
handphone-tablet,aksesoris-tablet,BACK COVER GLASS TUTUP BELAKANG BACKDOOR FOR IPHONE XR + RING KAMERA,Rp55.000
handphone-tablet,aksesoris-tablet,Case Oppo A71 2018 CPH1717 CPH1801 Softcase Gambar Kartun Pro Camera P,Rp25.000
handphone-tablet,aksesoris-tablet,Charger Samsung Galaxy A02 A02s Original 100% Micro USB Casan Ori,Rp50.000
handphone-tablet,aksesoris-tablet,SOFTCASE AIRBAG IPHONE 13 MINI/PRO/MAX ANTICRACK CLEAR/BENING TPU,Rp7.900
handphone-tablet,aksesoris-tablet,Anti Gores iPad Pro 11 inch M1 2021 PaperLike Matte Doff Screen Guard,Rp89.000
handphone-tablet,aksesoris-tablet,ROCKWARE RW-A12 - Universal 12-inch Multifunction Wireless Keyboard,Rp188.900
handphone-tablet,aksesoris-tablet,Soft case silikon ipad mini 1 2 3 4 5 karakter anak minnie dino,Rp135.000
handphone-tablet,aksesoris-tablet,carger ori copotan xiaomi 33w kabel oren,Rp150.000
handphone-tablet,aksesoris-tablet,Tempered Glass Poco M4 PRO 4G Anti Glare Gores Kaca Full Matte Dove,Rp12.500
handphone-tablet,aksesoris-tablet,"iPad Pro M1 11"" (2021) Smart V Transformer Case Cover Casing SLAVENS",Rp160.000
handphone-tablet,aksesoris-tablet,BASEUS Smooth Writing Capacitive Stylus (Active+Passive) - ACSXB-C,Rp379.000
handphone-tablet,aksesoris-tablet,"iPad Pro M1 11"" (2021) Smart V Transformer Case Cover Casing SLAVENS",Rp160.000
handphone-tablet,aksesoris-tablet,BASEUS Smooth Writing Capacitive Stylus (Active+Passive) - ACSXB-C,Rp379.000
handphone-tablet,aksesoris-tablet,Casing Custom Unik,Rp25.000
handphone-tablet,aksesoris-tablet,PB-48 - Car Headrest Phone Tablet Holder - Dudukan Smartphone di Mobil,Rp99.000
handphone-tablet,aksesoris-tablet,TERA Universal Plug Adaptor Multi-Country,Rp22.000
handphone-tablet,aksesoris-tablet,REALME PAD MINI SOFT CASE BENING FLIP COVER SMART CASE TABLET CASING,Rp50.000
handphone-tablet,aksesoris-tablet,Screen Guard Paperlike SwitchEasy Anti Gores iPad Pro M1 2021 2020,Rp300.000
handphone-tablet,aksesoris-tablet,COPPER IPAD PRO M2 - 2022 ( 11 INCH ) Magnetic Case,Rp296.900
handphone-tablet,aksesoris-tablet,Casing Space Clear Case Impact Anti Kuning iPhone 11 Pro Max,Rp20.000
handphone-tablet,aksesoris-tablet,Case i-crystal INFINIX SMART 5/SMART 6 /new hard case belt clip robot,Rp20.200
handphone-tablet,aksesoris-tablet,UGREEN Type C To Lightning Kabel Charger PD MFI 1M Fas Charging Iphone,Rp99.500
handphone-tablet,aksesoris-tablet,"SILIKON CASE ANAK IPAD MINI 8.3INCH 7 8 9 10.2INCH AIR 4 10.9"" PRO 11",Rp92.500
handphone-tablet,aksesoris-tablet,Universal Car Holder untuk iPad Tab Tablet PC,Rp50.000
handphone-tablet,aksesoris-tablet,IPHONE 12 12 PRO 12 PRO MAX | MAGSAFE CASE MAGNETIC CLEAR PREMIUM,Rp29.400
handphone-tablet,aksesoris-tablet,Casing custom case for ADVAN G5 100% presisi bukan modivikasi,Rp38.000
handphone-tablet,aksesoris-tablet,Ipad 9 2021 10.2 ipad 8 10.2 Anti GLARE DOFF MATTE Tempered Glass,Rp80.000
handphone-tablet,aksesoris-tablet,Kepala Adaptor Charger Samsung 45W USB C Super Fast Charging,Rp36.000
handphone-tablet,aksesoris-tablet,Tempered Glass HD iPhone XR / 11,Rp20.000
handphone-tablet,aksesoris-tablet,Case bening samsung a04 a04s a13 a20 a30 a50 a30s a50s a51 a52a71 a72,Rp12.000
handphone-tablet,aksesoris-tablet,"Temper Glass Xiaomi Redmi Pad 10.61"" Anti Blue Light Anti Radiasi",Rp25.999
handphone-tablet,aksesoris-tablet,TEMPERED GLASS CERAMIC MATTE SPY ANTI GLARE TYPE VIVO Y12,Rp7.000
handphone-tablet,aksesoris-tablet,APPLE THUNDERBOLT 3 USB-C TO THUNDERBOLT 2 ADAPTER ORIGINAL RESMI IBOX,Rp750.000
handphone-tablet,aksesoris-tablet,Charger Dock samsung galaxy watch 42mm / 46mm SM-R805 / SM-R815,Rp85.000
handphone-tablet,aksesoris-tablet,ESR Tempered Glass Screen Guard Protector for iPad 7 8 9 Gen 10.2 Inch,Rp199.000
handphone-tablet,aksesoris-tablet,Samsung Galaxy Tab A7 Lite T225 8 Inch Free Standing Case Cover,Rp92.500
handphone-tablet,aksesoris-tablet,Magsafe Case magnetic Samsung S22 S22+ Plus S22 Ultra Casing wireless,Rp99.999
handphone-tablet,aksesoris-tablet,BATOK EP-TA800 ORI 99% SAMSUNG NOTE 10 FAST CHARGING 25W NON KABEL,Rp22.000
handphone-tablet,aksesoris-tablet,Holder HP Dashboard Mobil / Strong Mount Stand Car PhoneHolder,Rp19.920
handphone-tablet,aksesoris-tablet,OTG USB CABLE TYPE C 2IN1 MICRO USB WIRED TYPE C FAST CHARGING DATA,Rp8.500
handphone-tablet,aksesoris-tablet,Tempered Glass Ibywind Samsung Galaxy S21 FE,Rp110.000
handphone-tablet,aksesoris-tablet,Samsung Galaxy Tab S2 9.7 T815 T810 Defender Lite Armor Case,Rp85.000
handphone-tablet,aksesoris-tablet,Exclushield Tempered Glass By Asoris - Full,Rp51.500
handphone-tablet,aksesoris-tablet,Samsung Galaxy Tab S8 Plus / Tab S8 | Paper Like Screen Protector S8+,Rp64.900
handphone-tablet,aksesoris-tablet,Case Xiaomi Redmi A1 Transparent Airbag Shockproof + Tempered Glass,Rp25.000
handphone-tablet,aksesoris-tablet,Keyboard Case 8inch Universal Android Sarung Keyboard Tablet 8inch,Rp73.000
handphone-tablet,aksesoris-tablet,Tempered Glass Samsung A23,Rp19.000
handphone-tablet,aksesoris-tablet,Dux Ducis Paperfeel Paperlike Screen Protector iPad Anti Gores Matte,Rp135.000
handphone-tablet,aksesoris-tablet,Samsung slim standing cover Z fold 4 5G Original Black-Beige,Rp525.000
handphone-tablet,aksesoris-tablet,Case Casing softcase samsung Galaxy A71 Softcase premiun ori A 71,Rp75.000
handphone-tablet,aksesoris-tablet,COPPER Adapter Charger GAN CP1005| 3Port 65W QC 3.0 Super FastCharging,Rp349.900
handphone-tablet,aksesoris-tablet,TPU Screen Protector ibywind Xiaomi 12 Paket Lengkap,Rp99.000
handphone-tablet,aksesoris-tablet,Baseus 2in1 Universal Capacitive Stylus Pen Tablet Apple iPad iPhone,Rp105.000
handphone-tablet,aksesoris-tablet,Infinix Note 12 2023 Tempered Glass Layar Full Glue Anti Spy PRIVACY,Rp25.000
handphone-tablet,aksesoris-tablet,CASE IPAD 10 10.9 inch SMART CASE book cover Leather iPAD 10 SLOT PEN,Rp57.500
handphone-tablet,aksesoris-tablet,flip case xiaomi redmi 6A / redmi 7 / redmi 7A flip dompet kulit hp,Rp21.000
handphone-tablet,aksesoris-tablet,Sticker Skin Pelindung Apple pencil,Rp25.000
handphone-tablet,aksesoris-tablet,ORIGINAL SAMSUNG CAR CHARGER TYPE C 25W 3A SUPER FAST CHARGING ADAPTOR,Rp50.000
handphone-tablet,aksesoris-tablet,Stylus Pen Sketsa Advan |Original Product,Rp225.000
handphone-tablet,aksesoris-tablet,Advan STARTGO Power Up Wall Charger 18W Pengisi Daya Quick Charge 3.0,Rp29.000
handphone-tablet,aksesoris-tablet,"iPad Pro 12.9 12,9 Inch Inci 2015 2017 Bookcover Kesing Leather Case",Rp167.900
handphone-tablet,aksesoris-tablet,BLU SMILE Checkered Case Iphone 7 8 Plus X XS XR 11 12 13 PRO MAX MINI,Rp17.999
handphone-tablet,aksesoris-tablet,Lamina Tempered Glass for iPhone 13/13 Pro/iPhone 13 Pro Max/14 Plus,Rp75.000
handphone-tablet,aksesoris-tablet,Magsafe Power Pack Traveler / Pack Fast Charging,Rp249.900
handphone-tablet,aksesoris-tablet,Leather Case iPhone 14 Pro Max Plus Card Slot Casing Kulit Hard case,Rp120.000
handphone-tablet,aksesoris-tablet,Mini Keyboard Wireless Bluetooth Built In TouchPad IS11-BT05,Rp300.000
handphone-tablet,aksesoris-tablet,APPLE SLEEVE LEATHER IPAD PRO 11 2020 2021 M1 POUCH PENCIL SLOT PRO11,Rp190.000
handphone-tablet,aksesoris-tablet,Samsung Galaxy Tab S6 Lite P615 Anti Crack Case Stylus Slot,Rp30.000
handphone-tablet,aksesoris-tablet,Handle Tempel Box Hardcase Besi Chrome 202 Handel Hard Case Mixer,Rp16.000
handphone-tablet,aksesoris-tablet,Tempered Glass Anti Spy iPhone 6 / 6S | Anti Gores Screen - Hitam,Rp24.900
handphone-tablet,aksesoris-tablet,ANKER A1641 - 633 Magnetic Battery MagGo for iPhone 12-13 Series,Rp999.000
handphone-tablet,aksesoris-tablet,Case Samsung Tab S5e 10.5 2019 T725 T720 Flip Cover Autolock Slot Pen,Rp125.000
handphone-tablet,aksesoris-tablet,SMART DEVIL TEMPERED GLASS XIAOMI POCO F4,Rp92.000
handphone-tablet,aksesoris-tablet,FLIP CASE UNIVERSAL TABLET 7/8/9/10 INCH ROTARY FLIP LEATHER COVER,Rp50.500
handphone-tablet,aksesoris-tablet,"Samsung Galaxy Tab S8 / 11"" - COPPER TEMPERED GLASS FULL CLEAR",Rp109.900
handphone-tablet,aksesoris-tablet,300% Charger xiaomi FAST CHARGING 33 watt TURBO MI Note 10 Pro poco x3,Rp90.750
handphone-tablet,aksesoris-tablet,Casing Housing Samsung Galaxy J5 Prime Sm G570 Original,Rp39.000
handphone-tablet,aksesoris-tablet,"IPAD 9 / 10,2"" (2021) - COPPER Screen Protector PaperLike",Rp194.500
handphone-tablet,aksesoris-tablet,Keyboard Smartphone Tablet Laptop Wireless Mini Koneksi Bluetooth Cas,Rp57.500
handphone-tablet,aksesoris-tablet,Pen Stylus Pulpen Stilus Touchscreen Tablet HP Android iPhone iPad Tab,Rp12.500
handphone-tablet,aksesoris-tablet,Tempered Glass IPAD PRO 9.7 inch 2016 Anti Gores Kaca Tablet,Rp27.500
handphone-tablet,aksesoris-tablet,REDMI NOTE 10 PRO TEMPERED GLASS ANTIGORES CERAMIC PRIVACY SPY MATTE,Rp12.000
handphone-tablet,aksesoris-tablet,Case iPad Air Pro 2020 10.9“ 11” 12.9” CoverBuddy Switcheasy inc,Rp490.000
handphone-tablet,aksesoris-tablet,Kabel Data Realme Micro Fast Charging VOOC Micro USB READY MAKASSAR,Rp8.500
handphone-tablet,aksesoris-tablet,Tempered Glass Blue Light Full Samsung Galaxy A12 Anti Radiasi,Rp14.500
handphone-tablet,aksesoris-tablet,iPad 10.2 2021 Gen 9 A2603 A2604 Soft Kids Case Tablet Casing Softcase,Rp157.000
handphone-tablet,aksesoris-tablet,SAMSUNG Stylus S Pen Galaxy Tab S6 Original 100%,Rp395.000
handphone-tablet,aksesoris-tablet,iLock Adjustable Tablet Stand and Security Lock for 7 to 10.1 inch,Rp730.000
handphone-tablet,aksesoris-tablet,SCREEN PROTECTOR FILM TEMPERED CERAMIC MATTE REALME 3 PRO 5 PRO C2,Rp7.500
handphone-tablet,aksesoris-tablet,Case iPad Pro 11 | 12.9 2018 Baseus Simplism Magnetic Leather Cover,Rp249.000
handphone-tablet,aksesoris-tablet,"Tempered Glass Premium iPad 7,8,9 | 10,2 inch Anti Gores Kaca Tablet",Rp49.000
handphone-tablet,aksesoris-tablet,IPHONE 14 / 14 Max / 14 Pro / 1 Promax Hydrogel CLEAR Bezel Body Side,Rp25.000
handphone-tablet,aksesoris-tablet,Paperfeel Anti Gores Samsung Tab S8 | Tab S8 Plus | Tab S8 Ultra - DD,Rp155.000
handphone-tablet,aksesoris-tablet,Case Samsung A13 4G Prime Casing Transparent Free Tempered Glass +Skin,Rp17.500
handphone-tablet,aksesoris-tablet,FLIP LEATHER XIAOMI POCO C40 POCO X3 GT FLIP CASE WALLET,Rp20.200
handphone-tablet,aksesoris-tablet,iPad Pro 11 2018 2020 2021 MAGNETIC PAPERLIKE SCREEN GUARD PROTECTOR,Rp187.000
handphone-tablet,aksesoris-tablet,Case Samsung Galaxy Tab A7 Lite 2021 T225 Dux Ducis Toby Cover Casing,Rp179.000
handphone-tablet,aksesoris-tablet,Apple Pencil 1 / Gen 1 Brandnew Garansi Apple bs kirim pake GOJEK/GRAB,Rp1.488.000
handphone-tablet,aksesoris-tablet,IPad 10 10th Gen 2022 Paper Like Matte Tempered Glass Anti Gores Glare,Rp108.000
handphone-tablet,aksesoris-tablet,Flip Smart Cover Softcase Soft Case HUAWEI Matepad 11 2021,Rp100.000
handphone-tablet,aksesoris-tablet,Bluetooth Wireless keyboard with touchpad Universal,Rp165.000
handphone-tablet,aksesoris-tablet,Baseus 45W USB Charger Adapter Auto Power Off Digital Display QC 3.0 U,Rp289.000
handphone-tablet,aksesoris-tablet,IPAD 10 2022 / IPAD 10.9 INCH DUX DUCIS KEYBOARD CASE ORIGINAL,Rp499.000
handphone-tablet,aksesoris-tablet,Case Samsung A50 Casing Transparent Free Tempered Glass + Skin,Rp25.500
handphone-tablet,aksesoris-tablet,Robot RT-OTG01 Converter Charger Adapter Usb Type C To Micro Usb,Rp19.000
handphone-tablet,aksesoris-tablet,Case Ipad 9 th 9th Gen 10.2 Inch 2021 Smartcase with Pen Holder,Rp99.900
handphone-tablet,aksesoris-tablet,BASEUS MAGNETIC CAR MOUNT PHONE HOLDER MOBIL 360 UNIVERSAL DASHBOARD,Rp99.000
handphone-tablet,aksesoris-tablet,"Soft Case Silikon Samsung Galaxy Tab S8, Plus Ultra Bening transparant",Rp60.000
handphone-tablet,aksesoris-tablet,LOGITECH KEYBOARD BLUETOOTH K380 / WIRELESS K380 MULTI DEVICE ORIGINAL,Rp434.700
handphone-tablet,aksesoris-tablet,Wireless Bluetooth Keyboard LED Backlight Backlit Gamer Ipad Tablet HP,Rp72.500
handphone-tablet,aksesoris-tablet,"STYLUS IPAD 10 PEN GEN 1 RECHARGEABLE PENCIL IPAD GEN 1O 10,9 INCH",Rp182.500
handphone-tablet,aksesoris-tablet,IPAD 10 2022 / IPAD 10.9 INCH DUX DUCIS PANDA KIDS CASE STANDING KIDS,Rp165.000
handphone-tablet,aksesoris-tablet,iPad 10 10.9 inch 2022 10th Gen Tempered Glass Anti Gores Screen Guard,Rp99.000
handphone-tablet,aksesoris-tablet,SS197 - GAMING COOLING PHONE CASE IPHONE 11 - 12 - 13 - PRO - MAX,Rp129.700
handphone-tablet,aksesoris-tablet,Holder Tablet Model Boom Arm Table Lazypod Stand,Rp35.000
handphone-tablet,aksesoris-tablet,VIVO Y90 Y91 Y91C Y91 - ANTI GORES CERAMIC MATTE FILM SPY ANTI PRIVACY,Rp5.900
handphone-tablet,aksesoris-tablet,Case Iphone MAGNETIC ULTRA THIN TPU MATTE 11 12 13 PRO MAX,Rp67.000
handphone-tablet,aksesoris-tablet,TEMPERED GLASS ADVAN TAB 8/TAB 8 BELAJAR/TAB BELAJAR ELITE/TAB 7,Rp23.900
handphone-tablet,aksesoris-tablet,Samsung Tab S8 S7 Plus S7 Fe 12.4 Flip Pu Leather Cover Slot Pen Case,Rp58.000
handphone-tablet,aksesoris-tablet,Tecnix CMH-019 Car Holder Universal 360° Mobile Phone Stand,Rp38.000
handphone-tablet,aksesoris-tablet,Tempered Glass Samsung A52/A52S Anti Gores Matte Anti Glare Full Layar,Rp13.500
handphone-tablet,aksesoris-tablet,Case iPhone X XR XS 11 Pro Max Soft Silicone Frame 3 in 1 SQUARE EDGE,Rp29.000
handphone-tablet,aksesoris-tablet,"Logitech Combo Touch Keyboard Case for iPad Pro 11"" / 12.9""",Rp2.779.000
handphone-tablet,aksesoris-tablet,Anker Kabel Charger Anker Powerline III Flow Type C to Lightning 6ft -,Rp229.000
handphone-tablet,aksesoris-tablet,STYLUS SPEN CAPATIVE ACTIVE FOR ADVAN TAB VX 10.4,Rp120.000
handphone-tablet,aksesoris-tablet,Adapter converter headset IPHONE 7 8 X LIGHTNING - JACK 3.5MM ORIGINAL,Rp135.000
handphone-tablet,aksesoris-tablet,ESR Rebound Magnetic Case for iPad Air 4 2020 10.9 inch,Rp300.000
handphone-tablet,aksesoris-tablet,Kabel Charge Anker PowerLine Micro 3ft /0.9m - A8132,Rp32.999
handphone-tablet,aksesoris-tablet,Universal 9 Inchi Tempered Glass Anti Gores Original FS for Tablet,Rp40.000
handphone-tablet,aksesoris-tablet,"Keyboard Case iPad 5/6 9.7,iPad 7/8 10.2,iPad Air 3 10.5, iPad Pro 11",Rp80.000
handphone-tablet,aksesoris-tablet,"TEMPERED GLASS 2,5D FOR IPHONE 4/5/4 BACK/5 BACK/6 BACK/6+ BACK",Rp600
handphone-tablet,aksesoris-tablet,KURA Flat Casing - Soft Case iPhone X Xs Max,Rp65.000
handphone-tablet,aksesoris-tablet,Apple leather case iphone x xs ibox Charcoal Grey,Rp235.000
handphone-tablet,aksesoris-tablet,Detaito premium import,Rp26.000
handphone-tablet,aksesoris-tablet,Case Samsung C9 Pro Hard Case Robot Iron Man Ultra Slim Fit Case,Rp41.000
handphone-tablet,aksesoris-tablet,9Skin - Premium Skin Protector for ASUS ROG Flow Z13 - Matte Guard,Rp199.000
handphone-tablet,aksesoris-tablet,iPad Pro 12.9 2015 2017 Origami Leather Flip Book Cover Case Casing,Rp164.000
handphone-tablet,aksesoris-tablet,Stylus UNEED Universal Capacitive Pen Android Windows Samsung USY102,Rp192.000
handphone-tablet,aksesoris-tablet,BASEUS Smooth Writing Capacitive Stylus (Active) - ACSXB-B,Rp369.000
handphone-tablet,aksesoris-tablet,Goojodoq 13 GD13 iPad Pen Stylus Wireless Charging 4 Tip,Rp499.000
handphone-tablet,aksesoris-tablet,A1692 - CHARGER CASAN HP IPHONE X 11 12 13 + KABEL ORIGINAL,Rp30.000
handphone-tablet,aksesoris-tablet,New skin HD case iphone for 11 12 13 pro max,Rp125.000
handphone-tablet,aksesoris-tablet,converter iphone lightning to 3.55mm headset / adapter sambungan audio,Rp59.999
handphone-tablet,aksesoris-tablet,Samsung Tab A8 10.5 2022 (X205) - Flip Leather Case Casing Cover,Rp99.000
handphone-tablet,aksesoris-tablet,Softcase Anti crack Casing for Samsung Galaxy J7 Pro 2017 - Clear,Rp8.250
handphone-tablet,aksesoris-tablet,VIVO Y21/Y21A/Y21E/Y21G/Y21S/Y21T TEMPERED GLASS ANTI MINYAK,Rp4.500
handphone-tablet,aksesoris-tablet,soft case iphone pupil eye holder stand transparan 11 12 13 14 pro max,Rp27.500
handphone-tablet,aksesoris-tablet,charger untuk apple pencil 2 goojodoq gen 13 GD13,Rp175.000
handphone-tablet,aksesoris-tablet,SMART FLIP CASE PREMIUM KEYBOARD TOUCHPAD FOR SAMSUNG S6 LITE P610,Rp299.999
handphone-tablet,aksesoris-tablet,Case iPad Pro 11 2020 ESR Rebound Soft Shell Protective Ori - Black,Rp156.000
handphone-tablet,aksesoris-tablet,Foldable Phone Holder Stand HP di Meja Folding desktop,Rp14.500
handphone-tablet,aksesoris-tablet,Charger Apple iPhone Fast Charging 20W NEW Kualitas ORIGINAL - JKT,Rp125.000
handphone-tablet,aksesoris-tablet,BACK tempered glass BELAKANG IPHONE 13 PRO MAX MINI anti gores,Rp28.000
handphone-tablet,aksesoris-tablet,SAMSUNG TAB S2 8.0 FLIP COVER SARUNG TAB T710 T715 ROTARY LEATHER CASE,Rp17.500
handphone-tablet,aksesoris-tablet,COTEetCI Premium Full Tempered Glass Clear 9H IPAD MINI 6 Screen Guard,Rp79.000
handphone-tablet,aksesoris-tablet,Apple Magic Keyboard for iPad Pro 2022 M2 6th Gen 11 12.9 Black White,Rp4.179.000
handphone-tablet,aksesoris-tablet,Keyboard Bluetooth Anker Ultra Slim A7726 Anker A-7726,Rp229.700
handphone-tablet,aksesoris-tablet,tempered glass Ibywind SAMSUNG GALAXY S21 FE paket komplit,Rp100.000
handphone-tablet,aksesoris-tablet,BACKDOOR BACKCASE CASING TUTUP SAMSUNG GALAXY A30 A305 A305F ORIGINAL,Rp20.000
handphone-tablet,aksesoris-tablet,The Puffer Case BLACK only for Iphone Case/Casing Iphone the Puffer,Rp265.000
handphone-tablet,aksesoris-tablet,Casing iPhone 11 Pro 5.8 | 11 6.1 | Soft Case Magsafe Silicone Magneti,Rp31.000
handphone-tablet,aksesoris-tablet,CASING ARMOR STANDING COVER FREE TALI IPAD 9 10.2 2021,Rp275.000
handphone-tablet,aksesoris-tablet,Desk Mount Cable Management Tray Oximus C80 - Desk Storage,Rp119.900
handphone-tablet,aksesoris-tablet,Samsung Galaxy A53 A33 A73 5G Case Rugged Shield Soft Shockproof,Rp50.000
handphone-tablet,aksesoris-tablet,Goojodoq Stylus pen Universal Capacitive Stylus Touch for apel Android,Rp37.000
handphone-tablet,aksesoris-tablet,SAMSUNG TAB S8 / S8 PLUS Soft Case Ultrathin Silikon Casing Cover,Rp29.900
handphone-tablet,aksesoris-tablet,"Samsung Galaxy Tab A8 2022 10.5"" X200 Anti Gores Glare Tab A8 2022",Rp35.000
handphone-tablet,aksesoris-tablet,Case Realme 5i Casing Transparent Free Tempered Glass + Skin,Rp25.500
handphone-tablet,aksesoris-tablet,Case iPad Pro M1 2021 | 2020 11 12.9 inch Dux Ducis Toby Cover Casing,Rp169.000
handphone-tablet,aksesoris-tablet,SAMSUNG Stylus S Pen Galaxy Note 10+ Note 10 Plus Original 100%,Rp335.000
handphone-tablet,aksesoris-tablet,Tempered glass full samsung A02s A03 A03s A13 A23 antigores kaca layar,Rp9.000
handphone-tablet,aksesoris-tablet,Temper Glass IPAD AIR 4 2020 Anti Gores kaca Premium High Quality,Rp38.430
handphone-tablet,aksesoris-tablet,STYLUS PEN UNIVERSAL FOR ANDROID TABLET APPLE IPHONE TOUCH SCREEN PEN,Rp10.000
handphone-tablet,aksesoris-tablet,Travel Blue World to USA Travel Adaptor TB912,Rp129.900
handphone-tablet,aksesoris-tablet,Backdoor Backcover Tutup Belakang HUAWEI P30 PRO Tutup Batre,Rp65.000
handphone-tablet,aksesoris-tablet,Casing Apple pencil case cover silicone 1 1st 2 2nd 3 3rd 4 4th gen,Rp75.000
handphone-tablet,aksesoris-tablet,"iPad 10 / 10,9"" 2022 - COPPER TEMPERED GLASS FULL CLEAR",Rp109.900
handphone-tablet,aksesoris-tablet,HAGIBIS PHONE HOLDER STAND FOLDABLE METAL DUDUKAN UNIVERSAL IPAD TABLE,Rp129.000
handphone-tablet,aksesoris-tablet,Pen Stylus 2in1 Touch Screen Stylus Ballpoint For Smartphone,Rp2.699
handphone-tablet,aksesoris-tablet,"ugreen cas charger 5v 2,1A kabel lightning MFI iphone 5 6 7 8 x xr xs",Rp63.000
handphone-tablet,aksesoris-tablet,Samsung Tab T870 T875 S7 S7 Plus Silicon Ultrathin Case Casing Soft,Rp31.500
handphone-tablet,aksesoris-tablet,Smart Case Ipad Pro 11 inch 2018 Monocozzi Apple Pencil Cover Original,Rp445.000
handphone-tablet,aksesoris-tablet,Hard Case iPad 10.2 ESR Ascend Trifold Back,Rp167.900
handphone-tablet,aksesoris-tablet,Vivo Y12 Y15 Y17 Hikaru Premium Tempered Glass Anti Gores Kaca,Rp25.000
handphone-tablet,aksesoris-tablet,TRIPLEDI Case iPad Mini 6 8.3 inch Keyboard Bluetooth Backlit Stylus,Rp694.600
handphone-tablet,aksesoris-tablet,SCREEN PROTECTOR HIDROGEL SAMSUNG S21 S21 PLUS S21 ULTRA,Rp13.500
handphone-tablet,aksesoris-tablet,Anti Gores Ceramic Glare Ipad Mini Ipad Mini 2 3 Ipad Mini 4 5 Mini 6,Rp16.500
handphone-tablet,aksesoris-tablet,Case iPhone 14 PRO MAX 14 PRO UAG PATHFINDER With Magsafe Compatible,Rp746.170
handphone-tablet,aksesoris-tablet,SwitchEasy EasyPencil Pro 4 Apple Pencil iPad Stylus Pen Original,Rp699.000
handphone-tablet,aksesoris-tablet,Samsung Galaxy Tab A8 2022 10.5 X205 Bluemoon Flip Case,Rp65.000
handphone-tablet,aksesoris-tablet,TERA T Multi Way Plug Adaptor - 4 Ways Socket,Rp29.000
handphone-tablet,aksesoris-tablet,Stylus Pen SPen SAMSUNG GALAXY NOTE 9 OEM - S Pen Pencil SAMSUNG Note9,Rp55.900
handphone-tablet,aksesoris-tablet,Tempered Glass TG Privacy Anti Spy - Redmi Note 5 6 7 8 9 10 Pro,Rp16.999
handphone-tablet,aksesoris-tablet,charger 5 port USB Charging station wireless fastcharging PD qualcomm,Rp375.000
handphone-tablet,aksesoris-tablet,Charger Smartwatch Magnetic 2 Pin,Rp40.000
handphone-tablet,aksesoris-tablet,Apple iPad 2 smart cover / Leather Case Auto lock,Rp85.000
handphone-tablet,aksesoris-tablet,Gub P20 Holder HP Phone Holder Aluminium Alloy Dudukan HP Sepeda Motor,Rp100.000
handphone-tablet,aksesoris-tablet,Charger Adapter Samsung Original 25W USB-C,Rp258.000
handphone-tablet,aksesoris-tablet,Pulpen Stylus Tablet Pen Touchscreen Universal Pen Tablet TD0213 Black,Rp26.910
handphone-tablet,aksesoris-tablet,Hydrogel Back XIAOMI 10 12 9T 10T 11T PRO Anti Shock Jelly Clear/Matte,Rp18.900
handphone-tablet,aksesoris-tablet,Anker Powerport+ 5 USB & Type C PD Fast Charging PowerIQ MultiProtect,Rp625.000
handphone-tablet,aksesoris-tablet,BACKDOOR BACK CASING TUTUP BELAKANG BATERAI FOR HUAWEIII NOVA 5T,Rp43.000
handphone-tablet,aksesoris-tablet,[iP 11-13] Case / Casing iPhone Cermin - Case iPhone Premium,Rp17.100
handphone-tablet,aksesoris-tablet,USAMS ZB057 TOUCH SCREEN CAPACITIVE STYLUS PENCIL IOS|ANDROID|WINDOWS,Rp245.000
handphone-tablet,aksesoris-tablet,Realme GT Neo 3T Anti Gores Kaca Tempered Glass Hikaru Bening,Rp24.000
handphone-tablet,aksesoris-tablet,Charger Oppo Reno 5 Reno 6 Reno 7 Original 100% Super VOOC 65W USB C,Rp75.000
handphone-tablet,aksesoris-tablet,Vivan Organized Bag Vbg-S01 Portable Soft Case For Digital Gadgets,Rp55.000
handphone-tablet,aksesoris-tablet,Alat display putar produk rotating rotasi 360 untuk fotografi display,Rp123.500
handphone-tablet,aksesoris-tablet,Anti Crack Redmi 10c,Rp19.000
handphone-tablet,aksesoris-tablet,SAMSUNG A6/A6+/A60/A7 2018/A70 TEMPERED GLASS ANTI MINYAK,Rp4.500
handphone-tablet,aksesoris-tablet,flip case samsung J8 / J510 / J710 / J4+ flip dompet kulit hp,Rp21.000
handphone-tablet,aksesoris-tablet,Case Samsung Galaxy Tab S8 Plus S8 S7 Plus S7 FE S7 Dux Ducis Domo ORI,Rp149.000
handphone-tablet,aksesoris-tablet,for Xiaomi Mi Band 7 SCREEN PROTECTOR Pet Film Anti Gores LIS BLACK,Rp29.900
handphone-tablet,aksesoris-tablet,Case Casing Bear Cute Xiaomi Redmi 8 8A 9 9A 9C 9T 10 Square Edge,Rp16.500
handphone-tablet,aksesoris-tablet,Charger Samsung Original 25 Watt power delivery garansi resmi sein,Rp229.000
handphone-tablet,aksesoris-tablet,IT Plug IT 20 Cube Wall Charger USB C 20W Fast Charging Kepala Adaptor,Rp199.000
handphone-tablet,aksesoris-tablet,Dus Box Kotak iPad Mini 5 / 6,Rp89.900
handphone-tablet,aksesoris-tablet,Backdoor Mi Max 2,Rp85.000
handphone-tablet,aksesoris-tablet,Mocolo Tempered Glass Screen Protector iPad Air 4 5 Pro 11 Pro 12.9,Rp145.000
handphone-tablet,aksesoris-tablet,2022 Premium Magic Keyboard for XIAOMI Redmi Pad 10.61 inch Backlight,Rp1.099.000
