base_type,type_,text,price
elektronik,lampu,Lampu Jalan PJU LED SOLAR CELL 90W Panel Surya SOROT 90 WATT,Rp225.000
elektronik,lampu,VT LAMPU HIAS TANGGA PAGAR DINDING TAMAN TENAGA SURYA SOLAR 1 PC,Rp13.500
elektronik,lampu,LAMPU LED MURAH SLOVEENS 5W PUTIH,Rp3.850
elektronik,lampu,Hannochs Lampu LED Premier 40 watt - cahaya Putih,Rp107.600
elektronik,lampu,lampu kulkas LED E12/E14/E17,Rp8.500
elektronik,lampu,Camelion Senter LED FL1L 2 X Baterai D,Rp29.000
elektronik,lampu,LED 3528 Blue 460-470nm SMD Chip 1210 Warna Biru,Rp200
elektronik,lampu,"PHILIPS LED MYCARE 14,5 W WATT 14,5W WARM WHITE CAHAYA KUNING",Rp52.700
elektronik,lampu,"PROMO Lampu Bohlam LED Sonic 6w,10w,13w Hannochs ISI 4Pcs Cahaya Putih",Rp41.500
elektronik,lampu,ECOLINK Lampu LED 8W Bulb Bohlam 8 w watt KUNING Warm White,Rp18.900
elektronik,lampu,Philips LED Paket Multipack Bulb 4W 6W 8W 10W 12W,Rp88.450
elektronik,lampu,LAMPU LED NEON FLEX AC 220V (PERMETER) PILIH WARNA,Rp13.000
elektronik,lampu,MORGEN LED Bulb Grand Lampu Hemat Beli 2 Gratis 1 Putih 6500K 7 Watt,Rp39.000
elektronik,lampu,Hannochs Lampu LED Nova 18W Cahaya Putih,Rp29.700
elektronik,lampu,INLITE Downlight Panel Light LED Inbow 12W Bulat INPS628R,Rp57.600
elektronik,lampu,Lampu Proyektor Langit Malam Bintang Galaxy Nebula Lamp Starry Project,Rp142.800
elektronik,lampu,"Philips DL262 Magneos 4W, 6W, 9W, 12W",Rp59.500
elektronik,lampu,Lampu LED PHILIPS 12W paket isi 4 pembelian kelipatan 4 PROMO TERMURAH,Rp37.950
elektronik,lampu,PHILIPS ECOFIT 16W 1200mm PUTIH 6500K NATURAL 4000K TL T8 16 W WATT,Rp41.400
elektronik,lampu,PESONACOM BOHLAM LED 7 Watt 9 Watt 12 Watt 15 Watt 18 Watt 23 Watt SNI,Rp8.400
elektronik,lampu,HANNOCHS Sonic Lampu LED 13W Bohlam 13 w watt Putih Bulb 13watt PAKET,Rp84.600
elektronik,lampu,Lampu LED USB Mini bentuk Flashdisk 3 / 8 Mata LED Kuning dan Putih,Rp5.500
elektronik,lampu,ACE - Krisbow Set 5 Pcs Bohlam Led 3 W - Warm White,Rp74.900
elektronik,lampu,Lampu Led Bulb INLITE 3W 3 Watt Putih Kuning IN-LITE INB007 SAMSUNG,Rp10.800
elektronik,lampu,Hannochs Lampu Bolam Led 18 Watt Premier,Rp47.000
elektronik,lampu,Audalux Led Surface Light Lampu Lemari OB Outbow 3w 3 watt 3 w Led,Rp14.500
elektronik,lampu,LAMPU BULB INLITE 5 7 9 11WATT KUNING ISI 4PCS LED BOHLAM IN LITE,Rp40.300
elektronik,lampu,Senter SURYA SHT L320 / Lampu Emergency / Emergency Lamp / Senter LED,Rp28.129
elektronik,lampu,Senter LED USB Cree T6 COB Magnet Rechargeable TaffLED WY8106 Taffware,Rp58.900
elektronik,lampu,Senter LED USB Cree T6 COB Magnet Rechargeable TaffLED WY8106 Taffware,Rp58.900
elektronik,lampu,Lampu Led Bola/Bohlam Warna Warni Model Bola 3W Javotec,Rp3.950
elektronik,lampu,Lampu Led Jagung/Candle 12W Fitting E27 3warna Putih/Kuning/Warm White,Rp9.900
elektronik,lampu,Lampu LED 50Watt Bohlam LED 50W Murah Garansi 1 Tahun SCORE Capsul,Rp39.000
elektronik,lampu,Lampu Bolham 5w 10w 15w 20w 30w Led Bulb Hinomaru Premier,Rp4.320
elektronik,lampu,Fitting Lampu Sambungan Ukuran E27 Panjang 20cm flexible,Rp13.500
elektronik,lampu,Lampu Layar Komputer Xiaomi Mijia Hanging Lamp Light Bar Monitor,Rp520.000
elektronik,lampu,Lampu LED Strip RGB Warna Warni Waterproof Remote Adaptor Modul 5 Mtr,Rp41.900
elektronik,lampu,HANNOCHS Sonic Bohlam LED CoolDaylight/Warm White -3W 5W 7W 9W 12W 15W,Rp10.500
elektronik,lampu,"DOWNLIGHT 4INCH 4 INCH KAP DOWNLIGHT / RUMAH LAMPU 4"" FITTING E27",Rp21.900
elektronik,lampu,Kabel Fitting Lampu Cafe Gantung Outdoor 5 meter / 10 meter,Rp61.750
elektronik,lampu,Lampu LED TUMBLR Kawat Lampu strip dekorasi Waterproof - 1M WarmWhite,Rp1.999
elektronik,lampu,bohlam lampu led hannochs vario 6 watt,Rp11.500
elektronik,lampu,Lampu LED Bulb Paket Ecolink 10w 10 Watt Paket Ecolink Putih / Kuning,Rp66.000
elektronik,lampu,LED Strip Flexible 5050 300 LED per Rol 12V Waterproof IP65 Putih,Rp57.000
elektronik,lampu,Philips Eridani DL190B LED3 D80 3.5W WH SNI,Rp32.780
elektronik,lampu,FANTECH Lampu LED Strip Light RGBWW 3 Meter Warna Warni,Rp149.000
elektronik,lampu,LAMPU PLAFON MINIMALIS LED 3 WARNA / LAMPU LED LORONG / TERAS,Rp235.000
elektronik,lampu,SENTER SWAT LED MINI / SENTER MINI CAS / SENTER LED POLICE CHARGEABLE,Rp16.350
elektronik,lampu,LAMPU DOWNLIGHT PLAFON 5 WATT FULL 5W VARIAN ADA PUTIH / WARMWHITE,Rp8.500
elektronik,lampu,lampu downlight led panel 12w tipis bulat inbow putih or kuning/warm,Rp25.000
elektronik,lampu,lampu sorot led 400 watt 400w led tembak outdoor 400w,Rp272.250
elektronik,lampu,Lampu Kawat Led Fairy Light Copper Wire Kedip,Rp11.000
elektronik,lampu,Lampu TL Neon T5 LED 13W 90cm Tube 90 cm 13 w watt WHITE PUTIH 14 15,Rp28.900
elektronik,lampu,Lampu LED Spot Light Spotlight Cob Dowlight Sorot Panasonic 5 watt 5W,Rp53.000
elektronik,lampu,Lampu Dinding / Lampu Pilar / Wall Lamp Kotak Minimalis 2 Arah,Rp95.000
elektronik,lampu,Panel LED 12 Watt Inbow Lampu Downlight LED Panel Bulat,Rp13.999
elektronik,lampu,PCB LED AC 18 w new BM,Rp13.000
elektronik,lampu,lampu led Phillips paket 12 Watt,Rp155.900
elektronik,lampu,LAMPU JALAN PJU LED 100W KOBRA 100 WATT COBRA 100 W COB GARANSI 1 THN,Rp199.950
elektronik,lampu,PHILIPS SMART WIFI LED 13W RGB & TUNABLE E27 A67 CRI90 WIZ CONNECTED,Rp85.000
elektronik,lampu,FITING LAMPU CABANG FITTING CABANG ULIR E27 1-7 CABANG,Rp5.980
elektronik,lampu,Lampu Philips Led Pack 4w 6w 8w 10w 12w,Rp104.100
elektronik,lampu,Meson 59467 150 17W Philips LED Downlight Kotak,Rp103.250
elektronik,lampu,LAMPU PHILIPS PAKET LED MYCARE 12W 12 W WATT BELI 3 GRATIS 1 PUTIH,Rp149.000
elektronik,lampu,Kap Lampu Jalan Fitting E27 SNI / Kap Lampu Jalan PJU Fitting E27 SNI,Rp55.000
elektronik,lampu,Lampu LED Philips Essential LED MR16 3W 220V Kuning 3 Watt Halogen LED,Rp35.696
elektronik,lampu,"Promo Lampu Philips LED TRUEFORCE 50w (50watt, 50 watt) TForce Putih",Rp169.900
elektronik,lampu,LED Air Mancur 10 WATT WARNA WARNI Lampu Kolam Ikan 10W RGB Underwater,Rp96.500
elektronik,lampu,Lampu Emergency 20 Watt Rolinson RL-512 USB Flashlight Gantung LED COB,Rp17.350
elektronik,lampu,Spring Clamp / Alat Penjepit / Adjustable Spring Klem ABS,Rp4.750
elektronik,lampu,LAMPU LED PHILIPS 12W 12W 12WATT KUNING 3000K,Rp47.450
elektronik,lampu,Lampu LED Hannochs Vario 30w 30 watt Capsule,Rp43.000
elektronik,lampu,PHILIPS LED Stick / LEDStick / DLStick Mycare (5.5W / 7.5W / 9.5W),Rp34.800
elektronik,lampu,Fitting Gantung WD/ Fitting WD E27,Rp5.000
elektronik,lampu,Lampu Jalan PJU LED ECOLINK 20 Watt 35 W 50 Street Light Lamp Outdoor,Rp293.000
elektronik,lampu,"lampu uv recent/takari 5w,7w,9w,11w,13w,15w,20w kualitas bagus.",Rp110.000
elektronik,lampu,Lampu LED Bulb Sinaya Barokah 9 Watt 9W 9 W Bergaransi,Rp8.000
elektronik,lampu,LAMPU SOROT LED 20W / LAMPU TEMBAK LED 20 WATT / LAMPU OUTDOOR LED,Rp21.999
elektronik,lampu,LAMPU LED TINTIN 5 WATT PROMO,Rp3.239
elektronik,lampu,PHILIPS LAMPU LED PAKET 3 GRATIS 1 10W 10 W WATT PUTIH COOL DAYLIGHT,Rp117.500
elektronik,lampu,Lampu Led Hannochs Genius 6W 8W 10W 12W 15W,Rp70.350
elektronik,lampu,connector led strip 3528 / 2835 kabel,Rp1.750
elektronik,lampu,Lampu Hannochs LED SONIC 3W/ 7W/ 12W/ 15 Watt,Rp9.999
elektronik,lampu,Lampu LED Hannochs Vario 50W Putih 50 w 50 watt 50watt cooldaylight,Rp88.000
elektronik,lampu,bohlam lampu led hannochs vario 24 watt,Rp25.500
elektronik,lampu,pcb lampu led ac 9 watt putih / biji,Rp7.500
elektronik,lampu,Lampu PANEL LED / slim downlight LED NEO ( BULAT ) 15Watt - Panasonic,Rp81.100
elektronik,lampu,Lampu Led Sinaya Premium 25 Watt,Rp20.000
elektronik,lampu,lampu sorot kap sorot floodlight led 220v 10w 20w 30w 50w 100w IP65,Rp19.500
elektronik,lampu,Fitting Lampu Flexible Pitting Colok Holder Lamp Ukuran E27,Rp15.631
elektronik,lampu,LAMPU DOWNLIGHT LED PHILIPS ERIDANI G2 DL190B 10W 10 WATT 5 INCH,Rp66.000
elektronik,lampu,PHILIPS Lampu LED MyCare 12W Kuning Bohlam LED Bulb My Care 12 Watt WW,Rp53.290
elektronik,lampu,Lensa Plano-Convex 60 Derajat + Casing Polos HPL 1W-5W,Rp1.400
elektronik,lampu,Lampu Magnet Tempel USB Meja Anak Belajar Kerja Rias 3 Mode Warna LED,Rp67.500
elektronik,lampu,Senter LED XHP 50 ultrafire Cree Compact baterai 26650 rechargeable,Rp105.000
elektronik,lampu,Lampu Dop Kulkas E12 E14 E17 15W / Lampu Tidur E12 E14 E17 15 Watt,Rp1.900
elektronik,lampu,Hitato Lampu Sorot LED 7w 7watt 7 w watt MR16 220v 220vac 220 v PAR,Rp13.500
elektronik,lampu,lampu highbay 100w 150w 200 smd gantung pabrik gudang industry hanging,Rp190.000
elektronik,lampu,HILED / Lampu Bohlam LED / 13 Watt Putih Natural / Hemat Listrik / A3,Rp22.700
elektronik,lampu,PHILIPS LAMPU LED MULTIPACK MYCARE 12W 12 WATT PUTIH PAKET 3 GRATIS 1,Rp147.000
elektronik,lampu,LAMPU LED MATI KHUSUS PHILIPS LEHER BESAR,Rp2.199
elektronik,lampu,LAMPU RELL LED TRACK LAMP 10W 20W 30W COB TRACK LIGHT SPOT LIGHT,Rp65.000
elektronik,lampu,Lampu LED Strip 5050 IP44 12v OUTDOOR Ledstrip ip 44 Warm White 12 v,Rp52.900
elektronik,lampu,Hannochs Lampu LED Sonic 5 Watt - Cahaya Kuning,Rp14.700
elektronik,lampu,CINSEER Lampu proyektor Uvo speaker bluetooth pantulan cahaya ourora,Rp139.000
elektronik,lampu,FITTING EXTENSION / SAMBUNGAN / FITTING LAMPU BOHLAM E27(PILIH VARIAN),Rp9.900
elektronik,lampu,Philips T5 LED Batten Trunklinea 9W 3000K 4000K 6500K,Rp89.680
elektronik,lampu,"Philips LED Strip Selang 5,6w Ready Putih/Kuning Harga permeter",Rp25.000
elektronik,lampu,MYVO KING LAMPU LED T BULB 5W 10W 15W 20W 30W 40W 50W 60W GARANSI 1THN,Rp5.999
elektronik,lampu,DRAT/ULIR E-27 NIKEL,Rp600
elektronik,lampu,PHILIPS Lampu LED 19W Bohlam 19 w watt PUTIH Bulb 19watt philip white,Rp77.900
elektronik,lampu,"Downlight Panasonic Kap Rumah Lampu 5"" 5inch NLP73412 high Quality",Rp50.000
elektronik,lampu,"Lampu LED Krisbow Bohlam Set Isi 5 pcs 3,5,7,9,11 Watt",Rp103.900
elektronik,lampu,PHILIPS SPOT NR63 Lampu Pijar PANAS E27 Kuning Reptil 25W 40W 60W Watt,Rp24.950
elektronik,lampu,Hannochs Nova 18 Watt Lampu LED Cahaya Putih,Rp23.500
elektronik,lampu,"Led Lampu Hannochs Sonic 15w, 20w, 25w, 30w, 40w, 50w",Rp28.400
elektronik,lampu,Senter LED Mini Rechargable Telescopic Zoom,Rp35.000
elektronik,lampu,Fitting Lampu E27 Cabang 2 3 4 5 6 Fiting Bohlam Studio-Interior Rumah,Rp16.500
elektronik,lampu,LED STRIP WS2812B WS2812 5V 1M 144 Piksel 144SMD/M Addressable,Rp98.000
elektronik,lampu,PHILIPS LAMPU LED MULTIPACK MYCARE 10W 10 WATT PUTIH PAKET 3 GRATIS 1,Rp125.000
elektronik,lampu,Philips downlight LED Meson Kotak 59465 13w watt,Rp88.526
elektronik,lampu,"Lampu LED Ecolink 6w, 8w, 10w, 12w",Rp12.900
elektronik,lampu,POMERON 59776 / 070 / 7W 27K/40K RECESSED LED - KUNING,Rp92.000
elektronik,lampu,"PAKET 10 PCS LAMPU LED TIN - TIN 15 WATT, LAMPU TINTIN 15 WATT",Rp59.000
elektronik,lampu,SENTER SWAT LED MINI / SENTER LED POLICE CHARGEABLE / SENTER MINI CAS,Rp16.350
elektronik,lampu,LAMPU PANEL LED 30X120 48WATT DOWNLIGHT TIPIS 48W 48 WATT INBOW SLIM,Rp203.950
elektronik,lampu,PHILIPS LAMPU LED ESSENTIAL MULTIPACK 5W 5 WATT PUTIH PAKET 3 GRATIS 1,Rp53.490
elektronik,lampu,Lampu Senter LED USB Charger Rechargeable Mini Flashlight Aluminum,Rp25.900
elektronik,lampu,LAMPU BOHLAM PIJAR CLEAR 15W 25W 40W 60W 75W PHILIPS,Rp9.900
elektronik,lampu,ECOLINK Lampu LED Tube TL T8 16W 120cm Putih 6500K / Natural 4000K,Rp29.888
elektronik,lampu,Lampu Baca Meja Dinding Flexibel Led 3W Flesibel Spiral Led,Rp75.000
elektronik,lampu,Hannochs Downlight LED Symphony 9 watt CDL - Putih,Rp39.700
elektronik,lampu,EELIC ELC-J044 Lampu sorot led 50 watt SMD tripod model berdiri memili,Rp100.000
elektronik,lampu,Hannochs - Lampu LED Alfa - 50 watt - cahaya Putih,Rp109.700
elektronik,lampu,"lampu led module samsung 12V 1,5 watt saso ip68 made in korea (putih)",Rp2.200
elektronik,lampu,Led 5mm Nyala Kuning Kedip,Rp275
elektronik,lampu,OPPLE PAKET 2 GRATIS 1 - Lampu LED Bulb Bohlam 5W 7W 9W Family Pack,Rp36.888
elektronik,lampu,Surya Lampu LED Remote 10 Watt CCT Dengan Remot Control,Rp35.000
elektronik,lampu,Lampu LED Bulb MEVAL 3W 5W 7W 8W 9W 11W 13W MEVAL kaca putih susu,Rp12.000
elektronik,lampu,Lampu Strip / Rope LED 5050 Warna Putih/White SMD 5050 IP44,Rp8.000
elektronik,lampu,Lampu Belajar LED USB Mini Metal Flexible 4 LED / Lampu Baca,Rp12.500
elektronik,lampu,Lampu LED STRIP SELANG 3528 2835 10M 220v 10 M METER 5050 OUTDOOR RGB,Rp58.900
elektronik,lampu,Lampu kolam renang rgb warna warni 12w 12 w swimming pol led 12watt,Rp105.000
elektronik,lampu,fitting rumah lampu broco bulat round 1212 Putih white Cream E27 E 27,Rp9.180
elektronik,lampu,Surya Magic Lampu Emergency Led Bohlam Darurat Rechargeable,Rp23.900
elektronik,lampu,Lampu LED Aliano 12w - Bohlam LED Bulb 12 Watt - Lampu LED Murah Bagus,Rp15.750
elektronik,lampu,LAMPU KEONG COB SPOTLIGHT DOWNLIGHT NOSE LIGHT 10W/15W/25W ADJUSTABLE,Rp86.000
elektronik,lampu,LED & UV Flashlight Senter LED dan Ultraviolet Joyko FL-92LED/UV,Rp146.970
elektronik,lampu,Philips TL UV Blue light 20Watt/Lampu UV baby kuning komplit set,Rp315.000
elektronik,lampu,Panaled Premium Lampu Bohlam LED 5 10 15 20 30 40 Watt By luby,Rp7.451
elektronik,lampu,Fitting E27 Jerman Hitam,Rp5.700
elektronik,lampu,Senter LED Mini Super Terang Police SWAT Zoom USB Cree XML T6 Q5 18650,Rp29.900
elektronik,lampu,Lampu Bohlam Lampu Pijar 5 Watt Elektra Clear,Rp3.700
elektronik,lampu,LAMPU HEROIC LED BERGARANSI 7 WATT,Rp12.100
elektronik,lampu,LAMPU MURAH T5 LED 5W 5 W WATT 30 CM INTERLUC,Rp16.500
elektronik,lampu,LED CAPSULE PANALED PREMIUM-LAMPU LED MURAH-LAMPU LED EKONOMIS...,Rp3.000
elektronik,lampu,Lampu LED Bulb Bohlam PHILIPS Paket 10 Watt Mycare Pack 10W Multipack,Rp116.000
elektronik,lampu,Lampu Mesin Jahit LED 20 Titik magnet (PAKAI COLOKAN),Rp24.000
elektronik,lampu,LED strawhat 5 mm - Merah,Rp200
elektronik,lampu,Lampu Sorot DC 50 Watt Tembak 12V IP65 Mitsuyama MS-9650DC Floodled,Rp100.999
elektronik,lampu,8W 12W 18W ASLI LAMPU DOWNLIGHT LED PLAFON/ASLI FULL TERANG,Rp11.500
elektronik,lampu,Lampu Led Luby Sumo Capsule 12w 16w 22w 30w 40w SNI,Rp12.500
elektronik,lampu,Lampu TL Neon T5 LED Tube Lampu 6/10/15/18 WATT,Rp20.000
elektronik,lampu,BROCO Fitting Kombinasi E27 Colok Lampu Kombinasi 226,Rp9.000
elektronik,lampu,PCB LED ac 20 w premium,Rp12.000
elektronik,lampu,Lampu pemanas Philips 250 watt 250w heating lamp pemanas makanan 250w,Rp237.500
elektronik,lampu,Lampu LED Bulb Philips LEDBright 20W 20 Watt 20Watt LED Bright Kuning,Rp74.050
elektronik,lampu,ACE - Eglo Basic Lampu Meja - Putih,Rp99.900
elektronik,lampu,BARDI Smart LIGHT BULB RGB+WW 12W Wifi Wireless IoT - Home Automation,Rp126.000
elektronik,lampu,Lampu Bohlam LED SURYA VEGA BULB Cahaya Putih,Rp15.000
elektronik,lampu,lampu led capsule pioline 5w/10w/15w/20w/30w,Rp3.600
elektronik,lampu,"Lampu Candle Led Bohlam lampu lilin gantung Smd 5w E14,E27 Putih Kunin",Rp6.680
elektronik,lampu,promo murah lampu led philip 3 4 6 8 10 12 14 19 watt 6500k,Rp22.900
elektronik,lampu,Casing Lampu LED 7w - 7 Watt (BM),Rp3.400
elektronik,lampu,Kap Lampu Baret Plafon E27 ukuran 25cm,Rp80.899
elektronik,lampu,Lampu LED Jumbo Tabung E27 Terang Putih Murah Berkualitas / Bohlam,Rp5.580
elektronik,lampu,LAMPU TAMAN LED COB OUTDOOR WATERPROOF SOROT TAMAN 5W FLASHSALE,Rp4.150
elektronik,lampu,Lampu LED Fairy Light Tumblr Battery Powered Waterproof 3/5 Meter,Rp18.800
elektronik,lampu,"HANNOCHS SONIC 3+1 PAKET ISI 4 PC LAMPU 6W , 10W , 13W.",Rp47.700
elektronik,lampu,LAMPU LED PANEL OUTBOW INLITE IN-LITE 12W 12 W 12WATT 12 WATT,Rp80.000
elektronik,lampu,LAMPU LED / LED MURAH / LAMPU MURAH / LED BULB ECOKING LEGEND 20W,Rp24.650
elektronik,lampu,LAMPU LED SENSOR CAHAYA MEVAL 5 WATT CAHAYA KUNING,Rp45.000
elektronik,lampu,INLITE PAKET 3 GRATIS 1 / Lampu Led Bulb INB007 5W Putih / Kuning,Rp38.000
elektronik,lampu,SENTER LED SUPER TERANG XML-T6 2000 - 3800 LUMENS ANTI AIR JARAK JAUH,Rp29.900
elektronik,lampu,Lampu LED Selang Neon Flex / Selang Susu 50 meter 220V,Rp480.000
elektronik,lampu,Magnetic Track Lighting System - Linear LED Light HBCX20,Rp95.000
elektronik,lampu,Hannochs LED PAR / Lampu Sorot PAR 30 10 Watt WW/CDL,Rp49.000
elektronik,lampu,Lampu LED Arashi Beat 5 Watt Putih / Cool Daylight,Rp10.100
elektronik,lampu,Lampu Hannochs Vario 12 Watt Murah,Rp19.500
elektronik,lampu,SURYA SQL L3001 Lampu Senter Led Emergency Lampu Darurat Portable,Rp33.000
elektronik,lampu,LAMPU HANNOCHS VARIO 24 WATT,Rp27.000
elektronik,lampu,Lampu LED Bulb Bohlam Philips 10w Paket Mycare Pack 10w Multipack,Rp120.000
elektronik,lampu,Lampu Filamen LED ST64 Bulb 4W bohlam 4 w watt pijar edison cafe OVAL,Rp9.900
elektronik,lampu,Paket Lampu led Hannochs Sonic 10 watt (4 lampu),Rp65.500
elektronik,lampu,Senter Police 3w Mini Senter Swat Police Senter Mini 3 Watt,Rp6.200
elektronik,lampu,WATERPROOF 2X36 IP65/Kap TL LED 2x36 waterproof IP65 120Cm/Rumah Lampu,Rp118.000
elektronik,lampu,List Lampu LED Strip Rumah 1M / Cover Aluminium Casing Lis Housing all,Rp28.500
elektronik,lampu,fitting sambung lampu konverter converter e40 to e27 e 40 ke e 27,Rp7.140
elektronik,lampu,Fitting Lampu Gantung E27 Model A1,Rp18.000
elektronik,lampu,Lampu Downlight LED Panel Lamp 3W PUTIH 3 w watt 3watt,Rp10.000
elektronik,lampu,Refill Lampu Nyamuk/Serangga - 4watt T5 ( UV Black Light ),Rp13.000
elektronik,lampu,Lampu LED PLC 8.5w G24d-3 2P Philips,Rp118.077
elektronik,lampu,LED 5MM 1 WARNA TRANSPARAN JUAL PER 10 BIJI,Rp1.500
elektronik,lampu,Soket Lampu H7 Flosser,Rp40.400
elektronik,lampu,LED PHILIPS 5 Watt PUTIH ESENSIAL Lampu Philip Bulb 5W E27 Cool Murah,Rp22.900
elektronik,lampu,Lampu LED Paket Philips 8W Putih isi 4 (3 gratis 1) Promo LED 8 W,Rp112.500
elektronik,lampu,HPL 1 WATT ( HIGH POWER LED 1 WATT ),Rp1.800
elektronik,lampu,Tongkat pengganti bohlam - lampu led - Nagata 2011,Rp91.000
elektronik,lampu,Hinolux LED Strip 5050 60L IP33 12VDC Warm White,Rp99.000
elektronik,lampu,"fitting konverter, konektor, connector E14 ke E27",Rp3.540
elektronik,lampu,Lampu Led 40watt Jumbo Myvo King Capsule T Buld Nyala Putih Bergaransi,Rp33.950
elektronik,lampu,Lampu LED Hannochs Infinity 15 Watt Cahaya Putih CDL 15 W,Rp42.500
elektronik,lampu,LED Lampu Neon Planet Rocket Alien Moon lightning Cat Dekorasi Decor,Rp75.000
elektronik,lampu,in-Lite LED Paket Lampu LED Stick 15 Watt,Rp28.300
elektronik,lampu,Inlite Led Bulb Cahaya Semu 9W/11W/15W INB007 4000K(LedSamsung),Rp23.500
elektronik,lampu,HAN RIVER Mosquito Killer LKS-2019 Lampu LED Ampuh Membasmi Nyamuk,Rp89.000
elektronik,lampu,"Led 3W 5W hpl chip lampu senter, hias, panel, aquarium, motor,cob dll",Rp2.550
elektronik,lampu,Lampu Sorot 100w 200w 300w 400w 500w COB Jalan Outdoor Tembak COB,Rp73.990
elektronik,lampu,DIY Mini Aluminium Heatsink Pendingin Led Driver Multi 44mm 30mm 11mm,Rp4.930
elektronik,lampu,BOHLAM ZORLIEN LAMPU SUPER TERANG BOHLAM HEMAT ENERGI GARANSI 1 TAHUN,Rp9.100
elektronik,lampu,Fitting/Fiting Lampu Tarik Tali E27 Cabang 2 Dua Dobel Double E-27 SNI,Rp15.000
elektronik,lampu,"PHILIPS LED STRIP LAMPU SELANG DLI 31087 HV LED TAPE HL 6,6w/m 50 M",Rp1.598.000
elektronik,lampu,PHILIPS DOWNLIGHT LED MESON PAKET 5W 5 WATT 2GRATIS1 (59447),Rp131.976
elektronik,lampu,American Pro LED ORIGINAL TH2810,Rp30.000
elektronik,lampu,Sensor Lampu Otomatis Merk ATN 212A Warna Putih 60 watt,Rp20.000
elektronik,lampu,YOUNGPRO YCO150 Lampu Jalan Outdoor Led Solar Panel Hemat Energi,Rp85.000
elektronik,lampu,LED Modul 3 Mata Strip SMD 5050 Putih/White DC 12V,Rp1.500
elektronik,lampu,LAMPU NEON LED TL PANJANG/TABUNG 18W/36W 60CM/120CM PUTIH ALUMINIUM,Rp45.000
elektronik,lampu,RELL LAMPU TRACK LIGHT RELL LAMPU SOROT SPOTLIGHT TRACK,Rp25.000
elektronik,lampu,Lampu LED Philips 14.5 Watt Putih/Cool Day Light 14.5W 14.5Watt 14.5 W,Rp51.900
elektronik,lampu,Lampu LED kedip kawat 1 meter dan 2 meter,Rp4.950
elektronik,lampu,STIK PEMASANG LAMPU / TONGKAT LAMPU Model 8 jari,Rp42.000
elektronik,lampu,TAKASIMURAH Lampu LED Bulb T 5W 10W 15W 20W 30W Putih Murah Terang,Rp2.950
elektronik,lampu,2835 led strip 12v lebar 4mm per 50cm,Rp26.500
elektronik,lampu,lampu led panel downlight 6w 12w 18w 24w plafon inbo 6 12 18 24 wat,Rp15.000
elektronik,lampu,FITTING SAMBUNG EXTENDER PERPANJANGAN LAMPU LED 18cm/28cm/38cm/48cm,Rp28.000
elektronik,lampu,Lampu Kulkas Led E12 E14 3W / Lampu Tidur Led E12 E14 3 Watt,Rp10.800
elektronik,lampu,Lampu LED Kawat Free Baterai Panjang 1m - 2m Warm White Tumblr Hias,Rp2.900
elektronik,lampu,Lightstick / Light Stick JKT48 AKB48 Change Color 18 Warna,Rp160.000
elektronik,lampu,lampu selang led strip outdoor 5050 100m 100 m lampu outdoor cafe,Rp500.000
elektronik,lampu,Hannochs LED NOVA 6W Cahaya Putih,Rp15.700
elektronik,lampu,Fitting lampu Sensor Cahaya Otomatis,Rp17.600
elektronik,lampu,INTERLUC LAMPU LED STICK 20W 20 WATT SNI - PUTIH CDL 6000K,Rp23.499
elektronik,lampu,DN020B G3 LED20 23W 220-240V D200 LED Downlight Philips,Rp106.600
elektronik,lampu,LAMPU LED KAPSUL PANALED PREMIUM 40W,Rp10.000
elektronik,lampu,Lampu Ublik Minyak Tanah Lampu Teplok,Rp19.000
elektronik,lampu,Clamp Holder Fitting E27 / Holder Lampu E27 Kabel Fleksibel + Switch,Rp27.000
elektronik,lampu,Led 5mm Nyala Merah Kedip,Rp275
elektronik,lampu,Lampu Led hias warna warni 3watt bohlam warna 3watt - LED Pingpong,Rp4.400
elektronik,lampu,Lampu LED Emergency 11 Watt 11w PHILIPS RadiantLine Rechargeable,Rp85.500
elektronik,lampu,Lampu Bohlam LED Philips 7 Watt Kuning/Warm White (7W 7 W 7Watt),Rp29.800
elektronik,lampu,Tongkat Penganti Lampu /Stik Lampu / Alat Ganti Pasang Lampu,Rp30.000
elektronik,lampu,HANNOCHS Sonic Lampu LED 5W Bohlam 5 w watt Bulb Warm White KUNING,Rp12.300
elektronik,lampu,Lampu LED Bulb Philips TrueForce Core 50W 50 Watt 50Watt E27 Putih,Rp165.216
elektronik,lampu,PHILIPS DOWNLIGHT LED ERIDANI G2 DL190B 14WATT 14W D150,Rp65.450
elektronik,lampu,KAP TKO 2x36 SET KOMPLIT TL LED PHILIPS 2x16 watt T8 panjang 120cm,Rp55.000
elektronik,lampu,"Krisbow emergency lamp rechargeable, kipas & lampu darurat",Rp165.000
elektronik,lampu,Lampu TL Neon T5 LED 5/9/15/19W Tube Warna Warni/Lampu neon led,Rp7.888
elektronik,lampu,Lampu LED USB Mini LED Stick 3 / 8 LED Emergency Lamp Reading Lamp,Rp4.900
elektronik,lampu,Kap Lampu Rumah Downlight OB Outbow Tempel Bulat 4 inch E27,Rp47.500
elektronik,lampu,Promo Lampu Philips Tornado 5w / 8w / 12w / 15w / 20w / 24w,Rp29.990
elektronik,lampu,Casing Aluminium Hard Strip LED model V-Reflektor 1 meter / 1 m,Rp17.500
elektronik,lampu,LAMPU LED BULB CAPSULE INLITE IN LITE INBC002 50WATT 50W VALUE PUTIH,Rp74.000
elektronik,lampu,LAMPU LED LUBY CAPSULE,Rp15.000
elektronik,lampu,Lampu Halogen Stick PHILIPS PLUSLINE C 150W 150 watt R7s,Rp37.000
elektronik,lampu,Philips downlight LED Meson Kotak 59451 9w watt,Rp77.683
elektronik,lampu,Lampu Neon LED USB Belajar Kerja Rumah Komputer Cahaya Tempel Portabl,Rp18.600
elektronik,lampu,FAMER LAMPU LED JUMBO 60W bohlam 60 w watt putih bulb WHITE KAPSUL SNI,Rp78.900
elektronik,lampu,Lampu Meja Belajar Baca Duduk LED Sentuh Rechargeable Myvo MD-1800,Rp30.000
elektronik,lampu,Rel Rell Lampu Sorot Spot Track Rell 2m Kap 2 m Meter Hitam & Putih,Rp41.500
elektronik,lampu,Kabel fiting lampu cafe gantung 10m 10 m dekorasi outdoor fitting,Rp72.500
elektronik,lampu,LED driver AC to DC 8W-36W seri 8-36 watt HPL 1W 270mA-300mA,Rp15.500
elektronik,lampu,AVEN Senter Mini XPE COB Led Zoom Super Terang Swat Light Recharge,Rp13.388
elektronik,lampu,LED strip smd IP 33 miyalux 5050 cahaya putih 5 meter,Rp45.000
elektronik,lampu,Neon Box Light Box 2 Sisi Ukuran 40 x 60cm,Rp350.000
elektronik,lampu,Part - SOKET/SOCKET/FITTING BOHLAM SEN/SENJA(TANCEP/COLOK) T10/T13,Rp1.750
elektronik,lampu,LED 3mm clear 3 mm super bright F3 Light Emitting Diode Bening Warna,Rp140
elektronik,lampu,LAMPU DOWNLIGHT PANEL LED 18 WATT INBOW 18W PLAFON 18WATT KOTAK 18 W,Rp39.500
elektronik,lampu,Lampu LED Strip 5050 IP33 12v INDOOR Ledstrip PUTIH ip 33 White 12 v,Rp32.900
elektronik,lampu,LAMPU LED HANNOCHS SONIC 15W 15 WATT CAHAYA KUNING 3000K WARM WHITE,Rp30.500
elektronik,lampu,Lampu LED Tembok Anak Tangga Dinding Step Light inbow tanam Wall Lamp,Rp29.000
elektronik,lampu,BROCO FITTING GANTUNG HITAM 216L (TERSEDIA HARGA GROSIR),Rp3.950
elektronik,lampu,paket sorot spot rel light track rel 10w 20w 30w tembak isi 4 lampu,Rp200.000
elektronik,lampu,philips led 10w putih,Rp35.006
elektronik,lampu,lampu led filamen 2w 3w 4w bohlam pijar edison cafe g45 st64,Rp6.100
elektronik,lampu,"Lampu LED Philips 14,5 Watt Kuning/Warm White (14,5W 14,5 W 14,5Watt)",Rp51.900
elektronik,lampu,Fitting LAMPU SENSOR Cahaya KOSS Fiting E27 Photo Sensor Otomatis Cel,Rp25.900
elektronik,lampu,Lampu PHILIPS Essential LED Bulb 3 5 7 9 11 13 W Watt Putih Kuning,Rp17.990
elektronik,lampu,Rokeet Lampu Dinding LED Panjang Tidur Magnetic Wireless Minimalis Kam,Rp79.900
elektronik,lampu,Lampu Philips Tornado 20w Putih/Kuning 20 w 20 watt 20watt,Rp47.700
elektronik,lampu,Paket Beli 3 Gratis 1 Lampu LED Bulb inlite Multipack 5 Watt IN-LITE,Rp40.275
elektronik,lampu,INLITE Lampu Spotlight Led 5W Lampu Downlight Led IN-LITE 5 W INDC232,Rp42.850
elektronik,lampu,INLITE LED Spot E27 Lampu Sorot COB 8W 8Watt in-Lite 8 W PAR INP1607,Rp33.660
elektronik,lampu,LAMPU EMERGENCY HANNOCHS 15 WATT,Rp114.999
elektronik,lampu,LAMPU LED HANNOCHS VARIO 24 WATT / BOHLAM LED VARIO 24 W - BERGARANSI,Rp25.700
elektronik,lampu,Lampu Led Sinaya Premium 25 Watt 5 Pcs - Putih,Rp61.000
elektronik,lampu,Lampu Mr16 Merk ASSA 5 Watt Tusuk 4000K Natural White,Rp27.500
elektronik,lampu,Lampu Led Bulb 007/ Paket 3in1/12 Watt Inlite,Rp77.800
elektronik,lampu,Kap housing Lis rel rumah lampu led strip Alumunium Susu Acrylic 1m,Rp20.808
elektronik,lampu,LAMPU MEJA BELAJAR DIMMER AOKI AK 6051,Rp70.500
elektronik,lampu,PHILIPS LAMPU LED MULTIPACK MYCARE 6W 6 WATT PUTIH PAKET 3 GRATIS 1,Rp88.450
elektronik,lampu,LAMPU RGB / RGBW / LAMPU CONTROL / LAMPU REMOTE / 12 WATT / 18WATT,Rp26.500
elektronik,lampu,"Lampu LED LUMENS 9w 9 watt 9watt putih TERANG MURAH, GROSIR 110++ Lm/W",Rp19.179
elektronik,lampu,Lampu LED Tube T5 18w 1 set Komplit Panjang 120cm Luxen Bergaransi,Rp52.550
elektronik,lampu,Thermal / Termal Silicon / Silikon Grease Tian Mu,Rp12.500
elektronik,lampu,LAMPU TL T8 LED 5 8 9 10 14 15 16 18 20 40 WATT / T5 30 60 90 120 Cm,Rp24.225
