base_type,type_,text,price
elektronik,lampu,PANALED ALTIS LED Lampu Bohlam Bulb 5W E27 220V Putih 6500K,Rp5.000
elektronik,lampu,Fitting Lampu Bohlam Extender E27 Socket Adapter Ekstensi 20cm LS4G,Rp12.900
elektronik,lampu,LAMPU ECOLINK PAKET LED BULB BELI 3 DAPAT 4 - E27 6500K COOL DAYLIGHT,Rp47.430
elektronik,lampu,BOHLAM LAMPU RGB 7WATT WARNA WARNI REMOTE,Rp17.500
elektronik,lampu,Philips Lampu Emergency / Rechargable LedBulb 7w/ 7.5W E27 6500k-Putih,Rp76.500
elektronik,lampu,LAMPU LED TINTIN 40 WATT PROMO,Rp18.720
elektronik,lampu,ACE - Krisbow Bohlam Led E14 3w 6500k - Cool Daylight,Rp19.900
elektronik,lampu,REL Lampu sorot spot track rell 1M kap 1 m meter trek LED PUTIH HITAM,Rp23.900
elektronik,lampu,LED Strip SMD 5050 Red/Merah IP44 WATERPROOF,Rp51.500
elektronik,lampu,Lampu Led Laser H4 D2 Laser Abstrak Putih Kuning Cahaya Luas Led Motor,Rp15.000
elektronik,lampu,LAMPU BOHLAM LED FILAMEN EDISON G95 E27 4W KUNING FILAMENT G 95 E 27,Rp25.000
elektronik,lampu,PHILIPS Lampu LED 14.5W MULTIPACK 14.5 Watt PUTIH PAKET 3 Gratis 1,Rp182.500
elektronik,lampu,FITTING FITING SOKET SOCKET COP LAMPU DEPAN GRAND SUPRA,Rp4.250
elektronik,lampu,OSRAM LED 12WATT (PUTIH/KUNING),Rp18.183
elektronik,lampu,Lampu LED Micro USB panel emergency LED SMD 8 16 20 titik 5v LED 5730,Rp5.500
elektronik,lampu,lampu philips led essential,Rp30.000
elektronik,lampu,Philips TL BN010C 8W 1xTLED /740 L600 - LED Tube Batten,Rp38.220
elektronik,lampu,Controller JWS P10 RGB (Jam Sholat) Wifi Murah,Rp255.000
elektronik,lampu,Kap Lampu Batten T5 LED Inlite INT5003 5W 10W 14W 20W,Rp37.500
elektronik,lampu,lampu LED Phillips TFORCE 50 Watt (putih) E27,Rp174.000
elektronik,lampu,Lampu Sorot Jalan Led Iodine Tungsten 50W 100W / 50 Watt / 100 Watt,Rp15.000
elektronik,lampu,Lampu led 20 watt Pioline Alpha,Rp7.800
elektronik,lampu,"PAKET 10 PCS SURYA VEGA 18 WATT, LED SURYA VEGA 18W, LAMPU LED",Rp161.000
elektronik,lampu,LAMPU LED CANDLE INLITE 4W E14 INCL005,Rp19.055
elektronik,lampu,Hannochs VARIO LED Bulb 18 Watt 18watt - Bola Lampu Bohlam LED,Rp23.800
elektronik,lampu,Lampu LED Strip RGB SMD 5050 IP44 5V USB TV MEJA PC HIAS REMOTE IR,Rp25.000
elektronik,lampu,Lampu Kulkas Fitting E12 E14 E17 15watt,Rp2.500
elektronik,lampu,Philips Lampu LED Trueforce 30W TForce Core 6500K Cool Day Light Putih,Rp103.900
elektronik,lampu,Ace - Krisbow Lampu Downlight Bulat Led 6w 400 Lm - Warm White,Rp69.900
elektronik,lampu,Paket Lampu Tidur Led 2w Kualitas Philips Fitting Colok,Rp9.999
elektronik,lampu,PANALED ALTIS LED Lampu Bohlam Bulb 12W E27 220V Putih 6500K,Rp7.800
elektronik,lampu,Lampu Pijar Philips Siawet 15W / Lampu Clear Philips 15W,Rp9.500
elektronik,lampu,LED Candle Light 5.5-40W E14 230V B35 CL ND AP Philips,Rp35.425
elektronik,lampu,PHILIPS LAMPU LED MULTIPACK MYCARE 10W 10 WATT PUTIH PAKET 3 GRATIS 1,Rp114.990
elektronik,lampu,PHILIPS LAMPU TORNADO 20W 20 WATT PUTIH SPIRAL CDL (GROSIR & GARANSI),Rp50.700
elektronik,lampu,LAMPU LED MURAH CHIYODA R&B 12W,Rp24.150
elektronik,lampu,BOHLAM LAMPU LED STICK 5 Watt 7 Watt 9 Watt 11 Watt KEIBU,Rp10.000
elektronik,lampu,PHILIPS LAMPU LED BRIGHT 20W E27 BULB 20 watt,Rp77.000
elektronik,lampu,000167 - Senter LED Cree XM-L T6 3800 Lumens - Black,Rp33.250
elektronik,lampu,Neon flex Led strip selang DC12V 12Volt,Rp18.500
elektronik,lampu,Hannochs Lampu LED Revo 30 watt cahaya Putih,Rp44.000
elektronik,lampu,SENTER LED BESAR JUMBO - SENTER SATPAM SECURITY HANSIP,Rp132.500
elektronik,lampu,Trafo Ballast Elektronik TL / Neon 10W 20W 40W,Rp17.500
elektronik,lampu,PAKET 4 PC LAMPU LED LUXEN CLASSIC 5W 7W 9W 12W 15W 18W CAHAYA PUTIH,Rp41.900
elektronik,lampu,LAMPU CANDLE LED BOHLAM CANDLE SMD 5WATT E27,Rp8.000
elektronik,lampu,BOKLAM DEPAN LED KAKI 1 OSRAM AC DC COOL WHITE 6000 KELVIN LED T19,Rp38.000
elektronik,lampu,Philips RadiantLine Multipack LEDBulb 5W 6500K Putih - Bohlam LED,Rp59.500
elektronik,lampu,Philips - Lampu LED Essential Multipack / Paket 9W (Putih),Rp79.900
elektronik,lampu,Lampu LED Hannochs Sonic 20W 20 W 20 WATT 20WATT - Kuning warmwhite,Rp34.500
elektronik,lampu,LAMPU LED HANNOCHS VARIO 12 WATT / BOHLAM LED VARIO 12 W - BERGARANSI,Rp15.990
elektronik,lampu,PHILIPS Lampu LED 12W Bohlam 12 w watt PUTIH Bulb 12watt philip MyCare,Rp38.725
elektronik,lampu,Fitting Lampu Holder E27 Putar Rotasi 180 Derajat,Rp22.000
elektronik,lampu,joule thief 3.7-12 volt berdriver dan Non driver,Rp20.000
elektronik,lampu,Lampu LED Jagung Corn Bulb 3in1 3 Warna Cahaya E27 E14 12W 12 Watt,Rp11.999
elektronik,lampu,LAMPU LED MURAH ISI 5 FIREFLY 7 W WATT BY MEVAL TERANG DAN BERGARANSI,Rp52.000
elektronik,lampu,LAMPU LED 16Watt JAGUNG/CORN BULB 3 IN 1 /3 CAHAYA 8W+8W E14/E27,Rp25.000
elektronik,lampu,"PHILIPS Eridani G2 DL190B 22W LED18 D200 8"" - LED Downlight",Rp96.130
elektronik,lampu,Lampu Halogen LED COB 7W E27 MR16 Putih / Kuning,Rp14.750
elektronik,lampu,Hannochs Lampu LED / Bohlam LED VARIO 24 watt / 24W Cahaya Putih,Rp30.000
elektronik,lampu,TIDY CV0301 3 Inch Lampu Downlight Cover SATIN NICKEL E27,Rp32.500
elektronik,lampu,Lampu Pijar Bohlam Hias Chiyoda 5W 5 watt merah kuning biru hijau,Rp4.998
elektronik,lampu,Fitting Lampu 12cm Pemanjang / Sambungan Lamp Downlight,Rp10.900
elektronik,lampu,BOLAM CANDLE E14 LAMPU COOKER HOOD Rinnai Modena LED 5 WATT,Rp35.900
elektronik,lampu,LED Modul 5630 Samsung 3 Mata Lampu Lensa 6618 Putih 12v 1.5W IP68,Rp2.010
elektronik,lampu,modul lampu led 13w 220v / led module 13watt 220Volt AC,Rp4.500
elektronik,lampu,KAWACHI LAMPU LED MURAH BERGARANSI DIAMOND CAPSULE SUPER JUMBO 80 WATT,Rp113.000
elektronik,lampu,Lampu Led Kapsul Jumbo 30w Philips T Force Core,Rp90.000
elektronik,lampu,Senter LED Mini Zoom USB Penlight Pena Cree Gantungan Kunci Flashlight,Rp9.900
elektronik,lampu,Lampu Philips LED Bulb 3W 3 Watt 3 W 3 Watt My Care,Rp18.800
elektronik,lampu,Goto Taya Table Lamp LED Lampu Meja Belajar Baca Fleksibel Recharge,Rp49.900
elektronik,lampu,Triple W Desk Mini Lamp Bedsite LED Portable Lampu Meja Tidur Belajar,Rp105.000
elektronik,lampu,AOKI Led bulb seri alphard,Rp10.500
elektronik,lampu,EKONOMAT LAMPU LED 1W WARM WHITE / EKONOMAT LAMPU LED 1WATT,Rp6.084
elektronik,lampu,Lampu Bohlam LED Hannochs Sonic 3W 3 Watt Cahaya Putih 6500K CDL,Rp10.500
elektronik,lampu,Lampu Downlight Hannochs Symphony 25W OBR / Outbow,Rp88.000
elektronik,lampu,bohlam Lampu fotografi studio 5500k,Rp59.900
elektronik,lampu,PHILIPS BVP150 20W LED17 SWB FloodLight - Lampu Sorot Outdoor,Rp158.900
elektronik,lampu,Trafo 10A 12V Travo Power Supply / Adaptor 10A 120w Strip LED,Rp52.900
elektronik,lampu,Lampu Bohlam Bentuk Kipas LED 45w 3 baling Fan Blade LED Bulb White,Rp14.900
elektronik,lampu,Lampu LED Neon FLEX Strip Light Flexible DC12V METERAN IP65 WATERPROOF,Rp17.000
elektronik,lampu,PHILIPS LAMPU HALOGEN STICK 100W PHILIPS PLUSLINE HALOGEN STICK,Rp39.500
elektronik,lampu,Lampu LED Stripe Selang SMD 5050 220 V Per Meter,Rp6.700
elektronik,lampu,lampu led modul 3 mata samsung saso DC 12 V 1.5 W lagi promo...,Rp2.200
elektronik,lampu,Lampu Led Laku Laku Platinum 15 Watt,Rp10.500
elektronik,lampu,Kap Lampu Sorot Plafon/ Dinding R63 Kap Lampu Rel,Rp13.500
elektronik,lampu,Fitting Lampu Jadwal Otomatis myeco,Rp65.500
elektronik,lampu,BL-5 Baterai HT UV-5R UV-5 UV5R UV-5RA Baofeng Weierwei BL5 UV5,Rp85.000
elektronik,lampu,CAHAYA Lampu Led 15w/18w/20w/25w/30Watt Cahaya Putih,Rp27.850
elektronik,lampu,3mm Copper Tape Tembaga Foil Jalur Konduktor PCB LED Lem Stiker Panas,Rp900
elektronik,lampu,Lampu Tidur / Kenmaster Dim Night Ligth,Rp16.617
elektronik,lampu,"Lampu LED SMD 3528 2835 21-23lm 0,2 watt High Power Putih",Rp200
elektronik,lampu,Lampu LED Hannochs REVO 40W 40Watt Cahaya Putih,Rp65.000
elektronik,lampu,Lampu Led Panaled 30W/Led Panaled Capsule 30 Watt Murah,Rp7.400
elektronik,lampu,Lampu Sorot LED 200W LED Flood Light Tembak Outdoor 200 Watt - PUTIH,Rp90.000
elektronik,lampu,LAMPU LED HANNOCHS SONIC 20W 20 WATT CAHAYA KUNING 3000K WARM WHITE,Rp39.100
elektronik,lampu,"Kap Rumah Lampu Downlight 3,5 inch 3.5"" Fitting E27 TOP Quality",Rp17.999
elektronik,lampu,Led SMD 2835 6V 1W 150mA White Backlight TV LED LCD Lampu Putih,Rp700
elektronik,lampu,HANNOCHS Sonic Lampu LED 10W Bohlam 10 w watt Putih Bulb 10watt PAKET,Rp70.750
elektronik,lampu,Photo Control Foto Cell Sel Sensor Cahaya Kawamura Jepang 6A 6 Ampere,Rp72.000
elektronik,lampu,Downlight LED PHILIPS MESON 9W 4inch 59449 PUTIH PAKET isi 3pcs 6500K,Rp63.900
elektronik,lampu,PHILIPS LED Downlight Pack 59441 MESON G2 080 3.5W 65K recessed LED,Rp117.090
elektronik,lampu,Lampu Sorot E27/MR16 3 Watt 7 Watt Spotlight Bohlam LED Halogen 3W 7W,Rp16.999
elektronik,lampu,senter police swat 2 cone lalin,Rp32.500
elektronik,lampu,Philips LED Downlight Meson 13 Watt 59464 Paket 2 Gratis 1,Rp190.000
elektronik,lampu,kap lampu gantug minimalis retro vintage,Rp70.000
elektronik,lampu,Speaker bluetooth smart touch Lampu tidur Portabel Lampu,Rp42.000
elektronik,lampu,Fitting Sensor Cahaya E27 / Lampu Sensor Otomatis E27,Rp26.900
elektronik,lampu,Ace - Krisbow Bohlam Smart Led 14 W Rgbcw - Multi Color,Rp92.500
elektronik,lampu,Hanya kaca tbt 9 dlx lighting lampu taman pilar,Rp197.900
elektronik,lampu,LAMPU CANDLE LED CHIYODA E14 LAMPU JANTUNG LED CHIYODA 5W 5WATT PUTIH,Rp21.500
elektronik,lampu,"PHILIPS Downlight LED DN020B G3 4,5W 4.5W 4.5Watt 4,5Watt",Rp48.500
elektronik,lampu,Philips MyCare LEDBulb 10W E27 4000K 230V Netral White,Rp33.500
elektronik,lampu,Philips wifi smart plug,Rp99.000
elektronik,lampu,LAMPU SENSOR CAHAYA 9W 9 W WATT INLITE IN-LITE INMS033,Rp43.500
elektronik,lampu,Lampu Emergency Luby L-7757 / Luby L7757,Rp82.500
elektronik,lampu,Lampu LED Halogen Sorot MR16 5W 220V Putih Atau Warm White,Rp18.500
elektronik,lampu,Lampu Strip LED smd 5050 12V 5m ip33 ip44 indoor outdoor waterproof,Rp55.000
elektronik,lampu,Tongkat Pengganti Lampu/Stick Tongkat pasang ganti Bohlam/Galah,Rp53.000
elektronik,lampu,Lampu Downlight LED Panel OB Kotak 6W Outbow 6 W Square 6 Watt,Rp21.000
elektronik,lampu,Lampu Tidur 3D Transparan Akrilik 3 Warna Lampu,Rp25.000
elektronik,lampu,LAMPU MULTIFUNGSI Multifunctional Working Lamp LAMPU CAMPING EMERGENCY,Rp168.000
elektronik,lampu,Philips BGP150 8W,Rp228.600
elektronik,lampu,GRATIS BUBBLE WRAP! Downlight Vosco Original 3.5 inch dan 4 inch Adjus,Rp16.500
elektronik,lampu,ENERGIZER LED BOOKLITE LAMPU BACA PORTABLE JEPIT PENJEPIT,Rp105.000
elektronik,lampu,Lampu Hannochs LED Sonic 20 Watt,Rp36.000
elektronik,lampu,Hannochs - Lampu LED Alfa - 25 watt - cahaya Putih,Rp54.700
elektronik,lampu,Bohlam Lampu LED Capsule 20W SUNSONIC,Rp6.250
elektronik,lampu,Lampu Bohlam Cabe Lampu Jantung E12 Clear Bening,Rp1.750
elektronik,lampu,LAMPU EMERGENCY LED HANNOCHS 12W 12 W 12WATT 12 WATT,Rp95.000
elektronik,lampu,lampu taman garden lamp led 3w 5w 7w sorot tembak jalan outdoor,Rp25.000
elektronik,lampu,LAMPU LED CLASSIC LUBY,Rp17.500
elektronik,lampu,PHILIPS LED Strip DLI 31088 KABEL POWER High Voltage Tape Accessories,Rp37.200
elektronik,lampu,BARDI Smart Light Bar with NFC,Rp598.000
elektronik,lampu,Fotosel Kotak Sensor Cahaya Kotak ( Model SELCON ),Rp39.000
elektronik,lampu,LED PANEL INLITE IN-LITE 6W 6 W 6WATT BULAT INPS 626R,Rp40.500
elektronik,lampu,Lampu LED Plafon 3 Warna Remote Control Modern Ceiling Light 18W 30 CM,Rp139.900
elektronik,lampu,PHILIPS Essential LED Bulb 7W Lampu LED Philips 7 Watt 6500K Putih,Rp23.900
elektronik,lampu,KLEM NEON FLEX type 220 V HARGA TERTERA ADALAH HARGA 1 Pak = 5 pcs,Rp20.000
elektronik,lampu,LAMPU TL T5 28W / 865 PUTIH Philips,Rp44.880
elektronik,lampu,in-Lite LED Lampu Bohlam Sensor Gerak 12 Watt,Rp60.705
elektronik,lampu,LED Hiled Bohlam 13W / Bulb 13 Watt - 6500K / 4000K / 3000K,Rp18.500
elektronik,lampu,INLITE Lampu LED Bulb Tabung Kapsul Sensor Cahaya INBC002 20W Putih,Rp48.222
elektronik,lampu,LED Strip Selang SMD 5050 AC 220V Meteran Per-1 Meter Outdoor Dekorasi,Rp999
elektronik,lampu,Bohlam LED Bulb 20 Watt Luby Squash Cahaya Putih 20 Watt,Rp31.650
elektronik,lampu,Lampu LED Bulb Bohlam PHILIPS Paket 10 watt Mycare Pack 10w Multipack,Rp129.900
elektronik,lampu,PHILIPS LAMPU LED BULB 12W 12 W WATT PUTIH /KUNING / NATURAL 4000k,Rp47.500
elektronik,lampu,"DIY lampu led smd dc 3,7 - 5 volt 8 watt pcb alumunium terang",Rp3.900
elektronik,lampu,LED Clip Book Light Reading Lamp For Travel Lampu Mini Portable Bright,Rp30.000
elektronik,lampu,Morgen Grand Lampu Neon LED TL T5 18W 120cm Tube Batten Berbagai Warna,Rp31.800
elektronik,lampu,LED CAHAYA Capsule 5/10/15/20/30/40/50W/LAMPU JUMBO SNI,Rp16.888
elektronik,lampu,DOWNLIGHT LED SUPER SLIM DL262 D150 12W PHILIPS,Rp87.000
elektronik,lampu,BARDI Smart LED BLUETOOTH 9W RGBWW Bulb - ORIGINAL lampu tidur terbaik,Rp71.000
elektronik,lampu,Lampu Emergency Professional Mitsuyama MS-508 IP66 Water Resistant,Rp199.500
elektronik,lampu,Lampu LED Philips Kuning Warm White 4W 4 W Watt 4Watt,Rp25.922
elektronik,lampu,Hannochs Symphony Outbow 9 Watt LED Downlight Timbul OBR Lampu Plafon,Rp55.000
elektronik,lampu,SENTER SWAT MINI ZOOM / SENTER LED POLICE CHARGEABLE / SENTER MINI CAS,Rp14.500
elektronik,lampu,Lampu Emergency Sunsonic Magic LED 9 12 18 Watt 3 Mode,Rp18.798
elektronik,lampu,LED STRIP 2835 / 3528 PUTIH WHITE IP 44 GEL OUTDOOR 5 METER 300 LED,Rp32.500
elektronik,lampu,Lampu sorot LED Hinolux 10w 20w 30w 50w Flood Light HL5000-JT IP66 SNI,Rp63.900
elektronik,lampu,Lampu LED CAPSULE STARLUX MAX 20 Watt,Rp19.250
elektronik,lampu,Cabe Led E12 Sembayang/ Hias - Clear (isi 2),Rp15.000
elektronik,lampu,Soket Lampu T5/ konektor t5 soket pararel t5,Rp3.500
elektronik,lampu,lampu led panaled murah berkualitas 15 watt e 27,Rp5.000
elektronik,lampu,Lampu Bohlam Pijar 15w 25w 60w 75w Philips Lampu Siawet Philips Clear,Rp17.500
elektronik,lampu,PAKET 1 Sampai 5 METER LAMPU LED STRIP 5050 PLUS SOCKET AC 220V,Rp13.999
elektronik,lampu,Lampu tempel emergency bulat / lampu darurat,Rp2.550
elektronik,lampu,Kap Lampu Downlight 5inch Gold Murah,Rp28.500
elektronik,lampu,Kepala Only Tongkat Stick Ganti Lampu Pengganti Bohlam Pasang Putar,Rp24.999
elektronik,lampu,AOKI LAMPU LED TITAN 15W AK-5015,Rp22.500
elektronik,lampu,LED bulb 12 Watt Philips putih,Rp45.000
elektronik,lampu,"Downlight 4"" E27 Putih Kaki 2 Kap D/L Lampu Reflektor 4 Inch White",Rp31.500
elektronik,lampu,Lampu Downlight LED 1W 1 Watt Sorot Mini Spot Light TOP Quality,Rp21.999
elektronik,lampu,Desk Lamp / Desk Lamp Arsitek / Lampu Belajar / Lampu Arsitek,Rp95.000
elektronik,lampu,Lampu bohlam led 9 watt krisbow / bohlam isi 5 pcs / bulb led,Rp95.000
elektronik,lampu,Lampu Led New Tricolour 10w & 14w - Lampu Led 3 Warna Cahaya Hannochs,Rp23.300
elektronik,lampu,LED Strip SMD 5050 Yellow/Kuning IP44 WATERPROOF,Rp51.500
elektronik,lampu,Lampu Bohlam LED Merk Cahaya 3W 5W 7W 9W 12W 15W 18W Putih,Rp10.500
elektronik,lampu,LED Strip Flexible 12V 2835 120LED SMD TERBAIK GARANSI 3BLN,Rp50.000
elektronik,lampu,lampu vonic 20 watt,Rp6.500
elektronik,lampu,Lampu LED 212 Lampu Taman Lampu Tenaga Surya Sensor Gerak,Rp26.250
elektronik,lampu,DOWNLIGHT-LED PANEL SLIM 18 WATT IB PUTIH KOTAK PANASONIC NNP746673031,Rp124.400
elektronik,lampu,Samono SW-RLW08 Lampu Emergency Lampu Gantung Lampu Darurat 360°,Rp119.123
elektronik,lampu,Paket Senter Police Pocketman Senter LED Flashlight Baterai + Charger,Rp42.000
elektronik,lampu,Baru Lampu Langit-langit Modern Untuk Ruang Tamu Kamar Tidur Nordic,Rp306.090
elektronik,lampu,Lampu Sorot Tembak Led Floodlight 500 Watt 500W,Rp210.000
elektronik,lampu,Paket 3pcs Ecolink LED Bulb 15W E27 - Cool Day Light (Putih),Rp132.000
elektronik,lampu,LUMIRS Lampu LED STRIP 4000K IP65 2835 4000 K Selang OUTDOOR 220v AC,Rp149.500
elektronik,lampu,Bohlam Warna Warni LED 7watt LED Bulb RGB + Remote Lampu Tiktok 7w,Rp31.000
elektronik,lampu,"Lampu Mobil - Bohlam Kaki 1, Kepala Besar - Stanlee Star",Rp2.750
elektronik,lampu,LED Driver Adaptor Switching Power Supply 12-18W 18-25W 25-36W 36-50W,Rp25.950
elektronik,lampu,Fitting lampu Flexibel On Off Colokan lampu E27 Saklar Switch On Off,Rp20.000
elektronik,lampu,"Lampu Ublik 2 LED, Lampu Teplok, Lampu Templek, Lampu Emergency",Rp17.900
elektronik,lampu,Kap Lampu TKO 1x36 watt / Kap Lampu TL TKO 1x36watt,Rp54.600
elektronik,lampu,Fitting Lampu Tarik Cabang 2 Visalux V280W,Rp9.750
elektronik,lampu,Fiting Gantung BROCO Hitam 216L / Fiting Gantung Broco,Rp3.950
elektronik,lampu,Fitting lampu otomatis FA-224 pakai waktu bukan sensor cahaya,Rp60.000
elektronik,lampu,Lampu TL Neon T5 LED 13W 90cm Tube 90 cm 13 w watt WARM WHITE KUNING,Rp28.900
elektronik,lampu,Ace - Krisbow Lampu Downlight Bulat Led 6w 400 Lm - Cool Daylight,Rp69.900
elektronik,lampu,"Panasonic Lampu LED neo Bulb 3 W 5 w, 7 W 9 W ( Kuning & putih )",Rp16.150
elektronik,lampu,Surya Capsule 28 Watt Lampu LED 28 W Putih Cool Daylight Original,Rp23.184
elektronik,lampu,Bohlam Lampu LED ARASHI CAPSULE 5W 10W 15W 20W,Rp9.800
elektronik,lampu,VACOLUX LED SOROT 100W Flood light Lampu FLOODLIGHT 100 w watt tembak,Rp189.900
elektronik,lampu,Bohlam Lampu LED DC 12V E27 Super Terang 15W 18W Mitsuyama Energy,Rp17.000
elektronik,lampu,LED Strip Flexible 5050 Putih 300 LED / Roll 12V Waterproof 5 Meter,Rp58.000
elektronik,lampu,Ace - Eglare Lampu Meja Led Cct 8W - Putih,Rp179.000
elektronik,lampu,BARDI SMART BULB 12W RGBWW WIFI - BOHLAM LAMPU PINTAR,Rp120.000
elektronik,lampu,"pcb led dc 3,7 - 5 volt dc bahan almunium",Rp1.000
elektronik,lampu,Lampu LED Surya Capsule New 42 Watt 42 W Putih Cool Daylight Original,Rp38.999
elektronik,lampu,FUNANA Senter LED Tactical Airsoft Rifle with Mount + Baterai - JG-3,Rp162.500
elektronik,lampu,Beli 2 Gratis 1 Ecolink Downlight Lampu Plafon LED 16W - Warm White,Rp149.000
elektronik,lampu,Hannochs LED Nova 12w Putih / Lampu Hannochs 12watt Hannochs nova 12w,Rp18.250
elektronik,lampu,Hannochs Dakota Bohlam LED Putih/CDL 5W 10W 15W 20W 28W 38W 48W,Rp13.500
elektronik,lampu,MORGEN LAMPU LED BULB STICK 9W 9 WATT,Rp15.499
elektronik,lampu,led module 3 mata Samsung 220V warna putih,Rp8.000
elektronik,lampu,Philips LED Strip 31087 - 7W - 27K Kuning & 65K Putih,Rp32.000
elektronik,lampu,Lampu Strip Selang LED SMD 5050 Mata Besar AC 220V Meteran Per Meter,Rp4.341
elektronik,lampu,Hannochs Lampu Led Kapsul 36 Watt Vario,Rp47.000
elektronik,lampu,"LAMPU PANEL LED / LAMPU DOWNLIGHT LED 12W 12WATT 12 W 6 inchi 6""",Rp32.000
elektronik,lampu,Lampu Led Sinaya Premium 5 Watt 10 Pcs - Putih,Rp42.000
elektronik,lampu,Lampu Selang LED NEON FLEX / Neon Flexible per Meter 220v IP65,Rp7.850
elektronik,lampu,Senter Palu Emergency LED COB Pemecah kaca Mobil Multifungsi 4 ini 1,Rp29.000
elektronik,lampu,Lampu LED Bulb 3w MyCare My Care Philips,Rp19.116
elektronik,lampu,drat lampu ukuran E27 kualitas super tebal,Rp300
elektronik,lampu,Konverter Fitting Lampu E27 ke E14 Cap Lamp Light Converter Adapter,Rp3.400
elektronik,lampu,Kap Fitting Downlight 5 inci silver 5inci Down light rumah lampu 5inch,Rp28.900
elektronik,lampu,Lampu Led Dekorasi Interior Mobil Bintang Usb Star Decoration Lamp,Rp9.500
elektronik,lampu,bohlam lampu led hannochs vario 18 watt,Rp22.000
elektronik,lampu,LAMPU INLITE IN-LITE LED PAR 38 PAR38 15W 15 W 15 WATT,Rp91.000
elektronik,lampu,Golden LED LAMPU DOWNLIGHT LED 3 WARNA 6WATT/PANEL LED/LAMPU PLAFON,Rp10.599
elektronik,lampu,Paket 3pcs Ecolink LED Mini Bulb 4W E27 - Cool Day Light (Putih),Rp33.000
elektronik,lampu,LAMPU MERCURY ML 250W 250 WATT E40 LAMPU JALAN,Rp70.000
elektronik,lampu,LAMPU FILAMEN LED 4W / LAMPU FILAMEN EDISON/ FILAMEN CAFE,Rp7.500
elektronik,lampu,Lampu LED Hannochs VARIO LED Bulb 12 Watt Bohlam,Rp17.500
elektronik,lampu,Lensa Convex Mini +Housing 13mm HPL LED Lens Sorot 30 45 60 90 120,Rp1.350
elektronik,lampu,LAMPU SPOTLIGHT SOROT PLAFON 3W 3 W WATT INTECH INBOW 3 MATA 55x85MM,Rp28.500
elektronik,lampu,LAMPU EKONOMAT VISTA BOHLAM LED 19 15 11 9 7 W WATT 19W 15W 11W 9W 7W,Rp18.000
elektronik,lampu,Bohlam Lampu LED Music - Speaker Lampu LED Bohlam 8377,Rp28.500
elektronik,lampu,PHILIPS LED ESSENTIAL MR16 4.5-50W 36D 100-240V,Rp42.100
elektronik,lampu,FITTING GANTUNG HITAM 216L E27 - BROCO,Rp4.050
elektronik,lampu,Lampu TL Neon T5 LED 12w Panjang 90cm,Rp30.000
elektronik,lampu,fitting E27 menjadi mr16 converter fittingsambung e27,Rp19.000
elektronik,lampu,Philips SOFTONE 25W E27 220-240V Soft WarmWhite - Cahaya Kuning,Rp10.230
elektronik,lampu,Lampu LED Hannochs Sonic 7W Putih 7 w 7 watt 7watt cooldaylight,Rp15.000
elektronik,lampu,Ballast philips BTA 36watt,Rp50.000
elektronik,lampu,LED driver AC-DC ISOLATED 24W-36W 300 mA seri 24-36 watt HPL 1W 300mA,Rp36.500
elektronik,lampu,Philips Pomeron 7Watt 2700K/4000K- Spotlight,Rp110.000
elektronik,lampu,LAMPU LED HANNOCHS VARIO 36 WATT / BOHLAM LED VARIO 36 W - BERGARANSI,Rp44.550
elektronik,lampu,Lampu Light Sensor Cahaya Putih 11 Watt Hannochs,Rp46.900
elektronik,lampu,Lampu Led Hannochs Sonic 3w 5w 7w 9w 12w 15w 20w / Led Hannochs Sonic,Rp8.900
elektronik,lampu,Lampu sorot 1 set isi 4 Rel 2M LED Track light rel spotlight Ulir E27,Rp234.999
elektronik,lampu,Philips Multipack MyCare LED Bright 13W E27 6500K Putih isi 3 buah,Rp106.000
elektronik,lampu,LAMPU LED BULB CAPSULE INLITE IN LITE INBC002 50WATT 50W VALUE PUTIH,Rp75.000
elektronik,lampu,Spidol Marker Chalk Fluorescent Flash color 6MM Led Board,Rp25.000
elektronik,lampu,LAMPU DOP CHIYODA 5W HYPER,Rp4.100
elektronik,lampu,LED Strip 5 Volt WARM WHITE,Rp48.500
elektronik,lampu,Lampu Hias Gantung LED Outdoor Waterproof Taman Dekorasi Cafe Kamar -,Rp34.900
elektronik,lampu,Lampu LED Bulb 3 Watt 3000K Warm White Cahaya Kuning,Rp8.000
elektronik,lampu,INLITE Lampu LED Dinding / IN LITE Wall Step Light Tangga 3W - INWL238,Rp34.600
elektronik,lampu,PHILIPS LAMPU LED BRIGHT 17W PUTIH GROSIR LEDBRIGHT 17 W WATT TORNADO,Rp60.550
elektronik,lampu,Chiyoda Dop Pijar 5W 5 Watt HYPER/ Lampu Pijar Kuning Panas Lampu Ayam,Rp4.350
elektronik,lampu,BOHLAM LED LUBY CLASSIC CAHAYA PUTIH,Rp10.800
elektronik,lampu,PHILIPS ST033T 7W 7Watt Projector - Lampu Track / Rel ( Body Hitam ),Rp159.900
elektronik,lampu,Colokan Socket Lampu Selang LED Strip 5050 AC 220v,Rp10.000
elektronik,lampu,LUXEN CLASSIC LAMPU LED BULB 12W NATURAL WHITE 4000K SNI BAGUS GARANSI,Rp17.999
elektronik,lampu,Lampu Strip Selang LED Mata Besar SMD 5050 AC 220V Meteran Per Meter,Rp999
elektronik,lampu,LED STRIP COB 252 LED DOTLESS / LED STRIP DC12V PUTIH/WW/4000K,Rp87.500
elektronik,lampu,Senter Tangan LED Kecil Surya SYT L017 Senter Saku,Rp24.500
elektronik,lampu,Lampu Taman SOLAR Tancap | Lampu Outdoor LED Tenaga Surya WATERPROOF,Rp45.000
elektronik,lampu,Philips 59261 Eridani Recessed LED Downlight 5 Watt,Rp56.500
elektronik,lampu,Lampu Bohlam LED Hannochs Sonic 20W 20 Watt Cahaya Putih 6500K CDL,Rp39.000
elektronik,lampu,Lampu Sorot Luby 10 watt LBKS-501 / Lampu Tembak / Flood Light,Rp39.750
elektronik,lampu,Led Bulb Osram Eco Classic A Warm White Kuning,Rp16.750
elektronik,lampu,Refill Lampu UV Nyamuk TL 20w / Lampu Neon Insect killer 20watt T8,Rp23.000
elektronik,lampu,"Lampu LED Tin-Tin Platinum 5 WATT, GARANSI 1 TAHUN, TIN-TIN",Rp5.250
elektronik,lampu,Toshiba Lampu GU10 7.5 Watt Cahaya WarmWhite,Rp29.500
elektronik,lampu,Kap Balok untuk Lampu Neon atau TL 36 watt / 40 watt,Rp37.500
elektronik,lampu,Hannochs Downlight LED / LED Panel Easy II IBR 3 W - 12 W 4000K Bulat,Rp37.950
elektronik,lampu,Hannochs Smart LED Futura 9 watt RGB - Lampu Wifi Warna,Rp90.000
elektronik,lampu,"PHILIPS LAMPU LEDBULB MYCARE 3W,4W,6W,8W,10W,12WATT KUNING/WARM WHITE",Rp20.313
elektronik,lampu,Lampu T5 8 Watt HiMAWARi Tricolor - Lampu TL T5 8W Panjang 30cm,Rp22.000
elektronik,lampu,Lampu Bohlam Emergency LED Lamp Arashi Magic 9W 12W 18W - 9 12 18 Watt,Rp25.000
elektronik,lampu,Lampu Led Spotlight Spot light Downlight COB sorot 5W 5 Watt,Rp12.750
elektronik,lampu,HK-5066NEON/Lampu LED Strip Neon Flexible LED Strip Flexible IP65 220V,Rp485
elektronik,lampu,LED strip Yamasaki SMD 5050 Ip33 Dc12v 60led 5M Warm White 12w/Meter,Rp55.000
elektronik,lampu,Lampu PHILIPS LED Bulb bohlam 14.5W Pack Multipack,Rp180.780
elektronik,lampu,Lampu Light Sensor (Sensor Cahaya) Photocell Menyala Otomatis Hannochs,Rp55.000
elektronik,lampu,2 Pcs Baterai Batre batere Eveready Type C ukuran TANGGUNG / SEDANG,Rp14.000
elektronik,lampu,Lampu dinding 1ARAH 2 ARAH - Lampu Pilar - Lampu Tembok Dekorasi,Rp76.000
elektronik,lampu,InLite Lampu LED Panel Plafon Slim Downlight 12W 12 Watt INDS602R,Rp41.500
elektronik,lampu,Lampu LED Bulb Philips 13W Paket 3 free 1,Rp156.000
elektronik,lampu,PAKET 5 PCS!! Lampu Led Sinaya Barokah 15 W (Putih/CDL),Rp64.050
elektronik,lampu,NEON FLEX LAMPU LED SELANG 12V PANJANG 5M KUALITAS SUPER BAGUS 12V,Rp85.000
elektronik,lampu,Socket adaptor LED STRIP RGB 3258 - 5050 / Kabel colokan LED strip,Rp16.250
elektronik,lampu,kabel fitting lampu cafe gantung 10m 10 m dekorasi outdoor fitting,Rp95.999
elektronik,lampu,PAKET LAMPU SOROT REL LED 3 WATT ISI 3 LENGKAP REL TRACK LIGHT,Rp50.000
elektronik,lampu,Philips Lampu Smart WiFi LED 9 Watt - Tuneable White,Rp48.500
elektronik,lampu,Lampu Philips T-Force 30W E27 865,Rp96.500
elektronik,lampu,Huawei Charging Table Lamp Original Huawei,Rp75.000
elektronik,lampu,Lampu Anti Nyamuk PLS - E27 15watt / Lampu UV BL insect Killer 15 watt,Rp30.000
elektronik,lampu,Dop H4 Bohlam Lampu Philips 12Volt 60/55,Rp26.000
elektronik,lampu,Pesonacom Lampu LED Bohlam tabung kapsul SNI 5 10 15 20 30 40 w watt,Rp3.400
elektronik,lampu,lampu LED Pack 8 watt Philips beli 3 gratis 1,Rp108.000
elektronik,lampu,Lampu Bohlam LED Philips 4 Watt Cool White 4000K (4W 4 W 4Watt) -BESAR,Rp26.900
elektronik,lampu,Hannochs Lampu Emergency LED AC/DC EON 8 Watt (2pcs) - Cahaya Putih,Rp136.000
elektronik,lampu,Lampu LED ekonomat 1 watt Putih 1w / 1 w Bulb LED 1watt Lampu Tidur,Rp4.999
elektronik,lampu,Lampu TL Neon T5 LED 20w 120cm Tube Warna Warni,Rp30.900
elektronik,lampu,Senter LED Charge SYT-V171 SURYA,Rp12.750
elektronik,lampu,philips downlight led panel magneos dl 262 4 w 6 w 9 w 12 w inbow,Rp57.500
elektronik,lampu,Lampu Sorot Led 200 Watt COB / Led Floodlight 200 Watt,Rp115.000
elektronik,lampu,SURYA SHL L4003 Frosted Lampu Led Emergency Darurat Rechargeable,Rp87.900
