base_type,type_,text,price
elektronik,lampu,LED MAGNETIC TRACK LIGHT INBOW REL LAMPU TRACKLIGHT RAIL 1 METER,Rp180.000
elektronik,lampu,GARDEN LAMP LAMPU TAMAN COB 5W LAMPU SOROT COB LAMPU TANCAP,Rp28.975
elektronik,lampu,Lampu Led Filamen 2w 3w 4w Bohlam Pijar Edison Cafe G45 ST64,Rp6.100
elektronik,lampu,Lampu Led Strip RGB Warna Warni IP44 3528 Komplit Set Adaptor Remote,Rp24.000
elektronik,lampu,Lampu Tempel Dinding Led Magnetic Portable 3 Mode Lampu,Rp22.000
elektronik,lampu,LAMPU EMERGENCY 26SMD 8JAM USB DARURAT AOKI AK 7820,Rp42.500
elektronik,lampu,UPHOME Lampu Tidur Led Wireless Remote Control 3 Color Gaya Jepang,Rp85.000
elektronik,lampu,BARDI Smart LED BLUETOOTH BT 9W RGBWW Beacon Bulb Lampu Tidur Kerja,Rp73.000
elektronik,lampu,MOVIO LED Magnet Lamp - Lampu Baca / Lampu Meja / Lampu Dinding Tempel,Rp70.000
elektronik,lampu,Rechargeable LED Flashlight Senter LED Isi Ulang Joyko FL-88,Rp36.630
elektronik,lampu,Lampu LED LUMENS 12w 12 watt 12watt putih TERANG MURAH 110++ Lm/W,Rp21.859
elektronik,lampu,"PANALED PREMIUM , LED SUPER BRIGHT, BERKUALITAS ,5/10/15/20/30/40w SNI",Rp3.000
elektronik,lampu,kap lampu gantung/kap wd+fitting gantung E27 uk 30cm free bubble wrap,Rp12.500
elektronik,lampu,Tongkat lampu lintas lalu/lampu lalin kurus panjang / pedek senter,Rp29.000
elektronik,lampu,Golden LED LAMPU DOWNLIGHT LED 3 WARNA 6WATT/PANEL LED/LAMPU PLAFON - Model 1,Rp10.599
elektronik,lampu,Philips Lampu Smart WiFi LED 13W With Bluetooth - Tunable White,Rp50.100
elektronik,lampu,LAMPU MR16 MR 16 3W / 5W / 7W INLITE INMR1603 PUTIH / KUNING,Rp12.500
elektronik,lampu,SENTER LED 5 MATA 60W + 20W SUPER TERANG / SENTER CAS LED,Rp34.990
elektronik,lampu,LED Downlight PHILIPS Meson Putih 3.5 5 9 13 17 21 24 Watt PACK Isi 3,Rp133.900
elektronik,lampu,Lampu Sorot 10w 20w 30w 50w PUTIH Emico PUTIH BEST SELLER HIGHQUALITY,Rp20.750
elektronik,lampu,Lampu LED Luby tipe Classic Garansi 1 tahun Lampu Luby,Rp10.200
elektronik,lampu,Lampu Taman Pagar Halaman Tenaga Surya Solar Cell Waterproof Set 4 PCS,Rp50.000
elektronik,lampu,BASEUS i-Wok Series USB Screen Hanging Light - DGIWK-B,Rp294.000
elektronik,lampu,Paket Lampu sorot rel 1 set isi 3 spotlight track light rell hitam,Rp165.000
elektronik,lampu,Lampu Downlight LED Panel Bulat Inbow Morgen Grand 4w / 5w / 9w / 12w,Rp18.000
elektronik,lampu,lampu bohlam led dc 12v 25w jepit kebaterai / aki accu,Rp6.990
elektronik,lampu,Fitting Lampu Sensor Cahaya Otomatis Untuk Segala Lampu,Rp16.500
elektronik,lampu,"AONEZ Lampu bulan, lampu dekorasi bulan, lampu malam",Rp13.999
elektronik,lampu,VALESCOM lampu sorot led COB 50W 100W 200W 300W 400W SNI outdoor ip66,Rp53.000
elektronik,lampu,Downlight LED PHILIPS ERIDANI 14W 6inch 14 Watt D150 DL190B,Rp66.630
elektronik,lampu,Lampu Downlight Outbow E27 4Inch Rumah Lampu Down light 4 inch Plafon,Rp33.999
elektronik,lampu,Hannochs Lampu LED NEX 15 watt CDL - Putih,Rp28.700
elektronik,lampu,LAMPU KOLAM RENANG LED UNDERWATER 12 WATT SWIMMING POOL (sku : 13499),Rp355.000
elektronik,lampu,Broco Fitting Lampu Plafon Bulat 1212 White E27 Ceiling Lamp Holder,Rp9.965
elektronik,lampu,LAMPU LED DOWNLIGHT / SLIM DOWN LIGHT / PANEL LED INBOW 9W 12W 18W,Rp29.000
elektronik,lampu,Hannochs Lampu LED Light Sensor (Sensor Cahaya) 11 watt cahaya Putih,Rp58.700
elektronik,lampu,lampu neon flex LED DC12volt 5meter selang led flexibel ed susu,Rp45.000
elektronik,lampu,Emergency Light / Lampu darurat Luby tipe L-7771,Rp138.800
elektronik,lampu,Lampu Led Filamen edison 2 Watt G45 E27,Rp6.100
elektronik,lampu,ALI88 LAMPU LED STRIP SELANG 5050 SMD AC 220V METERAN (1M-100M),Rp500
elektronik,lampu,IKEA LERSTA Lampu Lantai / Lampu Baca Alumunium,Rp249.000
elektronik,lampu,COB Star 220v 3w 5w 7w LED Putih White Lampu PLN AC Super Terang 25mm,Rp8.500
elektronik,lampu,Lampu belajar LED tombol portable lampu tidur lampu lemari multifungsi,Rp2.500
elektronik,lampu,Paket Lampu LED Neon Flex 220V Lengkap Tinggal Colok / HK-5066 Strip,Rp18.000
elektronik,lampu,Lampu LED Murah Bohlam LED MYLed PLATINUM Cahaya Putih,Rp3.900
elektronik,lampu,Lampu LED STRIP SELANG SMD 5050 100M 220v 100 M METER OUTDOOR DEKORASI,Rp495.000
elektronik,lampu,FITTING LAMPU GANTUNG OUTDOOR 10 METER 10 FITING E27 10M KABEL,Rp46.500
elektronik,lampu,SLB3626-2 LAMPU DINDING NAKAS BEDSIDE MINIMALIS PANAH GOLD WALL LAMP,Rp599.000
elektronik,lampu,LAMPU HIAS LED CANDLE FITTING E14 2 WATT 4 WATT C35 MODEL LILIN,Rp7.250
elektronik,lampu,Lampu Meja LED Eye Protection Lampu meja Lampu Belajar Mode sentuh,Rp79.000
elektronik,lampu,EMICO Lampu Bohlam LED RGB Remote 7 Watt E27 SNI Warna Warni RGBW 7W,Rp24.800
elektronik,lampu,Senter LED Super Terang Rechargeable + COB Senter Led Jarak Jauh + COB,Rp35.000
elektronik,lampu,Paket Senter LED E17 CREE XM-L2 8000 Lumens Baterai Charger Pouch Box,Rp67.500
elektronik,lampu,Hiled LED Strip 2835/60LED/DC12V/33 - 6500K 3000K 4000K 2700K,Rp114.000
elektronik,lampu,"Philips Lampu LED 12Watt, 12W, 12 Watt, 12 W (1 paket isi 4PCS)",Rp37.450
elektronik,lampu,Senter cas LUBY L2673 senter besar 2in1 LED RECHARGEABLE HANDLIGHT,Rp75.500
elektronik,lampu,Modul Bohlam Lampu LED Listrik AC SMD White/Warm 3W-15W PCB Aluminium,Rp2.990
elektronik,lampu,Kabel fitting lampu cafe gantung 10 meter filamen dekorasi 10m outdoor,Rp47.000
elektronik,lampu,LED Strip Flexible 12V 5050 SMD TERBAIK GARANSI 3BLN,Rp45.000
elektronik,lampu,Lampu Meja LED Jepit Lampu Belajar Lampu Meja Lampu Baca 3 Warna Lampu,Rp99.000
elektronik,lampu,Philips Smart WiFi LED Bulb WiZ Connected Tuneable White 9W E27,Rp55.000
elektronik,lampu,Touch Light Omextra Lampu Sentuh USB 6 LED Plafon Laci Kolong Mobil VT,Rp29.900
elektronik,lampu,Lampu Proyektor Malam Langit Bintang dan Bulan Lampu Tidur Lampu Hias,Rp159.000
elektronik,lampu,lampu edison LED Filamen 2 watt 2watt bohlam edison cafe 2w 4watt g45,Rp1.000
elektronik,lampu,Lampu LED Neon Flex LED Strip Flexible 5 Meter DC 12V IP65 WATERPROOF,Rp25.000
elektronik,lampu,Lampu Tenaga Surya Solar Cell Panel Waterproof Two Light -191006ZK,Rp225.720
elektronik,lampu,Aonez lampu tidur unik dan lucu dengan bentuk yang unik dan lampu tidu,Rp13.999
elektronik,lampu,Camelion Senter LED FL1L 2 X Baterai AA,Rp21.000
elektronik,lampu,Lampu selang LED strip 5050 paket 1 Meter LED drop ceiling plafon outd,Rp1.990
elektronik,lampu,Lampu Senter Mini Super Terang Flashlight LED Portable Cas USB Charger,Rp18.900
elektronik,lampu,lampu philips essential 18w putih,Rp36.000
elektronik,lampu,Lampu LED Murah Bohlam LED PANALED ALTIS Cahaya Putih 10PCS,Rp54.000
elektronik,lampu,Lampu LED Tidur sensor cahaya Lampu Lorong Kamar dekorasi Sleep Lamp,Rp7.288
elektronik,lampu,Philips - Lampu LED Essential Multipack / Paket 7W (Putih),Rp64.900
elektronik,lampu,Paket Lampu Sorot 20w 1 set isi 3 + Rel 1M Track Light Rel Spotlight,Rp148.000
elektronik,lampu,Lampu LED Bohlam LED Garansi 1 Tahun SCORE Nitro 5W 7W 9W 12W 15W 18W,Rp6.000
elektronik,lampu,Lampu TL Neon T5 LED Tube Lampu T5 LED 5W 30cm 10W 60 cm,Rp17.999
elektronik,lampu,MAGIC - Lampu LED Neon Flex Selang 12V DC / Neonflex Flexible 5M,Rp10.500
elektronik,lampu,Yeelight Smart LED Bulb W3 YLDP005,Rp169.000
elektronik,lampu,LAMPU SOROT 50W RGB MODEL TIPIS IP65 / LAMPU TEMBAK TIPIS 50 WATT RGB,Rp18.999
elektronik,lampu,Paket Lampu LED Neon Flex 220V Lengkap Tinggal Colok / HK-5066 Strip,Rp18.000
elektronik,lampu,Lampu Sorot Taman Tenaga Surya / Lampu Sorot Solar Cell / Lampu Teras,Rp132.900
elektronik,lampu,Fitting Lampu Sensor Cahaya Otomatis Untuk Segala Lampu,Rp16.500
elektronik,lampu,Kap Lampu TKO LED 2x36 120cm kap TKO TL 2x16 Philips Komplit,Rp164.900
elektronik,lampu,Lampu Belajar / Lampu Meja LED Mode Sentuh Leher Fleksibel,Rp23.500
elektronik,lampu,Lampu Led Sinaya Premium LED 15 W 10 Pcs ( Putih ) !,Rp71.000
elektronik,lampu,Lampu Lalin Lalu Lintas / Lampu Lalin Magnet / Lampu Lalin Pluit Pro,Rp68.000
elektronik,lampu,LAMPU LED MODUL 12 MATA 24V 2835 10438 ULTRASONIC VARIASI MOBIL 12MATA,Rp3.600
elektronik,lampu,LAMPU T5 LED TUBE LIGHT TUBELIGHT 30CM 60CM 100CM 120CM 6W 10W 18W 20W,Rp24.000
elektronik,lampu,LAMPU sorot tungsten JALAN 50W PJU Tungsten LED SUNLAMP SOROT OUTDOOR,Rp4.000
elektronik,lampu,lampu jalan solar cell lampu dinding tenaga surya tenaga matahari 30w,Rp75.888
elektronik,lampu,Lampu Downlight Putih PHILIPS LED 3 4 5 6 7 8 Inch 3 5 7.5 12 14W Watt,Rp38.900
elektronik,lampu,lampu led Philips smart Wifi tunable 13w 13 watt,Rp68.000
elektronik,lampu,Hard Strip LED SMD 4014 14W Cool White AC 220V + Casing Transparan 1 M,Rp27.000
elektronik,lampu,Senter 4 LED COB Senter 4 Mode Jarak Jauh Senter Camping 4 Mata Lampu,Rp23.500
elektronik,lampu,"Lampu Bohlam Emergency LED AC/DC Genius 6w,8w,10w,12w,15w Hannochs",Rp64.200
elektronik,lampu,Lampu LED Essential PHILIPS 3W 5W 7W 9W 11W 13W W Watt Putih Kuning,Rp16.150
elektronik,lampu,lampu led selang 5050 led strip drop ceiling plafon outdoor meteran,Rp2.500
elektronik,lampu,Bohlam Lampu LED 40Watt Model Bola 5in1 Dragon Ball Football Ufo,Rp19.600
elektronik,lampu,lampu sorot spot rel spot light track rel 10w 10 watt tembak led,Rp20.000
elektronik,lampu,PHILIPS LED Downlight Pack 59464 MESON 125 13W 65K ID MP recessed,Rp180.040
elektronik,lampu,Lampu Led Filamen 2w 3w 4w Bohlam Pijar Edison Cafe G45 ST64,Rp6.100
elektronik,lampu,Lampu Sunset - Lampu Tidur - Lampu Hias - Lampu Proyektor LED Sunset,Rp26.000
elektronik,lampu,Lampu Downlight LED Panel 12W Putih 12 W Watt 12Watt Tipis Bulat Inbow,Rp24.900
elektronik,lampu,LUMI Smart Home Lampu LED Light Strip RGBW + Adaptor Controller IR,Rp148.900
elektronik,lampu,Lampu LED Philips Multipack 12Watt 12W 12 Watt 12 W Paket Isi 4,Rp139.990
elektronik,lampu,Bohlam Lampu LED Emergency 28 W Jumbo / Lampu Darurat / Lamp Magic,Rp19.999
elektronik,lampu,AVARO Lampu Smart LED 10W Bluetooth Smart Bulb RGB+WW,Rp29.900
elektronik,lampu,Lampu Tanam Taman Solar Tenaga Surya Outdoor 8 LED Anti Air,Rp25.000
elektronik,lampu,SENTER SWAT LED 36W / SENTER LED POLICE CHARGEABLE / SENTER CAS,Rp27.500
elektronik,lampu,Ace - Eglo Up-Ii Lampu Lantai - Hitam,Rp249.000
elektronik,lampu,Tongkat Pengganti Lampu Panjang 2 Meter Downlight Downlights 2 M 2m,Rp38.710
elektronik,lampu,PHILIPS TL-D TLD 36W/54 36 W WATT LAMPU NEON 120 CM,Rp19.300
elektronik,lampu,Bohlam Lampu LED Phillips promo beli 3 gratis 1 6 watt-12watt,Rp116.400
elektronik,lampu,Lampu Bohlam Hannochs SONIC LED Bulb 6 10 13 Watt - Paket Buy 3 Get 1,Rp45.500
elektronik,lampu,LAMPU LED PAKET INLITE 5W/7W/9W/12W/15W PUTIH/ KUNING INB007,Rp40.300
elektronik,lampu,Lampu LED Kawachi Diamond Garansi 1 tahun 5W 10W 15W 20W 30W 40W 50W,Rp11.300
elektronik,lampu,Tongkat Pengganti Bohlam Lampu Nagata NGT 2008,Rp82.500
elektronik,lampu,Senter 4 LED + COB Light Super Terang L-S03 Senter Rechargeable 4 Mode,Rp23.195
elektronik,lampu,ECOKING Lampu LED Sensor Cahaya 12W Putih 12 W ESS-812DL 12 Watt SNI,Rp39.000
elektronik,lampu,Lampu Led Sinaya Premium LED 10 W 10 PCS ( Putih ) !,Rp55.000
elektronik,lampu,LAMPU RELL LED TRACK LAMP 10W 20W 30W COB TRACK LIGHT SPOT LIGHT,Rp65.000
elektronik,lampu,Philips Paket Lampu Led 8 Watt 4 Buah,Rp109.000
elektronik,lampu,Galaxy Star Projector Night Light Astronaut Starry Sky Lamp Home Room,Rp225.000
elektronik,lampu,Lampu Gantung Lilin Kristal Chandelier 88KE,Rp3.420.000
elektronik,lampu,LAMPU EMERGENCY 50SMD DARURAT AOKI AK 7830,Rp62.500
elektronik,lampu,54D Led Strip RGB 2835 / 5050 IP65 12V Remote 10M 2 Cabang 5M,Rp25.999
elektronik,lampu,Klem Lampu Neon Flex LED 12 Volt 220 V Bracket Selang Susu 220volt 12V,Rp700
elektronik,lampu,LAMPU LED STRIP SELANG 5050 SMD AC 220V METERAN (1M-100M) OUTDOOR,Rp4.250
elektronik,lampu,PHILIPS LED MULTIPACK 5W 6W 7W 8W 9W 10W 11W 12W PUTIH PAKET ISI 4 PCS,Rp54.745
elektronik,lampu,Philips LED Essential pack/paket 5W 7W 9W 11W Multipack 3 FREE 1 Promo,Rp54.000
elektronik,lampu,Lampu LED Kawachi Diamond 80watt Garansi 1 tahun 80w Lampu LED 80 WATT,Rp53.900
elektronik,lampu,lampu mesin jahit led 20 titik,Rp22.450
elektronik,lampu,Lampu Led Hannochs Vario 24Watt,Rp26.700
elektronik,lampu,"Kap Lampu Downlight Outbow 4 INCH FITTING e27 HITAM PUTIH OB BULAT 4""",Rp46.500
elektronik,lampu,DOWNLIGHT PANEL LAMPU TEMPEL PLAFON 6W 12W 18w LED OUTBOW BULAT KOTAK,Rp34.900
elektronik,lampu,Lampu Meja Belajar LED Design Minimalis Lampu Tidur Lampu Kerja,Rp60.000
elektronik,lampu,Lampu PanaLed Altis / 5w 7w 9w 12w 15w 18w / Lampu Led Bulb panaled,Rp6.600
elektronik,lampu,Lampu Downlight Outbow 3 Watt 3W / Lampu Led Lemari Kitchen Set Tempel,Rp15.000
elektronik,lampu,List Rel Rumah Lampu HUBEN RULAM-17 Led Strip Alumunium Acrylic Cover,Rp40.000
elektronik,lampu,lampu led Philips smart Wifi Multipack tunable 9w 9 watt MULTICOLOR,Rp135.000
elektronik,lampu,GARANSI 12 BULAN! YOUNGPRO YSF-100 3 MODE LAMPU SOLAR 100 LED + PANEL,Rp89.900
elektronik,lampu,lampu tenaga surya IP67 Waterproof lampu led solar with Remote Control,Rp29.900
elektronik,lampu,Lampu LED Philips 10 watt multipack 10w Promo beli 3 gratis 1,Rp116.500
elektronik,lampu,Lampu LED Bulb Jumbo Tabung 5W 10W 15W 20W 30W 40W Kapsul Putih,Rp3.250
elektronik,lampu,Lampu Ecolink LedBulb Pack 6w 8w 10w 12w 6500K E27 paket 3 free 1,Rp45.900
elektronik,lampu,Lampu Taman Pilar Pagar Pimi05-08,Rp65.000
elektronik,lampu,Lampu Led Filamen 4W / 2W Filamen Edison 4 WATT / 2 WATT E27 bohlam,Rp7.200
elektronik,lampu,Lampu Hakamitsu Trend / Lampu Led Bulb / Lampu Putih / LED ABulb,Rp5.288
elektronik,lampu,Lampu Downlight LED Panel OB Bulat 12W Outbow 12 W Round 12 Watt,Rp32.500
elektronik,lampu,LAMPU PHILIPS LED 4W 6W 8W 10W 12W 14.5W MULTIPACK MYCARE PUTIH 6500K,Rp69.700
elektronik,lampu,LED Ekonomat 1 watt WARM WHITE 1w / 1 w Bulb LED 1watt Lampu Tidur,Rp4.999
elektronik,lampu,Paket Rangkaian Listrik Lampu Seri Pararel Praktek anak Sekolah,Rp10.000
elektronik,lampu,Kap Housing Aluminium LED Strip Rigid Bar Lampu 100 CM / 1 M,Rp11.684
elektronik,lampu,VALESCOM lampu LED sorot tembak terang COB SNI 50w 100w 200w 300w 400w,Rp58.100
elektronik,lampu,Lampu Led Max Starlux 30 Watt Cahaya Putih Super Terang,Rp33.500
elektronik,lampu,Hannochs LED NOVA 12W Cahaya Putih ( PAKET 10pcs ),Rp160.000
elektronik,lampu,Kadonio Lampu Led Strip RGB Warna Warni IP65waterproof Adaptor kontrol,Rp28.000
elektronik,lampu,Kabel fitting lampu cafe gantung 10 meter filamen dekorasi 10m outdoor,Rp47.000
elektronik,lampu,Neon Flex Custom | LED Neon Flex | Neon Sign | Dekorasi Kamar,Rp225
elektronik,lampu,LED Strip Flexible 12V 2835 120LED SMD TERBAIK GARANSI 3BLN,Rp50.000
elektronik,lampu,Lampu Dinding Pilar Lampu Taman Tembok Dinding Outdoor Minimalis Hias,Rp87.950
elektronik,lampu,Philips Wifi Led downlight 9 Watt Putih kuning,Rp67.500
elektronik,lampu,Lampu Downlight Mini LED COB 2W Plafon Spotlight Kecil,Rp14.250
elektronik,lampu,LAMPU LED FILAMEN 2W 4W BOHLAM PIJAR EDISON CAFE DEKORASI G45 ST64 E27,Rp7.188
elektronik,lampu,Paket Lampu Sorot 10w 1 set isi 3 + Rel 1M Track Light Rel Spotlight,Rp238.000
elektronik,lampu,Philips Lampu LEDBulb Essential 3w 5w 7w 9w 11w 13w putih Murah,Rp15.250
elektronik,lampu,Lampu LED Hannochs Avengers Cool Daylight 5W 7W 9W 12W 15W Bohlam Bulb,Rp9.062
elektronik,lampu,Lampu LED Neon FLex LED Strip Flexibel DC 12V IP65,Rp17.000
elektronik,lampu,Lampu LED PHILIPS MyCare Multipack putih 6500k 4 6 8 10 12 14.5 watt,Rp92.990
elektronik,lampu,Tongkat Pengganti Lampu 2in1 Stik Lampu Alat Pengganti Lampu,Rp28.800
elektronik,lampu,Hannochs Lampu LED Click & Dim 10 watt - 3 tingkat kecerahan - putih,Rp24.700
elektronik,lampu,SENTER LED JUMBO 20W AOKI AK 6686L,Rp99.500
elektronik,lampu,Lampu led strip 5050 SMD Per Meter / LED strip 5050 SMD Meteran,Rp999
elektronik,lampu,Lampu INLITE/IN-LITE Led Bulb Bohlam Murah 5W/7W/9W/12W/15W- 3GRATIS 1,Rp39.000
elektronik,lampu,"Lampu led candle Philips 5,5 watt E14 kuning",Rp39.000
elektronik,lampu,PHILIPS LAMPU LED MYCARE 8W PAKET LED BULB 8 WATT ISI 4 PUTIH,Rp120.304
elektronik,lampu,Lampu LED 3W 5W 7W 9W 12W 15W 18W Hakamitsu /Bohlam Lampu terang,Rp3.298
elektronik,lampu,Lampu COB Magnet LED Terang Carabiner Gantungan Kunci Senter Camping,Rp16.500
elektronik,lampu,LED Bulb PHILIPS MyCare 3W 4W 6W 8W 10W 12W 14.5W 19W Watt E27 Putih,Rp24.700
elektronik,lampu,LAMPU LILIN LED ELEKTRIC MINI CANDLE PORTABLE,Rp1.450
elektronik,lampu,Hannochs LED NOVA 30W Cahaya Putih ( PAKET 3pcs ),Rp123.700
elektronik,lampu,Bohlam Lampu LED USB SX-10W,Rp8.500
elektronik,lampu,Bohlam Lampu Phillips Essential 5 Watt 8W 11W 14W 18W 23W 32W,Rp26.730
elektronik,lampu,LED 3528 Ice Blue SMD Chip Warna Biru Muda,Rp390
elektronik,lampu,LAMPU DOWNLIGHT LED 3 WARNA 5WATT/ PANEL LED / LAMPU PLAFON,Rp9.500
elektronik,lampu,Lampu Led Murah Panaled 5w 7w 9w 12w 15w 18w CDL Putih Hemat listrik,Rp2.000
elektronik,lampu,lampu led panaled murah berkualitas 40 watt e 27,Rp10.400
elektronik,lampu,Ringlight Laptop PC Model Jepit | Lampu Portable,Rp34.000
elektronik,lampu,Lampu Led Grow Light Hidroponik Pengganti Sinar Matahari Untuk Tanaman,Rp17.500
elektronik,lampu,Philips LED Paket Multipack Bulb 6W 8W 10W 12W Essential 7W 9W 11W,Rp55.895
elektronik,lampu,Hannochs Vario 6w 12w 18w 24w 30w 36w 45w 50 Watt Lampu Led Putih SNI,Rp13.175
elektronik,lampu,"Lampu Tangga LED Stairs Step Hitam Putih Inwall Tanam 1.5/1,5 W 220 v",Rp28.000
elektronik,lampu,Lampu LED Murah Bohlam LED PANALED ALTIS Cahaya Putih Garansi 1 Tahun,Rp5.500
elektronik,lampu,Bohlam Pijar PIOLINE 5Watt Lampu Pijar PIOLINE 5W Super Hyper 5 - PS55,Rp2.300
elektronik,lampu,Hannochs LED NOVA 12W Cahaya Putih ( PAKET 3pcs ),Rp55.000
elektronik,lampu,PJU LISTRIK COBRA 100W / PJU 100 WATT LISTRIK COBRA / LAMPU JALAN 100W,Rp96.900
elektronik,lampu,Hannochs Lampu LED NEX 7 watt CDL - Putih PAKET 10PCS,Rp150.700
elektronik,lampu,Hannochs Lampu LED NEX 12 watt Cahaya Putih ( BELI 4 GRATIS 1 ),Rp91.000
elektronik,lampu,HK-5066/Lampu LED Strip Neon Flexible 220V IP65 WATERPROOF,Rp7.850
elektronik,lampu,Lampu Kapsul Pana Led 15w 20w 30w Putih Lampu Murah,Rp2.000
elektronik,lampu,PHILIPS LED MULTIPACK 4W 5W 6W 7W 8W 9W 10W 11W 12W PUTIH PAKET LAMPU,Rp54.745
elektronik,lampu,Lampu Philips LED Bulb MyCare Multipack 10W Putih (Paket 10 Watt 10 W),Rp120.000
elektronik,lampu,Philips Smart Wifi LED Downlight 4W Tunable BLE NEW SERIES + BLUETOOTH,Rp40.900
elektronik,lampu,Lampu LED CAPSULE HANNOCHS VARIO 6W 12W 18W 24W 30W 36W 45W 50W,Rp12.400
elektronik,lampu,Lampu LED Strip Modul Module SMD 2835 12 Mata 2.4W 12V IP67 Waterproof,Rp3.650
elektronik,lampu,IT Smart LED Bulb 9W Bluetooth - RGB 16 Juta Warna,Rp89.000
elektronik,lampu,In-Tech Bohlam LED Bulb 5 Watt - 18 Watt,Rp13.870
elektronik,lampu,Lampu Meja Belajar Lampu Baca LED / Arsitek Kerja Fleksibel Minimalis,Rp50.000
elektronik,lampu,Bohlam Emergency SURYA MAGIC Lampu Emergency Bohlam LED 9W / 12W / 18W,Rp23.500
elektronik,lampu,Osram Lampu Bohlam LED 7 Watt 5 Pcs - Putih,Rp66.000
elektronik,lampu,LAMPU TENAGA SURYA / LAMPU TENAGA MATAHARI - LAMPU SOROT SOLAR CELL,Rp85.000
elektronik,lampu,Lampu TL Neon T5 LED Tube Warna Warni GARANSI 100%,Rp14.999
elektronik,lampu,"PHILIPS LAMPU LED MYCARE MULTIPACK 12W, 10W, 8W, 6W CAHAYA PUTIH",Rp69.055
elektronik,lampu,PHILIPS DN027C G3 9W D150 6 inch Surface Mounted LED Downlight Outbow,Rp115.940
elektronik,lampu,LAMPU KABINET KITCHEN SET LED 4w 8w 12w AUDALUX,Rp39.000
elektronik,lampu,Philips Senter Led Flashlight Led Senter Police Super Terang Tahan Air,Rp198.999
elektronik,lampu,"Lampu LED MODULE SAMSUNG 12V LED MODUL 1,2W 3 MATA IP68 1,2 WATT",Rp2.250
elektronik,lampu,Lampu selang Neon Flex 12V 5 Meter 5M,Rp42.500
elektronik,lampu,Lampu Inlite Bolam LED INLITE murah 5w 7w 9w 12w 15w,Rp41.500
elektronik,lampu,Lampu Proyektor Tidur Cahaya Bintang Galaxy Astronaut Light,Rp209.000
elektronik,lampu,LAMPU LED HANNOCHS VARIO 12 WATT PUTIH 12W,Rp17.100
elektronik,lampu,Lampu LED 15W E27 Bohlam 15 Watt PANALED BULB Putih 15Watt w Pana,Rp5.350
elektronik,lampu,Philips Paket Lampu LED MyCare 12W Bulb Putih (Isi 4 Pcs)PROMO GARANSI,Rp41.000
elektronik,lampu,LAMPU KULKAS LED E12,Rp8.500
elektronik,lampu,Philips MultiPack MyCare LedBulb 14.5W 6500K Putih - Bohlam Lampu 14W,Rp176.000
elektronik,lampu,"lampu LED luby SUMO 12w,16w,22w,30w,40w LED T-BULB",Rp11.970
elektronik,lampu,LED Modul Samsung 3 Mata SMD 5730 Putih/White DC 12V IP67 WATERPROOF,Rp1.500
elektronik,lampu,"Lampu TL Neon T5 LED 18W 120cm Tube 120 cm 18 w watt PUTIH WHITE 1,2m",Rp33.500
elektronik,lampu,PHILIPS Recessed Spot LED Pomeron 7W 7Watt 7 W 7 Watt 59776,Rp79.990
elektronik,lampu,LED BULB SMART WIFI 8W PHILIPS,Rp46.759
elektronik,lampu,Lampu Tangga Dinding Taman LED Outdoor Waterproof stairs step Light,Rp169.500
elektronik,lampu,SL5031 LAMPU DINDING HIAS OUTDOOR KLASIK ANTIK FITTING E27 DEKORASI - Hitam,Rp139.000
elektronik,lampu,Lampu Tenaga Solar LED Outdoor 300W Cahaya Terang Daya Matahari,Rp220.000
elektronik,lampu,COD LED Lampu Ceilling Lampu Plafon LED 3 Warna lampu hias ruang tamu,Rp1.080.000
elektronik,lampu,Hannochs Lampu LED Nova 18W Cahaya Putih ( PAKET 3pcs ),Rp74.700
elektronik,lampu,Lampu Dinding Hias Minimalis Teras Rumah Indoor Outdoor Waterproof,Rp55.800
elektronik,lampu,Lampu PLC / PL-C 13W & 18W / 830 Warm White 2P Philips,Rp38.000
elektronik,lampu,Rel Lampu sorot spot track 1Meter Rell track LED,Rp24.999
elektronik,lampu,lampu gantung 1 set minimalis - 1 Pcs Edison,Rp18.500
elektronik,lampu,Baseus Magnetic Stepless Dimming Charging Desk Lamp Deep gray-DGXC-C0G,Rp199.000
elektronik,lampu,Tongkat Pengganti Lampu / Stick Lamp / Alat Ganti Pasang Lampu,Rp42.000
elektronik,lampu,Ruibao E14 E27 Lampu Bohlam LED Jagung Fitting 12W / Lampu Bohlam Hias,Rp8.999
elektronik,lampu,BARDI LED STRIP,Rp106.000
elektronik,lampu,Senter LED Power Bank Mini USB Recharge Anti Air Cree XM-L T6 1200mAh,Rp38.888
elektronik,lampu,LAMPU TAMAN TENAGA SURYA SOROT OUTDOOR SOLAR CELL WATERPROOF 20 LED,Rp135.000
elektronik,lampu,Lampu LED Murah berkualitas Bohlam LED,Rp3.000
elektronik,lampu,Lampu Bohlam LED E27 45w - Lampu Bohlam LED Bentuk Kipas 3 Baling,Rp18.250
elektronik,lampu,LAMPU BULB INLITE 5 7 9 11 12 WATT PUTIH PAKET 4PCS BOHLAM LED IN LITE,Rp40.300
elektronik,lampu,Lampu LED Strip 2835 RGB 5Meter Strip LED Komplit Adaptor Remote Warna,Rp24.888
elektronik,lampu,LAMPU PHILIPS SMART WIFI LED 9W 9 W WATT TUNABLE WHITE SMARTLAMP,Rp46.500
elektronik,lampu,Kabel Fitting Outdoor 10Meter 20 Fitting Gantung Lampu Cafe,Rp55.900
elektronik,lampu,HANNOCHS LAMPU LED SONIC 6W / 10W / 13W 10.000 JAM - 100% ORI,Rp47.320
elektronik,lampu,lampu led strip selang 5050 10m 10 meter lampu selang rgb warna warni,Rp50.000
elektronik,lampu,kap lampu belajar model arsitek desk lamp duduk jepit,Rp77.500
elektronik,lampu,Li-Ion Charger modul TP4056 5V 1A + Guard Combo (Modul 03962A),Rp4.500
elektronik,lampu,AOKI Lampu Bohlam LED AC/DC NEW CRYSTAL Darurat Emergency Lamp,Rp26.500
elektronik,lampu,Baterai ENERGIZER MAX Type AAA- 2+1 PCS,Rp12.500
elektronik,lampu,LAMPU CANDEL LED BOHLAM CANDEL LILIN SMD 5WATT E14 E27 PUTIH KUNING,Rp6.670
elektronik,lampu,LAMPU FILAMEN LED 4W/ FILAMEN EDISON 4W/ BOHLAM CAFE ST64 4W LED,Rp9.999
elektronik,lampu,AVARO Smart LED BULB RGB+WW 10W Smart Light BLUETOOTH For Home,Rp29.900
elektronik,lampu,PlayPanel Hexagon RGB LED Light Lamp by Press Play,Rp459.000
elektronik,lampu,promo beli 3 gratis 1 Led Sonic Hannochs hemat ekonomi 6w 10w 13w bulb,Rp43.000
elektronik,lampu,"Philips LED Stick 9.5w E27 6500K White Lampu Bulb 9.5 watt Putih 9,5 w",Rp38.900
elektronik,lampu,led neon flex dc12v all varian warna 5meter led flexiebel roll 12volt,Rp32.950
elektronik,lampu,SMD LED Chip 5730 0.5W Cool Cold /Warm White Putih Red Blue Biru Merah,Rp100
elektronik,lampu,Lampu Led Strip Selang SMD 5050 220 Volt Warm White / Kuning,Rp4.499
elektronik,lampu,200W Solar Light Lampu Panel Surya Tenaga Led Lampu Jalan Tahan Air,Rp116.430
elektronik,lampu,METERAN LAMPU LED STRIP 5050 SMD PER METER LED STRIP 5050 SMD,Rp4.600
elektronik,lampu,LED STRIP RGB 5050/2835 WARNA WARNI IP44 5m10M AC 220V+ADAPTOR+REMOTE,Rp27.000
elektronik,lampu,Lampu Led Strip Selang SMD 5050 10M 220v OUTDOOR 10 M Meter DEKORASI,Rp85.000
elektronik,lampu,"Lampu Downlight Panel LED Inbow Bulat Kotak 2 Warna 6 + 3 Watt - Putih + Kuning, Bulat",Rp35.000
elektronik,lampu,DOWNLIGHT OUTBOW MINI 3W / 5W HITAM PUTIH 3 WATT 5 WATT PLAFON CEILING,Rp14.400
elektronik,lampu,Ruibao E27 E14 Lampu Bohlam LED Jagung Fitting 12W / Lampu Bohlam Hias,Rp8.999
elektronik,lampu,SL5003 LAMPU DINDING OUTDOOR KLASIK ANTIK E27 WATERPROOF WALL LAMP,Rp145.000
elektronik,lampu,TaffLED Pocketman Senter LED USB Rechargeable XML-T6 6200 Lumens,Rp39.500
elektronik,lampu,LAMPU SOROT 50W PUTIH 30W TAMAN 20W LED 10W KUNING OUTDOOR IP65 HEMAT,Rp25.650
elektronik,lampu,PHILIPS LED PAKET 6W 8W 10W 12W PUTIH 6 8 10 12 W 3 GRATIS 1 MULTIPACK,Rp83.600
elektronik,lampu,LAMPU EMERGENCY TUBE 10SMD+1W AOKI LAMPU DARURAT AK 9988,Rp27.500
elektronik,lampu,BARDI SMART LIGHT BULB 12W RGBWW WIFI - BOHLAM LAMPU PINTAR,Rp128.000
elektronik,lampu,Senter Luby L-2673,Rp69.000
elektronik,lampu,IKEA MELODI Lampu Gantung putih 28cm Minimalis,Rp99.900
elektronik,lampu,LAMPU LED STRIP 2835 5050 RGB 5M/10M SET IP44 ADAPTOR + REMOTE,Rp29.500
elektronik,lampu,Philips LED Bulb 14.5W E27 6500K 230V Putih,Rp46.000
elektronik,lampu,Lampu TL Neon T5 LED 16w Panjang 120cm,Rp35.000
elektronik,lampu,LAMPU T5 LED TUBE LIGHT TUBELIGHT 30CM 60CM 100CM 120CM 6W 10W 18W 20W,Rp24.000
elektronik,lampu,Lampu USB Mini LED Stick 3/8 LED Emergency Lamp Reading Lamp,Rp7.599
elektronik,lampu,Tongkat Lampu 6 Jari Panjang 2m Dexicon Stick Pengganti Lampu Putar 2m,Rp33.000
elektronik,lampu,Lampu Led Bohlam Paket Hemat (BELI 3 GRATIS 1) HANNOCHS SONIC ORI,Rp46.500
elektronik,lampu,Lampu Philips Essential 5W 8W 11W 14W 18W 23W Watt Putih Cool Daylight,Rp34.000
elektronik,lampu,Lampu LED Downlight Plafon Hannochs EASY II IBR 7 Watt,Rp28.500
elektronik,lampu,LAMPU SENTER MINI COB Keychain Light Gantungan Kunci LED Rechargeable,Rp18.000
elektronik,lampu,Lampu PHILIPS Spotlight Pomeron 7W 7watt 7 W 7 Watt 59776 Original,Rp79.550
elektronik,lampu,Mini USB Light Lampu Tidur Lampu Baca USB,Rp810
