base_type,type_,text,price
elektronik,lampu,LAMPU LED ANGKA 0-9 SIMBOL LOVE HATI WARM WHITE DEKORASI PESTA BAGUS,Rp3.320
elektronik,lampu,LED SOROT 50W Flood light Lampu FLOODLIGHT tembak 50 w watt outdoor LC,Rp53.900
elektronik,lampu,Lampu LED SMD PCB Aluminium AC 220V 220 Volt Round Bulat,Rp3.000
elektronik,lampu,PHILIPS LED ESSENTIAL PAKET 7W 9W 11W PUTIH (7 9 11 W WATT) MULTIPACK,Rp54.745
elektronik,lampu,Lampu Downlight LED PHILIPS Eridani G2 3W 7W 10W 14W 22W Putih Kuning,Rp33.150
elektronik,lampu,LAMPU LED BULB 15W 15 W 15WATT 15 WATT INLITE 4000K 4000 K SEMU,Rp34.000
elektronik,lampu,PHILIPS MyCare LEDBulb 10W Lampu Bohlam 10 W My Care LED Bulb 10 Watt,Rp39.500
elektronik,lampu,lampu emergency sunsafe ajaib 9watt - Putih,Rp35.000
elektronik,lampu,Philips LED pack 4 watt beli 3 gratis 1,Rp82.500
elektronik,lampu,lampu sorot Led 100 watt outdoor kap sorot 100w lampu tembak,Rp22.500
elektronik,lampu,lampu LED slim downlight 12watt 12w in lite warm white/kuning,Rp43.559
elektronik,lampu,PCB LED AC 9w new BM,Rp7.650
elektronik,lampu,"SAMSUNG LED Modul SASO IP68 SMD 5730 DC 12v 1,5 watt 1,5w 3 mata KOREA",Rp2.178
elektronik,lampu,Lampu Tricolour LED Hannochs 10W lampu 3Warna 10watt lampu led bulb,Rp21.000
elektronik,lampu,Lampu LED Bulb Philips MyCare 4 6 8 10 12 W Watt Putih E27 6500K,Rp20.990
elektronik,lampu,PHILIPS Ceiling LED 31110 Moire 17W 1100lumen - 33x33cm,Rp305.000
elektronik,lampu,PHILIPS Recessed Spot LED 59776 Pomeron 7W White,Rp98.000
elektronik,lampu,LED BULB PANASONIC 13W 13 W 13WATT 13 WATT,Rp33.700
elektronik,lampu,lampu selang led strip neon flex waterproof 50m 50 meter 220v outdoor,Rp525.000
elektronik,lampu,LAMPU BOHLAM TAKASIMURAH 15W BULB T LED MURAH HEMAT ENERGI 15W 10W 5W,Rp2.950
elektronik,lampu,Lampu Bohlam LED DC 12v 5w 10w 15w 20w 25w/LAMPU AKI,Rp7.000
elektronik,lampu,Lampu dinding minimalis fitting holder E27,Rp25.000
elektronik,lampu,LAMPU SERVICE JEPIT 60 LED / LAMPU SERVICE JEPIT 60 LED 1 SET,Rp70.000
elektronik,lampu,Hannochs Click & Dim 10 watt / Hannochs 1 Lampu 3 Jenis Watt,Rp21.000
elektronik,lampu,LAMPU TEMBAK SOROT LED 50W/100W/200W OUTDOOR FLOOD LIGHT LED ALITECO,Rp57.500
elektronik,lampu,Lampu Tidur Led 1 Watt Warm White Kuning Fitting Colok Bulp Non Phili,Rp18.987
elektronik,lampu,COD LAMPU DOWNLIGHT LED 3 WARNA 6WATT/PANEL LED/LAMPU PLAFON 6Watt,Rp410
elektronik,lampu,lampu tenaga surya untuk rumah,Rp19.500
elektronik,lampu,Lampu Meja / Lampu Hias / Lampu Tidur - Cute,Rp99.800
elektronik,lampu,"PHILIPS Eridani G2 DL190B 7W LED6 D100 4"" - LED Downlight Integrated",Rp50.450
elektronik,lampu,Dekorasi Lampu Tidur Anak Crystal Ball Lamp Solar Sistem Tata Surya,Rp58.900
elektronik,lampu,Hannochs Downlight LED Symphony 12 watt CDL - Putih,Rp49.700
elektronik,lampu,Kap Fitting Lampu Gantung Besi E27 Model A1 CHROME,Rp21.000
elektronik,lampu,Philips Smart Wifi LED Downlight 4W - Tunable White (Putih),Rp44.800
elektronik,lampu,LAMPU LED STRIP SELANG 5050 SMD AC 220V METERAN (1M-100M) OUTDOOR,Rp4.250
elektronik,lampu,HATTASU lampu LED sorot tembak SNI 10 20 30 50 100 200 300 500 W WATT,Rp21.100
elektronik,lampu,ACE - Apa Bohlam Led 9 Watt - Cool Daylight,Rp17.900
elektronik,lampu,CENTRALITE Lampu LED Nella 3W 5W 8W 10W 13W 15W 18W 20W 30W,Rp6.640
elektronik,lampu,PHILIPS LAMPU LED BULB 4W 4 W WATT BESAR PUTIH /KUNING / NATURAL 4000K,Rp24.800
elektronik,lampu,Lampu Jalan Tenaga Surya 3 Modes lampu tenaga surya otomatis outdoor,Rp29.900
elektronik,lampu,PHILIPS Meson 59466 Multipack 17W 6 inch D150 - isi 3 bh LED Downlight,Rp213.150
elektronik,lampu,Lampu Bohlam Bulb Led Rumah 3w 3 watt 5w 5 watt 7w 7 watt 9w 9 watt,Rp8.100
elektronik,lampu,"Lampu Bohlam LED Sonic 3w,5w,7w,9w,12w,15w Hannochs CoolDayLight",Rp9.100
elektronik,lampu,ACEVIVI Bunga Mawar Lampu LED Dekorasi Beauty and The Beast Rose,Rp55.250
elektronik,lampu,LAMPU BHOLAM PIJAR SUPER HYPER 5 5 WATT LUMMENT E27 Cahaya kuning,Rp2.900
elektronik,lampu,Kap Lampu Jalan PJU waterproof LED outdoor fitting E27 + TIANG KABEL,Rp58.900
elektronik,lampu,Lampu Led Sonic Hannochs 3 watt hemat ekonomis sonic 3w,Rp8.900
elektronik,lampu,Lampu Oven Tungsram 40W E27 Tahan Panas 300 Derajat,Rp52.500
elektronik,lampu,Grosir LED Bulb Centralite 3W 8W 10W 13W 15W 18W 20W Watt Putih,Rp9.300
elektronik,lampu,Hannochs LampU Bolam Led 12 Watt Premier,Rp30.000
elektronik,lampu,Lampu Downlight / Spotlight LED Murah 7w 7watt - 3000k / 4000k / 6500k,Rp20.000
elektronik,lampu,Lampu Sorot Plafon LED 7w 7 watt / Spot Light COB Murah Spotlight MR16,Rp44.800
elektronik,lampu,LAMPU DINDING DEKORASI TEMPEL MINIMALIS CORRIDOR 3 - 6 W,Rp43.200
elektronik,lampu,Hannochs Lampu LED NEX 9 watt Cahaya Putih,Rp19.700
elektronik,lampu,Lampu Hannochs PLC 4U 45 Watt,Rp60.850
elektronik,lampu,LED Flashlight Senter LED Joyko FL-91,Rp39.330
elektronik,lampu,LAMPU LED STRIP SELANG 5730 SMD AC 220V DOUBLE LED OUTDOOR AND INDOOR,Rp7.500
elektronik,lampu,Lampu Jalan PJU 100w / 100 w / led kap pju 100 watt cobra Led,Rp188.000
elektronik,lampu,KRISBOW Lampu LED Putih/Kuning 3/5/7/9/11 Watt Paket 5 pcs Original,Rp86.900
elektronik,lampu,Lampu LED RGB Bar Strip Spectrum Audio Indicator Music Sound Control,Rp49.000
elektronik,lampu,"lampu halogen kacang osram 12v 10w, 20w, 35w dan 50w",Rp18.000
elektronik,lampu,lampu taman led / halaman / sorot led / outdoor led 3w 3watt tancap,Rp24.000
elektronik,lampu,"Philips Lampu LED 13Watt, 13 Watt, 13W, 13 W (1Paket Isi 4Pcs)",Rp37.450
elektronik,lampu,lampu tenaga surya untuk rumah Lampu jalan surya otomatis lampu taman,Rp215.000
elektronik,lampu,LAMPU LED BULB 3W 3 W 3WATT 3 WATT LUXEN,Rp8.500
elektronik,lampu,PHILIPS TL-D TLD 18W/54 18 W WATT LAMPU NEON 60 CM,Rp18.200
elektronik,lampu,Lampu inlite LED Bulb 15W 15 watt Natural White 4000K E27 1417lm SNI,Rp38.000
elektronik,lampu,Booklite Energizer / Lampu baca buku (Gratis Baterai CR2032 2 pcs),Rp90.300
elektronik,lampu,"Lampu LED Bulb ACE Putih/Kuning 3, 5, 7, 9, 12, 15, 18, 24 Watt E27",Rp11.845
elektronik,lampu,LAMPU LED TINTIN 30 WATT PROMO,Rp10.084
elektronik,lampu,Lampu Led LANCAR PREMIUM 5w 7w 9w 12w 15 w 18Watt 21 Watt Garansi 1Th,Rp5.850
elektronik,lampu,CENTRALITE LED Bulb Nellla Classic 3W 5W 8W 10W (Grosir),Rp7.900
elektronik,lampu,HPL High Power LED Epistar Epiled Chip COB Biji Mata 1W 1 Watt White,Rp1.300
elektronik,lampu,MYLED PLATINUM 5W 10W 15W 20W 30W/5Watt 10Watt 15Watt 20Watt 30Watt,Rp3.200
elektronik,lampu,"Philips LED Bulb Mycare 4w, 6w, 10w, 12w warna SEMI PUTIH 4000K",Rp30.150
elektronik,lampu,Lampu Ecolink 3 Free 1 LED Bulb Multipack 10W Putih - 10Watt 10 Watt,Rp67.000
elektronik,lampu,Led+pcb hpl 1 watt 3 watt 5 watt emiter super bright lampu senter cob,Rp1.700
elektronik,lampu,Philips Led Pack Paket 3+1 Multipack MyCare LED Bulb 6 Watt 6500K,Rp99.000
elektronik,lampu,Lampu LED Downlight ceiling plafon kantor rumah inbow bulat 12w 18w,Rp26.000
elektronik,lampu,HPL LED 1W 3W 5V DENGAN PCB,Rp2.500
elektronik,lampu,HOUSING LED BAR/LED STRIP/RIGID BAR ALUMINIUM @DOVE COVER 1m,Rp14.500
elektronik,lampu,Lampu LED Bulb MORGEN Grand 18W E27 220V,Rp22.222
elektronik,lampu,DOWNLIGHT PANEL LED UNILUX 12 W INBOW BULAT PUTIH CDL 220V 6500K,Rp28.800
elektronik,lampu,PHILIPS LAMPU LED MULTIPACK 10W MYCARE 10 WATT PUTIH PAKET 3 GRATIS 1,Rp115.659
elektronik,lampu,Lampu Led Api 9 Watt 9W / Lampu Dekorasi Cafe / Led Flame Fire,Rp23.500
elektronik,lampu,lampu blitz e27 strobe light flash lamp e27 lampu blizt e27 strobo e27,Rp30.000
elektronik,lampu,"Grosir LED Centralite Nella 3w, 5w, 8w, 10w, 13w, 15w, 18w, 20w",Rp7.900
elektronik,lampu,Lampu sorot RGB 10w 20w 30w 50w RGB. Floodlight tembak RGB 10watt SNI,Rp59.900
elektronik,lampu,Philips Lampu Smart WiFi LED 8W With Bluetooth - Color and TW (Warna),Rp54.800
elektronik,lampu,philips ufo 15w,Rp65.000
elektronik,lampu,Lampu LED Emergency Darurat Isi Ulang USB 30W 60W 80W Indoor Outdoor,Rp31.900
elektronik,lampu,ECOLINK Lampu Bohlam 12W LED Bulb Multipack 12Watt Beli 3 Free 1 Putih,Rp105.000
elektronik,lampu,BROCO Fitting Plafon Lux Bulat Putih 12101,Rp26.900
elektronik,lampu,Lampu LED Downlight Eridani G2 3.5 7 10 14 22 W Watt Natural 4000K,Rp38.900
elektronik,lampu,Lampu LED Click and Dim Dimmer Hannochs 10 Watt 3 warna Putih,Rp21.500
elektronik,lampu,Keychain Light Super Terang Senter Keychain Mini Senter LED Carabiner,Rp15.500
elektronik,lampu,Lampu Halogen Stik 150W 150 watt kiso,Rp5.800
elektronik,lampu,LAMPU LED HANNOCHS VARIO 12WATT,Rp16.000
elektronik,lampu,Baterai Ultrafire Baterai SWAT 99000 mAh Recharger BARU,Rp5.999
elektronik,lampu,LAMPU SOROT / TEMBAK LED SLIM 50WATT / SLIM LED FLOODLIGHT 50W AC 220V,Rp25.000
elektronik,lampu,Lampu LED Philips RadiantLine Multipack LEDBulb 11 Watt,Rp102.000
elektronik,lampu,FITTING GANTUNG E27 WATERPROOF/FITTING KHUSUS PEMBIAKAN WARNA-WARNI,Rp5.800
elektronik,lampu,Lampu Dinding Klasik Hias rumah Minimalis 5007,Rp33.700
elektronik,lampu,FITTING JERMAN E27 FITTING DRAT DOUBLE RING FITTING GANTUNG CAFE HIAS,Rp5.440
elektronik,lampu,Lampu LED hannochs genius emergency / magic ac dc 8w 8 watt w,Rp67.000
elektronik,lampu,Hannochs Lampu LED NEX 3 watt CDL 3pcs - Putih - Paket Murah,Rp31.700
elektronik,lampu,THE AMAZE NIGHT LAMP / LAMPU UNIK KEREN ORIGINAL TH2810,Rp47.000
elektronik,lampu,LAMPU FILAMEN LED 4W/ FILAMEN EDISON 4W/ BOHLAM CAFE ST64 4W LED,Rp7.200
elektronik,lampu,Lampu Philips Radiantline multipack LEDbulb 11 watt 6500k,Rp99.000
elektronik,lampu,Lampu led Ecolink 8 watt harga murah promo,Rp13.500
elektronik,lampu,Hannochs Lampu LED Revo 40 watt cahaya Putih,Rp63.500
elektronik,lampu,Philips Lampu Smart Wifi LED 9 Watt - Tuneable White,Rp162.000
elektronik,lampu,Led 5mm putih+kuning/merah/hijau/biru,Rp135
elektronik,lampu,BROCO FITTING PLAFON SEGI PERSEGI CREAM 1210 - TERSEDIA HARGA GROSIR,Rp9.000
elektronik,lampu,Fitting E27 Cabang 3 Bohlam Lampu Studio Extension Adapter Converter,Rp17.500
elektronik,lampu,INLITE / IN-LITE Led Bulb Bohlam 5W / 7W/ 9W / 12W / 15W - 3 GRATIS 1,Rp39.000
elektronik,lampu,Lampu Led Sonic Hannochs 15 watt hemat ekonomis sonic 15w,Rp26.200
elektronik,lampu,LAMPU LED PHILIPS ESSENTIAL 3 5 7 9 11 13 watt 3w 4w 5w 7w 9w 11w 13w,Rp9.700
elektronik,lampu,LAMPU LED LUXCO A BULB ASHTA 3-22 WATT COOL DAYLIGHT,Rp11.250
elektronik,lampu,Lampu LED Downlight PHILIPS Kuning Warm White 3000K,Rp38.900
elektronik,lampu,Lampu Philips Mycare 6w pack beli 3 gratis 1 Putih,Rp89.000
elektronik,lampu,Paket Lampu Sorot 20W 1 set isi 3 + Rel 1M Track Light Rel Spotlight,Rp278.000
elektronik,lampu,Philips Led Pack Paket 3+1 Multipack MyCare LED Bulb 8 Watt 6500K,Rp110.000
elektronik,lampu,PHILIPS MyCare LEDBulb 12W Lampu Bohlam 12 W My Care LED Bulb 12 Watt,Rp48.000
elektronik,lampu,PANALED Premium Lampu LED Bohlam Cahaya Putih / LED Bulb White Light,Rp5.900
elektronik,lampu,Converter Lampu Fitting E27 ke Fitting E14 Fiting Over E 27 E 14,Rp3.120
elektronik,lampu,Adaptor Sambungan Fitting Lampu E27,Rp5.350
elektronik,lampu,Lampu lantai taman spotlight led mr16 waterproof outdoor,Rp132.300
elektronik,lampu,Lampu PHILIPS LED Bulb MultiPack 8W 10W 12W 8 10 12 Watt 6500K Putih,Rp69.900
elektronik,lampu,INLITE Downlight Panel Slim LED Inbow 12W Bulat INDS602R,Rp41.500
elektronik,lampu,LAMPU HANNOCHS VARIO 30WATT,Rp35.700
elektronik,lampu,CMOS EMERGENCY LAMP HK-86,Rp183.000
elektronik,lampu,"Lampu Led Selang 2835 Natural White 4000k 144led,strip selang led 220v",Rp14.500
elektronik,lampu,Lampu Led Capsule Luby Diamond 24 Watt Cahaya Putih,Rp26.600
elektronik,lampu,Philips Downlight Outbow DN027C LED D150 11 Watt,Rp115.000
elektronik,lampu,Lampu LED 18 Watt Myvo Classic Bulb Putih,Rp15.500
elektronik,lampu,Motion Sensor HANNOCHS 13w Lampu Led Sensor Gerak Hannoch 13watt 13,Rp47.999
elektronik,lampu,"KAP DOWNLIGHT PHILIPS FBS115 FBS 115 5 INCH 5"" FITTING E27 putih",Rp89.000
elektronik,lampu,Lampu LED 5w 5 watt Tintin Tin Tin Lampu murah lampu capsule,Rp3.250
elektronik,lampu,Lampu Downlight COB 5w 5 w 5 watt Sorot Spotlight Led Spot Garansi,Rp17.500
elektronik,lampu,"LED BULB PHILIPS 3W, 4W, 6W, 8W, 10W, 12W KUNING WARM WHITE",Rp70.800
elektronik,lampu,3M Lampu Hias Lebaran Dekorasi Idul Fitri EID Mubarak Ramadan LED,Rp98.975
elektronik,lampu,Refil Modul TL Ring Led Lampu Plafon/Baret Lampu LED Ceiling 12-36 wat,Rp24.500
elektronik,lampu,Tongkat Pengganti Lampu PX Stick Pasang Ganti Bohlam LED PLC SPIRAL,Rp31.490
elektronik,lampu,In-Lite Lampu Emergency LED + Hanger + Battery INBE007,Rp99.510
elektronik,lampu,Lampu LED Paket Philips 10W Putih isi 4 Promo LED 10 W MyCare 10 Watt,Rp125.000
elektronik,lampu,Lampu LED Bohlam Garansi MYVO KINGS 50 Watt Termurah Garansi 1 Tahun,Rp39.199
elektronik,lampu,"Lampu led downlight philips DN027C G3 9watt 6"" dn027c 9w",Rp140.000
elektronik,lampu,Senter Lampu SURYA SYT L101 / Emergency Lamp/ Lampu Darurat,Rp27.000
elektronik,lampu,lampu sorot tembak jalan led 50w 100w 200w 300w 400w VALESCOM,Rp52.500
elektronik,lampu,BOHLAM LAMPU HALOGEN OSRAM H3 12V 55W,Rp15.900
elektronik,lampu,STROM Lampu LED 12W Sensor Cahaya Bohlam white 12 w watt Bulb PUTIH,Rp38.500
elektronik,lampu,Lampu LED Bohlam MYVO KINGS 30 Watt Murah Garansi,Rp22.000
elektronik,lampu,Lampu tembak Kap sorot Halogen 1000w 1000 watt komplit dengan lampu,Rp118.000
elektronik,lampu,LED STRIP 3528 12V IP33 INDOOR warmwhite putih hijau biru merah kuning,Rp20.500
elektronik,lampu,LED NEON FLEX RGB WARNA WARNI 16 WARNA DIJUAL METERAN,Rp39.000
elektronik,lampu,Hannochs Lampu Bolam Led 9 Watt Premier,Rp23.500
elektronik,lampu,Lampu jalan 50w pju 50 watt led cobra led 50w 50 watt,Rp115.000
elektronik,lampu,Hannochs Lampu LED Premier 30 watt - cahaya Putih,Rp79.700
elektronik,lampu,Bohlam emergency SX 28 watt pegang nyala,Rp16.250
elektronik,lampu,PHILIPS LED ESSENTIAL MR16 3W-35W 36D 100-240V,Rp36.630
elektronik,lampu,PHILIPS LAMPU LED BULB 3W 3 W WATT PUTIH KUNING,Rp18.450
elektronik,lampu,Lampu sorot Led - Flood Light Hinomaru 50 watt - Putih,Rp95.000
elektronik,lampu,Lampu meja belajar duduk fleksibel,Rp32.000
elektronik,lampu,PHILIPS LED TUBE ECOFIT 1200MM 16W 765 T8 TL LED 16 WATT 16 W 16W,Rp43.598
elektronik,lampu,LED MURAH EKONOMIS PANALED 5W,Rp2.680
elektronik,lampu,"Lampu Led Philips MyCare 6w, 8w, 10w, 12w Multipack | Putih",Rp59.500
elektronik,lampu,Lampu Philips LED Trueforce Tforce 30 Watt Putih,Rp95.839
elektronik,lampu,lampu taman bulat 10 inch 25 cm outdoor indoor MEVAL,Rp99.500
elektronik,lampu,Terminal Sambungan Jepit 2 Jalur/Quick Connect 2 Wire Connector,Rp500
elektronik,lampu,Lampu Led LUBY Capsule 5w 10w 14w 18w 24w 38w Putih / Bohlam Led,Rp10.075
elektronik,lampu,LAMPU RELL TRACK LAMPU SOROT TRACK LIGHT SPOTLIGHT 10W/15W/20W/30W,Rp39.500
elektronik,lampu,Lampu LED VARIO 12w Hannochs led prisma hanochs vario 12watt,Rp16.600
elektronik,lampu,Lampu Led Bohlam Emergency Magic Cas Sentuh 12w 15w 18w 22w,Rp24.900
elektronik,lampu,Lampu Pioline LED ALPHA 10W,Rp4.100
elektronik,lampu,bohlam halogen h11 std 12v 55 w philips 12362 c1 (57883),Rp72.200
elektronik,lampu,Silicone Tube / Selang karet For LED Strip IP65 width 10mm,Rp4.800
elektronik,lampu,Lampu LED Tabung 5W/10W/15W/20W/25W/30W Bulb Jumbo/Lampu Kapsul/Bohlam,Rp3.750
elektronik,lampu,CENTRALITE LED Bulb Nella Classic 13W 15W 18W 20W (Grosir),Rp12.500
elektronik,lampu,Lampu Tidur 4 LED Night Lamp + Sensor Cahaya (Kuning) - Meval,Rp63.000
elektronik,lampu,Rechargeable LED Flashlight Senter LED Isi Ulang Joyko FL-84,Rp164.500
elektronik,lampu,Gantungan Kunci Lampu LED Multifungsi/Keychain Light COB Rechargeable,Rp19.750
elektronik,lampu,Philips Smart Wifi Led Bulb 8W Tuneable,Rp43.900
elektronik,lampu,Lampu Master Hpit Plus 400w Philips,Rp220.000
elektronik,lampu,PHILIPS LAMPU LED ESSENTIAL 3W 5W 7W 9W 11W 13W PUTIH KUNING ESS ORI,Rp15.395
elektronik,lampu,LAMPU OUTDOOR DINDING TERAS / INDOOR LAMPU DINDING MINIMALIS MODERN,Rp85.000
elektronik,lampu,LED Strip Light roll 2835 12W 12V 120 mata Warm White 4000K Putih 120L,Rp32.950
elektronik,lampu,ECOLINK LED Bulb | 6W 8W 10W 12W Watt | Cool Daylight | 6500K | Putih,Rp15.980
elektronik,lampu,PAKET 10 Pcs Lampu LED Hinomaru Premier 10 Watt Cahaya Putih,Rp61.250
elektronik,lampu,Set Lensa HPL +Holder Bracket Case 23mm LED Convex Lens Fokus Sudut 60,Rp1.350
elektronik,lampu,Lampu led 3 warna cahaya putih kuning waram white 12wat 16watt,Rp9.800
elektronik,lampu,Lampu Led Emergency / Bohlam Emergency Led AC/DC Lampu Darurat,Rp23.999
elektronik,lampu,Lampu Taman Tenaga Surya - Solar Cell Terpisah - Sensor Gerak 56 LED,Rp89.400
elektronik,lampu,SUNSET LAMP / LAMPU SUNSET LED / LAMPU EFEK MATAHARI / 25WARNA,Rp27.000
elektronik,lampu,AOKI Lampu LED Magnet Dinding Serbaguna Rechargable USB tombol sentuh,Rp49.800
elektronik,lampu,Lampu Philips LED 13 WATT 13WATT 13W 13 W (1 Paket isi 4 pcs),Rp39.000
elektronik,lampu,PHILIPS Eridani G2 DL190B 14W 14W 14Watt 14Watt,Rp72.880
elektronik,lampu,Philips lampu smadt WIFI LED 13W 13 Watt With Bluetooth-Tunable White,Rp63.963
elektronik,lampu,Senter Tactical Flashlight 2000 Lumens LED Flash Light Senter LED Cree,Rp34.760
elektronik,lampu,Lampu LED Spot Light Spotlight Cob Dowlight Sorot Panasonic 3 watt 3W,Rp43.000
elektronik,lampu,LAMPU LED 45 WATT JUMBO KAPSUL ORION BERGARANSI MURAH,Rp35.000
elektronik,lampu,Tiang Lampu Stainless Steel/Tiang Lampu Jalan/Tiang Lampu Teras,Rp175.000
elektronik,lampu,Lampu LED Kawat Warm White Lampu Hias LED Baterai Lampu Tumblr,Rp2.000
elektronik,lampu,Hyderson UV Senter 12 LED Lampu Hitam 395nm Ultra Violet Hitam Lampu,Rp49.500
elektronik,lampu,INLITE LAMPU SOROT Tembak Flood in-Lite LED VALUE Outdoor 10W 10 Watt,Rp45.555
elektronik,lampu,Spare part Bohlam Lampu LED Base E27 ulir drat tebal Bulb,Rp800
elektronik,lampu,Lampu LED Sensor Cahaya 5 6 9 11 Hannochs / Meval / Surya 5w 6w 9w 11w,Rp12.500
elektronik,lampu,LAMPU DOWNLIGHT LED PHILIPS ERIDANI G2 DL190B 14W 14 WATT W 6 INCH,Rp70.200
elektronik,lampu,Fitting Lampu LED E27 dengan Sensor Gerak Infrared PIR 110-240V,Rp54.500
elektronik,lampu,Hannochs Lampu LED Alfa 12 watt CDL 4 pcs - Putih,Rp92.700
elektronik,lampu,lampu LED Hannochs 5 Watt SONIC,Rp10.750
elektronik,lampu,Fitting Gantung Hitam Broco 216L,Rp4.100
elektronik,lampu,Philips Multipack LEDBulb 14.5W E27 6500K 230V Putih,Rp175.000
elektronik,lampu,AOKI Senter Multifungsi 10W+50SMD POWER BANK AK 6691,Rp168.000
elektronik,lampu,Lampu INLITE Kap Tube LED T8 52W INTE002 120CM Intergrated 2 Model,Rp98.333
elektronik,lampu,3set Lampu Sorot Cafe Track light LED 7watt E27 Rel 1Meter Halogen LED,Rp188.000
elektronik,lampu,Lampu Dinding Taman Outdoor / LED Wall Light Minimalis SK SUNLED,Rp72.500
elektronik,lampu,ULTRON Fiting Sambungan Lampu Downlight - Fitting Holder Lamp E27,Rp5.500
elektronik,lampu,LAMPU PIJAR DOP BOHLAM DOP HYPER 5W LAMPU AYAM ECER,Rp2.500
elektronik,lampu,Refil Isi Lampu LED Ceiling 12-36 watt Modul TL Ring Led Lampu Plafon,Rp24.500
elektronik,lampu,LAMPU HIAS LED 3D / LAMPU TIDUR HIAS DIMENSI 3 WARNA PUTIH KUNING WARM,Rp25.000
elektronik,lampu,Bohlam Lampu LED 30W Jumbo Capsule SUNSONIC,Rp8.900
elektronik,lampu,[KHUSUS GOJEK GRAB] Lampu Philips TL LED BN015C Set 16W Ecofit LEDTube,Rp82.900
elektronik,lampu,Lampu LED 50Watt Bohlam LED 50W Murah Garansi 1 Tahun SCORE Capsul,Rp35.402
elektronik,lampu,PHILIPS LAMPU LED UFO 15W E27 65K 240V (PUTIH),Rp72.009
elektronik,lampu,Fitting Fiting Downlight E27 bahan keramik - porcelain tahan panas,Rp2.250
elektronik,lampu,Lampu Spotlight E27 3W 7W Sorot LED 3/7 Watt Warm White/Natural/Putih,Rp17.999
elektronik,lampu,Fitting Sambungan Downlight e27 Lamp Adapter 9.5cm Fitt Extention 95mm,Rp4.700
elektronik,lampu,PHILIPS LED Flood Light BVP150 LED90 PSU 100W SWB G2 GM 220-240V,Rp899.000
elektronik,lampu,LAMPU BOHLAM/BOLAM DYMA 15W VALUE BULB T LED HEMAT ENERGI 15W 10W 5W,Rp2.900
elektronik,lampu,BOHLAM LAMPU LED SUKASUKA 5W SUKA SUKA 5 WATT CAPSULE ASLI TERMURAH,Rp3.050
elektronik,lampu,lampu neon flex 2835 strip led selang flexible merah biru hijau pink,Rp8.999
elektronik,lampu,"lampu led essential 3w, 5w, 7w, 9w, 11w, 13w philips",Rp18.000
elektronik,lampu,LUMIRS Kabel Socket EASY Install Lampu LED Strip Selang SMD 2835 Soket,Rp12.900
elektronik,lampu,LED PHILIPS Sorot BVP150 10Watt 10 Watt 10W 10 W Flood Light IP65,Rp116.200
elektronik,lampu,1 psc lampu led 20 watt vonic,Rp5.400
elektronik,lampu,Lampu Led Shinyoku 12 Watt Putih,Rp21.650
elektronik,lampu,LAMPU JALAN 50W / LAMPU JALAN 100W / LAMPU JALAN 150W / PJU KOBRA LED,Rp105.000
elektronik,lampu,Fitting lampu jerman German E27 e 27 hitam,Rp5.610
elektronik,lampu,Bohlam beam 230 watt 7r Bohlam beam 230w 7R,Rp350.000
elektronik,lampu,Fitting Jambu / Dop - Keramik Type E27,Rp2.750
elektronik,lampu,Pin Soket Socket Jarum Neon Flex Lampu LED Strip Selang 5050 Dan Tutup,Rp799
elektronik,lampu,PHILIPS SPOTLIGHT SPOTLED KYANITE 5W 5 WATT 59752,Rp69.012
elektronik,lampu,sambungan led strip 5050 connector / konektor fitting led to led,Rp4.050
elektronik,lampu,Lampu Tanam Tangga LED Persegi Minimalis ADX-525SF 3W AUDALUX IP65,Rp55.000
elektronik,lampu,Lampu Philips LED 19W Putih Cool Daylight 6500K (19 Watt W) Grosir,Rp74.495
elektronik,lampu,DOWNLIGHT OUTBOW 6W 6 W 6WATT PANASONIC warna : PUTIH / KUNING,Rp78.800
elektronik,lampu,GARDEN LAMP LAMPU TAMAN COB 5W LAMPU SOROT COB LAMPU TANCAP,Rp28.975
elektronik,lampu,Lampu kulkas myvo 3 watt E14 PUTIH - lampu bohlam E14 KULKAS,Rp7.350
elektronik,lampu,Lampu Philips SITRANG Putih 5w 8w 11w 18w 23w,Rp25.500
elektronik,lampu,mata lampu sorot led 50watt / chip lampu tembak 50w cob trafo 50 w,Rp25.000
elektronik,lampu,Senter LUBY L2673 / Senter Cas Luby L-2673 Led Rechargeable Handlight,Rp67.500
elektronik,lampu,Lampu Philips LED [PACK] Bulb 12W E27 6500K 230V A60-MyCare (PROMO),Rp145.000
elektronik,lampu,lampu hias led strip RGB 3528 /5050 smd warna warni 5m/10m remot,Rp33.500
elektronik,lampu,Lampu LED Hannochs Sonic 20 watt cahaya putih,Rp33.500
elektronik,lampu,Ruibao E27 E14 Lampu Bohlam LED Jagung Fitting 12W / Lampu Bohlam Hias,Rp8.999
elektronik,lampu,LAMPU T5 REFILL 4W 6w 8W 64 6 8 WATT BLB ULTRAVIOLET UV MONEY DETECTOR,Rp13.000
elektronik,lampu,L013 2A LAMPU DINDING TAMAN WATERPROOF MINIMALIS PILAR PAGAR OUTDOOR,Rp124.500
elektronik,lampu,Raket Nyamuk Cas/raket nyamuk rechargeable/CAHAYA CA-6001,Rp28.666
elektronik,lampu,LAMPU REFILL TL-5 T5 ESSENTIAL 14W 865 840 830 - PHILIPS,Rp32.700
elektronik,lampu,Hannochs Nova 30w 30 Watt Lampu LED Bohlam,Rp40.000
elektronik,lampu,LAMPU OUTDOOR SOROT LED UNTUK TAMAN / HALAMAN 3 & 5 WATT PUTIH KUNING,Rp24.888
elektronik,lampu,Lampu Rotary Lamp LED EWIG N1101A-J 3 Voltase/3 Model Lampu/3 Suara .,Rp75.000
elektronik,lampu,EZMODE Bulb E27 Flourscent Lamp CFL 45W - 5500K,Rp75.000
elektronik,lampu,PAKET SENTER XM-L2 8000 LUMENS MC,Rp44.900
elektronik,lampu,Fiting Colok + Saklar Harga Grosir,Rp2.900
elektronik,lampu,Philips Lampu Senter LED / Senter Police Swat Flashlight Super Terang,Rp180.000
elektronik,lampu,Lampu TL T5 LED 30cm /60cm/90cm/120cm | Lampu TL LED LANBO,Rp20.500
elektronik,lampu,Fitting Gantung Keramik WD / Fiting WD E27,Rp5.000
elektronik,lampu,Fitting Gantung Bohlam Lampu Saklar Fiting Socket + Panjang Kabel 5 M,Rp10.499
elektronik,lampu,lampu led bulb ACE 12 watt putih,Rp16.400
elektronik,lampu,PAKET SUPER MURAH BELI 3 GRATIS 1 LAMPU LED INLITE 12 WATT INB007,Rp76.500
elektronik,lampu,LED downlight panel DN020B PHILIPS 15watt inbow 220vac,Rp82.400
elektronik,lampu,Lampu LED Surya Vega 5w/7w/9w/12w/15w/18w Bulb Cahaya Putih,Rp10.000
elektronik,lampu,Hannochs Downlight LED Panel Click & Dim 12W IBR Cahaya Putih,Rp56.700
elektronik,lampu,HPL 3W + PCB SUPER BRIGHT SEMUA WARNA 3WATT HPL LED,Rp1.800
elektronik,lampu,Lampu Bohlam LED 9W/12W/15W/18W Putih / Kuning Warm White Garansi SNI,Rp12.499
elektronik,lampu,paket 15w 3pc+1pc merk in-lite cahaya putih lampu led bulb inlite 15w,Rp92.000
elektronik,lampu,( KEYCHAIN ) Lampu Senter mini LED Tahan Air Gantungan Kunci Magnet,Rp16.500
elektronik,lampu,Philips Lampu LED Bulb Essential 3W 5W 7W 9W 11W 13W Watt Putih Grosir,Rp19.200
elektronik,lampu,Senter jarak jauh senter 4 mata senter camping senter 4 LED,Rp22.500
elektronik,lampu,MYLED PLATINUM 5W 10W 15W 20W 30W/5Watt 10Watt 15Watt 20Watt 30Watt,Rp3.200
elektronik,lampu,PHILIPS LIFEMAX TL 36W 54 765 PUTIH T8 TL-D 36 W WATT TLD NEON 36WATT,Rp19.900
elektronik,lampu,Lampu Led Strip RGB 10M 2835/5050 IP65 Waterproof 2 CABANG LENGKAP,Rp50.000
elektronik,lampu,Paket Lampu LED 12 Watt Rakitan Polos - Rakit Satu Set Lampu LED,Rp12.800
elektronik,lampu,LAMPU PIJAR CHIYODA / LAMPU BOHLAM CHIYODA 5W 15W 25W 40W,Rp5.400
elektronik,lampu,Chip LED 1860 15W 3C Putih MCP CSP HeadLight DayMaker Projie Dakar 9V,Rp13.160
elektronik,lampu,"PHILIPS Downlight LED DN020B G3 10,5W 10,5Watt 10.5W 10.5Watt 10,5 W",Rp69.700
elektronik,lampu,lampu sorot led 200w 200 watt lampu led floodlight lampu tembak 200 w,Rp90.000
elektronik,lampu,Lampu Led Pack 5W 7W 9W 12W 15W promo beli 3 gratis 1 Inlite kuning,Rp42.000
elektronik,lampu,Senter Mini XPE COB Led Zoom Super Terang Swat Police Light Recharge,Rp12.750
elektronik,lampu,Bohlam LED Lampu ARASHI MAGIC II Emergency Lamp 9W 12W 18W,Rp25.500
elektronik,lampu,Lilin Lampu Dekorasi Lebaran Ramadhan,Rp15.000
elektronik,lampu,lampu Model Sorot Tembak LED Slim Flood Light waterproof SMD 50W putih,Rp18.900
elektronik,lampu,MORGEN LAMPU TL T5 LED 5 WATT 30CM 9W 60CM 14 W 90CM 18WATT 120CM,Rp22.500
elektronik,lampu,Tongkat Alat Pengganti pasang Lampu Stik Bola Lamp. Bohlam Led Stick,Rp29.990
elektronik,lampu,"PHILIPS Eridani G2 DL190B 10W LED8 D125 5"" - LED Downlight",Rp62.090
elektronik,lampu,Lampu sorot led/ Lampu Tembak led 100w watt 100W putih dan warm white,Rp64.350
elektronik,lampu,Lampu LED INLITE Bulb Tabung Kapsul INBC002 50W E27 220V,Rp74.000
elektronik,lampu,PAKET 3X Philips Smart Wifi LED Downlight 9W - Tunable White (Putih),Rp173.280
elektronik,lampu,Lampu LED USB Mini Bulat / Lampu Baca Tidur Travel Portable Night,Rp838
elektronik,lampu,COVER LED ALUMINIUM PROFILE LED STRIP CHANEL LED STRIP COVER 1 METER,Rp15.500
elektronik,lampu,LAMPU LED PAKET INLITE BULB / BOHLAM 5W 7W 9W 12W 15W INB007,Rp40.300
